,place,date,category,place ,Tagline,Review 
154,Antelope_Flats,Oct 2016 , Family,"Jackson, WY ",Settlers of the Hole,I usually visit this place several times a month all year long. It's has some awesome views shots of the Teton Range in it's whole. It also offers a huge variety of wildflowers (mostly during the months of July-August). It has in the past had several big herds of Bison that would reside here during the summer months. It's called Antelope Flats because of the vibrant herds of the Pronghorn Antelopes that graze here.
155,Antelope_Flats,Aug 2017 , Family,"Tampa, FL ",Beautiful drive,"We were advised to try a quick drive through Antelope Flats so we did. Of course, we got the iconic Mormon barn with the Tetons in the background pictures, but there are more things to see. We branched off on to the side roads that went into the hills and got several good pictures. We saw small deer that were grazing not more then 20 ft from the road. There was also a western looking ranch with beautiful horses."
156,Antelope_Flats,Sep 2016 , Couples,"Newport, OR ",Along the Teton Scenic Loop 42 mile drive,"This is a great stop along the Scenic Loop Drive south of Yellowstone. Nice photo opportunity. Get the gypsy ap for the Tetons, which include detailed info. of this area and place."
157,Antelope_Flats,Aug 2017 , Family,"Dallas, TX ",Early to rise gets the amazing photographs!,We visited Mormon Row on Antelope Flats Road during the day and at dawn. There is no comparison. The dawn is magical as the first light hits the Tetons and these buildings. Well worth the early wake up. Check your weather the night before to ensure best photos.
158,Antelope_Flats,Aug 2017 , Solo,"New York City, NY ",Bring Your Camera,"If you are looking for great pics to frame on your wall when you go home, this is the place. There are a mountains in every direction and a variety of old buildings."
159,Antelope_Flats,Aug 2017 , Couples,"Howell, NJ ",Antelope Flats is a Must!,"Exploring Antelope Flats is a must STOP on a trip to Jackson,Wy. Not only is it a good area to scout for wildlife, but how can you not make a stop to see the Moulton Barns!  The T.A. Moulton Barns are the iconic landmark of Jackson Hole and the Teton Mountains. You just can't leave without at least one picture!"
160,Antelope_Flats,Jun 2017 , Couples,"Davenport, FL ",What a scenic tour w. wildlife and History,"The majestic beauty matched with the history was breath taking. We saw a two prong horn , ground squirrel, and nesting birds. A nice side trip was quiet and pretty."
161,Antelope_Flats,Aug 2017 , Friends,"sandy springs, United States ","rent a bike , gaze at the mountains","rented bikes at Noonan's(?) and road to the area, nice and flat and kinda windy, iconic views of the Grand Teton. a beautiful area"
162,Antelope_Flats,Jun 2017 , Family,"Bixby, OK ",Icons area for photographers,"We always visit the flats because I am a photographer and I always find plenty of bison, antelope and elk to photograph. We have seen coyotes too. Easy ti drive thru and stop to take photos."
163,Antelope_Flats,Jul 2017 , Couples,"Concord, NC ",PIcturesque Barns,What a beautiful area in the Grand Tetons! It is a must see stop along the Grand Teton Loop. We had a picnic under one of the trees!! A must see!!
164,Antelope_Flats,Aug 2017,not available,"Greenfield, IN ",Better than pictures,"We had a great guide that shared a lot of history of this area. We saw elk, bison, antelope, and badgers. Outstanding! This is a must for your visit to Jackson."
165,Antelope_Flats,Jul 2017 , Family,"San Francisco, CA, ",Don't miss it! Photographer's dream location,"COOLEST location for photography in the Grand Tetons. Amazing old houses on Mormon Row and the famous barn. Well worth it- not at all far from the main road. And, it is NOT a long dirt road as some had warned."
166,Antelope_Flats,Aug 2017 , Couples,"Indianapolis, IN, ",Take a beautiful drive,"Such a great place for a drive. Beautiful views of the Tetons and wildlife interspersed throughout the scenery. If you have a bike, that would be the primo way to travel through the flats."
167,Antelope_Flats,Jul 2017 , Couples,"Houston, TX ",Get Your Teton Barn Shot Here,"A broad flat area just east of the Teton mountain front, home of the iconic Teton barn photo. Easily accessible from the main north-south road. Mormon Row is a long line of derelict houses and barns built by Mormon pioneers from the first half of the twentieth century. Less than half of them are still there. The park service provides a guide and free tours. Fascinating history. Go in the early morning to get the best light. Oh, there are plenty of pronghorn antelope around."
168,Antelope_Flats,Jul 2017 , Couples,"Sebastian, FL ","Beautiful, uncrowded","Go early morning or late in the day for best chance of seeing animals - this is a drive one, not hike. Great photo ops, bring binoculars"
169,Antelope_Flats,Jul 2017 , Family,"Pinehurst, NC ",Iconic Barn/Buildings for Photographs,"This is where you can find the Moulton Barn and 'Mormon Row', with the Tetons in the background. Very interesting history. You're also likely to see pronghorn here, and frequently a bison herd"
170,Antelope_Flats,Jul 2017 , Family,"Baton Rouge, LA ",Mountain bike ride through Antelope Flats,Had a great time seeing this area on mountain bikes. A lot of cool things to see and beautiful surrounding and sites.
171,Antelope_Flats,Jul 2017 , Solo,"Jackson, WY ",Super Photo Op Spot,Great Views in All Directions So Bring Your Camera and Enjoy . Also often Fabulous Bison / Antelope Photo Ops .
172,Antelope_Flats,Jul 2017 , Family,"Auburn, CA ",The Tetons barn picture!,If you want to re-create the pictures you have seen of the historic barns with the Tetons in the background...this is where they are. Easy drive in off of 191 or a gravel drive off of Shadow Mountain Drive.
173,Antelope_Flats,Jul 2017 , Couples,"Santa Monica, CA ",Good photo op,The Mormon barn imaged above is a very photogenic place to visit. We enjoyed shooting lots of photos there.
174,Antelope_Flats,Jun 2017 , Solo,"Martinez, GA ",A must see!,Rode into Antelope Flats looking for antelope but what I saw was some of the most beautiful scenery. This is a great place to take pictures so have your camera ready.
175,Antelope_Flats,Jun 2017,not available,"Dayton, OH ",Iconic photo spot,"Even if you're not into history or old buildings, trying to snap a photo of these iconic old buildings set against a dramatic backdrop of the Grand Tetons is a fun, free experience when you're in the area. Even if you don't get the buildings, the views of the Tetons from here are the best!"
176,Antelope_Flats,Jul 2017 , Couples,"Texas Gulf Coast, TX ",Outstanding Place to View Tetons and See Bison,"Home On the Range, right here. Spring Wildflowers, Summer Sage, and home to a bison herd! Area where the western movie ""Shane"" was filmed...historic settlement. But you can't beat the majestic Teton views!! Especially at sunset...Top area of Jackson Hole!"
177,Antelope_Flats,Jul 2017,not available,"West Hartford, CT ",Great vantage points,Worth the small detour off the highway to get to these special views... just make sure you have the time as the traffic sill slow you down.
178,Antelope_Flats,Jul 2017,not available,"Minneapolis, MN ",Beautiful spot,We biked from Jackson 30 miles round trip. A trek but beautiful views all along the way. Look for antelope and buffalo enroute
179,Antelope_Flats,Jul 2017 , Family,"Houston, TX ",Scenery to take your breath away,"Antelope Flats and the area around it are simply amazing. The view of the Tetons, with the probably most photographed barn in the US in the foreground is amazing.    There were antelopes and bison just off the road when we were there - including a giant male bison in the bachelor herd that was easily a few hundred pounds larger than any of the rest of them.    Pay attention - not everything is a huge animal. We stopped to look at the flowers and saw a red fox just 20 feet off the road. Our presence didn't seen to bother it as it continued to hunt ground squirrels (and we got to watch its leaping hunting method and saw it come up with a ground squirrel after a few attempts)."
180,Antelope_Flats,Jun 2017 , Family,"Burlington, NC ",Scenery - WOW!,"I had been to the Tetons a couple of times before, but this was my first visit to Antelope Flats. This is the place they take photos of the Tetons that you see everywhere. I need to visit in the fall when the aspen trees are golden."
181,Antelope_Flats,Jun 2017,not available,"Matthews, NC ",Amazing Place,Even if you are just a novice photographer this is must stop for some amazing picture opportunities.
182,Antelope_Flats,Jun 2017 , Family,"East Bridgewater, MA ",Famous Moulton Barn,"As a photographer, this was one of my top picks while visiting the Tetons. I was so excited to photograph such an amazing barn with it's beautiful surroundings."
183,Antelope_Flats,Jun 2017 , Couples,"Jersey City, NJ ",Off the beaten path but not too far,"You feel a million miles away from Jackson Hole when you venture off onto Antelope Flat Road. Drive into the hills and then a long stretch of fields (occasionally--depending on the time of day--strewn with bison and antelope or pronghorn deer; we even saw a wolf!). You can visit the historic houses of Mormon row, or just keep on driving a relate and enjoy the scenery. Somewhere around the turnoff for the Science center is a big stretch where you can park and look out onto the Tetons (well, you can't miss them anywhere from Jackson, but this is a goos spot to get reflective about them!). And there were deer and lost of damsel flies and teams of technicolor moths just hatched! Great little find if you take your time going through it."
184,Antelope_Flats,May 2017 , Family,"League City, Texas, United States ",Interesting history,Great place to see historical homes And learn about the areas history. Can only imagine waking up to that view every day.
185,Antelope_Flats,Jun 2017 , Couples,"Lutz, FL ",The mountain's mirror,"In the valley of the Tetons, this gem reflects the power of the mountain in its many wildflower species, various insects among the sage, and the occasional peek at a pronghorn antelope. Peace and tranquility!"
186,Antelope_Flats,Jun 2017 , Family,"Huntersville, NC ",Buffalo & Amish,"We enjoyed looking at the old homesteads and took some amazing pictures. We did see buffalo, at a distance, and a ton marmots.  We are glad we took this side trip."
187,Antelope_Flats,Jun 2017 , Family,"Tupelo, MS ",Beautiful views,We went here based on recommendations that the Moulton barn was the most photographed barn in America. I understand why now. The view was spectacular. It is worth the drive out.
188,Antelope_Flats,May 2017 , Family,"Pensacola, Florida, United States ",What a beautiful piece of property - the views! The history!,"We visited Mormon Row in Antelope Flats in May 2017. I thoroughly enjoyed reading the history of the property, and then walking around and looking at the irrigation ditches, the houses and the other buildings. It was a bucket-list item to see the Moulton Barn live and in person, if you will. The views of the mountains and the nearby butte were just spectacular. I highly recommend a visit to this area for anyone going to Yellowstone, the Grand Tetons or Jackson, WY."
189,Antelope_Flats,Jun 2017 , Couples,"Payson, AZ, ",Iconic View of the Grand Tetons,"If you don't go here, you've missed the most photographed area of Jackson and the Grant Tetons. Go for sunrise and get the Mormon Row barns in your shot. If you're lucky, a bison will come into your shot at just the right moment!"
190,Antelope_Flats,May 2017,not available,"Hillsborough, NH ",Beautiful part of Americana,"We loved driving through this part of Jackson, and stopping to take pictures. In fact we went back a second day during the magic hour to take more photos."
191,Antelope_Flats,May 2017 , Couples,"Weymouth, UK ",Pleasant drive,A loop road near Grand Teton National Park. Good views of mountains and the sage brush flats. Only saw 1 pronghorn but that's wildlife for you!
192,Antelope_Flats,May 2017 , Family, ,Stunning Views!,"Visited Mormon Row on the Antelope Flats with 2 couples and 2 children! The kids had fun being able to wonder around and see all of the prairie dogs, while the adults had the opportunity to capture some pictures of the breathtaking views of the Tetons! Will return to this area in the future!"
193,Antelope_Flats,Apr 2017 , Couples,"Benalla, Australia ",Two Aussies on road tour,The tourist info centre suggested we take this drive which we did on 18 April 2017. Mid afternoon a herd of 150 bison crossed the road the herd consisted of calves to yearlings to cows and bulls. Along with some 6 cars we stopped waited and got some great photos. Also walked around the remains of the Mormon settlement. It's a must visit area probably around 2 hrs trip if you see animals. Lot little marsupials around the Mormon buildings popping their heads up or running to their next burrow.
194,Antelope_Flats,May 2017 , Couples,"Pocatello, ID ",Moulin Barn,Everyone is very familiar with photos taken at Moulin Barn with the Tetons in the background. Early morning with first light hitting the peaks is best. Many other photo opportunities unless you are into old barns.
195,Antelope_Flats,May 2017 , Couples,"Alpharetta, Georgia, United States ","Beautiful, peaceful, historic setting","Located north of Jackson, this beautiful setting, called Mormon Row, features the historic Moulton barn & several other structure - pictures of which are often seen in magazines. The informational sign provided details of the history of the area. We drove here leaving Jackson heading north, turned off @ Gros Ventre Jct around to Antelope Flats, heading west back to the main road (191). Scenery was peaceful, there were only a few visitors around the barns . . . . but lots of 'gophers' scurrying about. The Grand Teton backdrop was breathtaking."
196,Antelope_Flats,May 2017 , Couples,"Dallas, OR ",Lots of history,Mormon Row is here. Lots of old house and out buildings still standing showing the migration of the Mormons to this area.
197,Antelope_Flats,Apr 2017 , Couples,"Green Bay, WI ",Good place for National Park photos,"Historic barns are a common photo shoot location Sunset is nice, bring your filters, leave your drones at home. The twice we were there, it was not very crowded."
198,Antelope_Flats,May 2017 , Couples,"Redwood City, CA ",Old Homestead,Stopped by to take pictures of these very old buildings. There were about 3-4 buildings with a view of the Grand Tetons which were absolutely breath-taking. You could just imagine what life back then was like.
199,Antelope_Flats,May 2017 , Couples,"Montreal, Canada ",A real highlight - go at sunrise!,"Don't miss the drive around Antelope Flats and Mormon row early in the morning! You will be out there with the expensive guided safari type tours, and the animals, and the view, and not many other people. In the spring we saw lots of elk and moose. The photo ops for the famous mennonite barn with the fresh snowfall on the Tetons in the background were really special!"
200,Antelope_Flats,Sep 2016 , Family,"Christchurch, New Zealand ",History and Bisons what more do you want?,Great place to take a drive and see all the historic barns that are scattered around; we were also lucky enough to come across a herd of Bison with their young! We were careful not to get too close (stayed well behind another tour guides truck)!
201,Antelope_Flats,Sep 2016 , Family,"Rigby, ID ",Buffalo Heaven,I always visit the antelope Flats area each time I visit Jackson. I am always guaranteed a beautiful view of the Tetons and the iconic barn. There are always lots of buffalo in the area and a visit to Kelly hot springs to view the fish is a bonus.
202,Antelope_Flats,Jun 2016 , Business,"Jackson Hole, WY ",The most photographed barns in America,Well I worked in the TV and film industry and we photographed at the Barnes all the time on antelope Flats. It is a place to see and the amazing view from this area is breathtaking. Also you'll see hundreds and hundreds of bison around the barns got to make this one of your stops because everybody else does .
203,Antelope_Flats,Aug 2016 , Couples,"Jacksonville, FL ",Historic shots,Ok...this is one of the most photographed places in the Tetons. We shared the shots with several photography classes. Worth the Drive? Yes. It's also called Mormon Roe.
204,Antelope_Flats,Sep 2016 , Couples,"Colorado Springs, CO ","1890-1910 era buildings, great scenic Teton backdrops","Only 1 mile off the Hwy, very interesting spot, and you have a chance at seeing Buffalo and pronghorn. While we were out in the area, a herd of about 300 Buffalo calmly walked by--right by us (closest within 30 yds). Go see it!"
205,Antelope_Flats,Sep 2016 , Couples,England ,An interesting drive - bison herd,We have driven this way before but this year a large herd of bison crossed in front of us. It was a pleasant drive and we saw Pronghorn too.
206,Antelope_Flats,Nov 2016 , Couples,"Birmingham, AL ",4 Bull moose hanging together,Beautiful area as always . We usually see bison here but didn't this time . However we did see 4 large bull moose just hanging out not far off the road . There are couple of cows not far away . We have only been here barely 24 hours and have seen more moose than we ever do in fall. I am excited to see what he rest of week holds . We got more fresh snow last night which helps to see them . Unlike in the fall when we usually come and they blend in .
207,Antelope_Flats,Oct 2016 , Couples,"Fort Myers, FL ",Wonderful Scenery,Well worth a visit to Molten Barn for great photographs.The free range bison also roamed nearby and added an up close and personal view of the wildlife.
208,Antelope_Flats,Oct 2016 , Couples,"Idaho Falls, ID ",One of those iconic western scenes,When you see pictures of this part of the world Antelope flats is always included. Worth the drive to say you have been there.
209,Antelope_Flats,Jun 2016 , Friends,"Dallas, TX ",Iconic Photographic Location of Mormon Row Barns,If you are a photographer then this spot is on your list of places to check out. I was in a photography workshop and this was one of our 4:30 am spots to set up and wait for the sunrise on the mountains. It is simply breath-taking.
210,Antelope_Flats,Sep 2016 , Business,"Boulder, CO ",Overdone,"Years ago, no one seem to know where Mormon Row was located - the Park Service was even ready to tear all of the buildings down to restore the area to its 'natural state' - they seemed to overlook the fact that there was a lot of history also being destroyed - fortunately, smarter folks prevailed and now it is on the bucket list of every photographer who can access the internet... I counted 26 photographers lined up ready for the sun to pop over the ridge - but then again, it is still an awesome sight to see and though way overdone, still makes a nice photo."
211,Antelope_Flats,Sep 2016 , Couples,"Toms River, NJ ",Attractive,This is a very attractive and rustic place to visit on your way to Teton or Yellowstone National parks. It is a deserted homestead with a house and barn. It is a great place for pictures with the Teton mountains in the background. Sometimes there are bison on the property.
212,Antelope_Flats,Oct 2016 , Family,"Highlands Ranch, CO ",Gotta see the Mormon Row and Moulton barns!,They are famous in the movies and countless tourist photos and videos. A true must-see attraction when you visit Grand Teton National Park!
213,Antelope_Flats,Sep 2016 , Friends,"Chatham, MA ",Visit both Mormon Row and the Nearby Salt Ponds,"Mormon Row with it's houses and iconic Moulton Barn is a delightful bit of 19th and 20th century Americana. Go further in to Antelope Flats, turn left on Moose Wilson Road, and check out the salt ponds and surrounding fields with beautiful views of the Grand Teton. In this area, we saw river otter, moose, mule deer, various ducks, and an osprey fishing for trout. Really terrific!"
214,Antelope_Flats,Oct 2016 , Couples,"Henderson, NV ",need to go on a sunny day,"Certainly picturesque but you really need a sunny day to capture a good photo. You also need to get there early, ahead of the many others/bus loads of visitors who make it difficult to photograph. Not a good road, lots of pot holes."
215,Antelope_Flats,Oct 2016 , Solo,"East Hampton, NY ",Spot the buffalo!,Best place for spotting buffalo and Mormon Row is worth a visit. Moulton Barn is purportedly the most photographed barn in the country.
216,Antelope_Flats,Oct 2016 , Couples,"Leawood, KS ",An Ionic Photo Spoiled by a Slow Moving Wedding Party,"Every photographer wants to get a great shot of Antelope Flats...but if there's a wedding party that seems to linger forever in the middle of the scene, it's pretty tough. I don't think I would return for another attempt...not worth it."
217,Antelope_Flats,Sep 2016 , Couples,"Arlington, TX ",That famous barn!,We stopped at Mormon Row in Antelope Flats so I could take photos of the famous Moulton Barn. The weather changed several times during our trip and we ended up going back to the barn several times so we could get photos with the different weather/sky background. An iconic and hauntingly beautiful scene.
218,Antelope_Flats,Oct 2016 , Couples,"Marion, IA ",Interesting History,Our tour guided stopped here so we could see the homestead and read about it's history. I can't imagine how cold it could have been in that cabin during the long Wyoming winter's!
219,Antelope_Flats,Sep 2016 , Couples,"Paducah, KY ",Great view,"Yes, it is widely photographed, but that is because it is has a great view of the Tetons from the vintage buildings."
220,Antelope_Flats,Aug 2016 , Family,"Montclair, NJ ",Stunning views and historic place not to be missed!,Stunning views and historic place not to be missed! We came here as a stop with the Jackson Wildlife Safari tour.
221,Antelope_Flats,Sep 2016 , Couples,"Philadelphia, TN ",NORTHWEST AND CANADIAN ROCKIES TRIP,"We drove Mormon Row and took photos of the famous barn with the Grand Tetons in the background. Saw a few Pronghorns, When we were here in 2015, saw lots of Buffalo, but none this trip."
222,Antelope_Flats,Sep 2016 , Family,"Raleigh, NC ",In the footsteps of Ansel Adams,"So every photographer was there. And rightly so, as the views of the Tetons is fantastic from here. Big skies, open plains, mountains - you can't go wrong with either a smart phone or an expensive camera. It's really easy to get to."
223,Antelope_Flats,Sep 2016 , Couples,"Chicago, IL ",Beautiful,A park ranger in Grand Teton told us to come to Mormon Row to see the famous barn and soak in the views of the Tetons. She told us to take this unpaved road from the south to get there from Jackson and I would not recommend doing that unless you have a 4 wheel drive car. The road was long and very bumpy. We did see a herd of bison grazing on the pasture so that made the trip worth it. But once we got to Mormon road we realized there was a nicely paved road to get to it from the North side instead of the unpaved road from the South.    Mormon row is very small but a great side trip and worth the quick visit.
224,Antelope_Flats,Sep 2016 , Business,"Chicago, IL, ",Nice views,The views across the high grass fields up the the mountains are amazing. I saw a couple buffalo. But the real selling point is the views. I thought it was a great spot.
225,Antelope_Flats,Jun 2016 , Couples,"Pine Island, MN ",Gorgeous view,We came here twice because the view of the Tetons was incredible from this location. There are lots of wildflowers and prairie dogs in the area that are fun to see.
226,Antelope_Flats,Sep 2016 , Solo,"ATLANTA, ",Great place for sunrise photos.,Visit the Mormon Barns for sunrise if you feel up to it or at least before noon if you don't make it for sunrise.
227,Antelope_Flats,Sep 2016 , Friends,"La Q, California ",Historic farm houses and lots of animals.,Our visit to the Grand Tetons would not have been complete without our visit to antelope flats. We drove there 3 times and there were always Bison and Prong horn deer to see. We also made our attempt to capture the beauty of the old farm houses with the scenic mountains in the distance.
228,Antelope_Flats,Sep 2016,not available, ,Make sure you have good weather,"Stopped to get the ""best shot ever"" but clouds were so low and mixed with smoke from the fires. Pictures were not as good as I had hopped. If you can get it, it's a nice place to stop."
229,Antelope_Flats,Sep 2016 , Couples,"Fort Worth, TX ",Bring Your Camera!,"Antelope Flats is a photogrpher's dream. The beauty of the surroundings is breathtaking. While there you may also see mountain bluebirds, hawks, and coyotes."
230,Antelope_Flats,Sep 2016 , Couples,"Hong Kong Island, China ",Very nice for scenery and wildlife,We visited this area as due to low cloud the Tetons were not visible - thus cancelling some of our planned photo stops.    We however were not disappointed.
231,Antelope_Flats,Sep 2016 , Couples,"Cincinnati, OH ",Good Oppprtunity to see wildlife,"Large wide open area and very scenic drive. If you want to see wildlife in the area, be sure to drive this at dawn or dusk."
232,Antelope_Flats,Aug 2016 , Family,North Carolina ,Absolutely Beautiful!!!,Driving to Mormon Row is a must if you're in the Tetons. The view is so beautiful. It's easy to get to also.
233,Antelope_Flats,Sep 2016 , Solo,"Sedona, AZ ",Picture Central,close to town; great view of Tetons; interesting to see the irrigation ditches the mormons dug. wonder if it could use an interpretative Ranger presence -- did not try to see inside of any of the buidlings.
