,place,date,category,place ,Tagline,Review 
81,Antelope_Flats,Nov 2018 , Business,Springdale ,Always love visiting the barns,"However, I am upset about the number of wedding and posed photography that goes on at the barns - the photographers park in the road and take over the entire place for hours at a time. Some times there is more than one wedding in a day and people who traveled from all over the world to visit these icons of GTNP, can't get a photo. There should be a limited schedule that can be published and the weddings should take place at high noon when there are few visitors to the area."
82,Antelope_Flats,Sep 2018 , Couples,"Florence, KY ",One of the Most Popular Photographs Taken,This area is all flat in the valley. The Mormon Barn is probably one of the most recognized photos taken. There is also a lot of wildlife in the area. Saw lots of prawn horn and popular moose watching area was nearby even though we did not see them. Classic piece of history.
83,Antelope_Flats,Jul 2018 , Family,"Costa Mesa, CA, ",Beautiful Area,"We drove through here on a whim, not exactly knowing what to expect. Glad we decided to cut through here. This is a beautiful location with some great photo opportunities. Didn't see a whole lot of wildlife on our trip as we visited about 3:00 PM but it was worth the drive just for the scenery."
84,Antelope_Flats,Sep 2018 , Family,"Charlotte, NC ",Great photo ops,Lots of bison and the Grand Teton views are beautiful. It is fun to drive around and see all the beautiful scenery.
85,Antelope_Flats,Oct 2018 , Couples,"Nashville, TN ",Outstanding photo opportunities,"We were part of a Landscape Photography Workshop by Joe Brady, and Antelope Flats was one of our stops. The scenery is breathtaking!"
86,Antelope_Flats,Oct 2018,not available,"Chicago, IL, ",One of the most epic locations in America,"A visit to Grand Teton National Park in northwestern Wyoming isn't complete without a trip to Antelope Flats, one of the most epic locations in the American West with views of the entire Teton Range and abundant wildlife. This 640-acre stretch of land was established to preserve critical habitats and migration routes for a variety of species. It also provides visitors with a taste of the Old West, complete with old homesteads and spectacular mountain views. From Jackson, drive north on Highway 189. After you pass Moose Junction (the entrance to Grand Teton National Park), you will see Blacktail Butte on your left. Drive a bit further and just beyond the butte you will see a right hand turn which is Antelope Flats Road. After several miles you will come to a junction with several structures on your left and a dirt road on your right. The structures are abandoned homesteaders' barns and houses from the turn of the 20th century, part of the famous Mormon Row barns. Take the dirt road another mile and you will find the T.A. Moulton Barn, one of the most famous in the world. Antelope Flats Road can be linked up to the Gros Ventre-Kelly Road for a big loop. This will take you through the small town of Kelly and along the Gros Ventre River. It's a great way to see moose, bison, pronghorn antelope, badgers, coyotes, the largest elk herd in the West, raptors and much more, a photographer's dream."
87,Antelope_Flats,Oct 2018 , Friends,phoenix ,it's not where you think it is,"it was cold. I'm from Phoenix. I didn't get out. But the 'Mormon' row, eh, why bother? The REAL barn is across the street, not where the cluster of buildings is. For me, what's the point? You can't go inside. But, there's a road across from here, there is a private residence on it. DRIVE SLOWLY, don't kick up the dust for them to clean. Just past it, it says, '4 wheel drive recommended'. Not when it's dry. No washboard, gravel, but smooth and cuts off a ton of miles from going around. And it's the path less taken. Isn't that what travel is all about?"
88,Antelope_Flats,Sep 2018 , Couples,"United Kingdom, ",A piece of history preserved,"Known particularly for Mormon Row, the collection of old farm buildings, Antelope Flats is more than this and if you drive the roads there's a chance of seeing Bison and Pronghorn as we did on our way to Gros Ventre.    Mormon Row however is well worth a stop. You can park at one end and walk the road and drive the other side, although 4WD is recommended beyond the last house. One of the houses is now a B&B but the others are in various states of repair - none can be visited within which is a shame.    If you're lucky you can get fantastic views of the buildings with the jagged peaks of the Tetons behind - unfortunately there was a wildfire creating smoke across the mountains the days we were there."
89,Antelope_Flats,Aug 2018,not available,"East Brady, PA ",Mormon Row,"Early pioneering Mormon families settled in the region near Jackson, WY, called Mormon Row, were the close knit families farmed and raised their children. Their life and history is depicted on information panels on the site. Breathtaking vistas of the Grand Teton range are visible from the homesteads."
90,Antelope_Flats,Sep 2018 , Friends, ,Mormon Row,Such a historic and beautiful site. We visited with the aspen trees in full bloom and it was truly a place of beauty.
91,Antelope_Flats,Sep 2018 , Friends,"New York City, NY ",Prototypical big sky landscape with jagged peaks behind,We enjoyed visiting the historic area known as Mormon Row. The autumn weather was glorious. Very near to downtown.
92,Antelope_Flats,Sep 2018 , Couples,"West Hartford, CT ",An Iconic View,"Everyone has seen photos othe this barn and it backgound of soring mountains. While were were there a large wedding party was doing their photo shoot. Just a cool view,"
93,Antelope_Flats,Sep 2018 , Couples,"Mesa, AZ ",Great Photo Opportunities,"A short drive off the main highway brings one to Mormon Row, an area of historic homesteads. For the photographer morning light seems best. The brilliant mountains make a great backdrop for the perfectly lit barns. Antelope Flats is also a good place to see bison and pronghorn. Drive about a mile south on the newly reopened Mormon Row Road to Gros Ventre Rd and follow it back to the highway for a chance to see moose along the river. The Gros Ventre Campground is a great place to see the moose."
94,Antelope_Flats,Sep 2018 , Couples,"Linthicum Heights, MD ",Scenic,"You have to drive Antelope Flats - best in the evening. Not only will you get some amazing scenic photos, you may see some pronghorn deer or a herd of bison. We also saw animals in this area."
95,Antelope_Flats,Sep 2018 , Couples,"Plano, United States ",Interesting historic buildings and good wildlife viewing,We took a half day tour which stopped in this area. The historic buildings were interesting to see but you couldn't go in them. We saw quite a few buffalo here and some pronghorn as well.
96,Antelope_Flats,Jun 2018 , Couples,"Manitou Springs, CO ",Pure Heaven!,So worth the drive in. There are no words to describe the beauty & peace. I feel blessed to have had the chance to go there
97,Antelope_Flats,Aug 2018 , Friends, ,Mormon Row is the star attraction here,"Mormon Row is the reason why people come to the Antelope Flats Road. There is nothing else to see in Antelope Flats. For more information on Mormon Row, see the Tripadvisor entry for Mormon Row Historical District."
98,Antelope_Flats,Sep 2018 , Couples,Tennessee ,My Best Photo on my trip,This area is off the beaten path in the Tetons but is worth finding. We had a beautiful blue sky day and this was our best photo from our trip. You have a simple little barn with these majestic mountains behind it and plenty of blue sky — wow! What a picture! There are some gravel-ly roads to get here but slow driving works fine.
99,Antelope_Flats,Sep 2018 , Couples,"Canandaigua, NY ",One location you don't want to miss,The perfect time to visit Antelope Flats is early morning just as the sun is coming up. The beautiful glow of the sun shining on the barn is quite spectacular. It's quite a special place and the perfect location for photos.
100,Antelope_Flats,Aug 2018 , Couples,"Collierville, TN ",Cool,"Very cool, nice short drive, not too off the beaten path. Great picture spot! ...and not far from Schwabackers Landing, where we saw 2 Bull Moose in the stream eating."
101,Antelope_Flats,Jul 2018 , Couples,"New Orleans, LA, ",Piece of History,Easy short drive down Antelope Flats. Very picturesque. You can also take in Mormon Row in the same drive.
102,Antelope_Flats,Aug 2018 , Family,"York, PA ",Beautiful views of the Tetons,"This is easily accessible, also known as Mormon row. Site of many iconic pictures of the mountains. There are a few houses to look at. You can't go inside but there are some great picture taking opportunities. Not much else to do here except take photos."
103,Antelope_Flats,Jul 2018 , Family,"Edinburgh, UK ",Iconic view of Tetons,My son and I got up at sunrise to go here and photograph the iconic view with the barns in the foreground. It did not disappoint. Well worth going!
104,Antelope_Flats,Aug 2018 , Family,"Springfield, MO ",Iconic Picture,You have to drive through Antelope Flats to take the picture of the old barn with the Tetons in the background. This is a iconic picture from Jackson. It's a gorgeous sight you won't want to miss.
105,Antelope_Flats,Aug 2018 , Couples, ,Worth the time to visit,"This is an interesting place for wildlife and pioneering. To realize the size of the community that inhabited the Mormon Row area and the sacrifices that occurred there was awe inspiring. While visiting, we even saw a large bison wander through the site. Quite exciting! Set in the backdrop of the Grand Tetons the area is quite beautiful."
106,Antelope_Flats,Jun 2018 , Family,"Florence, SC ",One of the do not miss places in the Grand Tetons,I had seen many pictures of the buildings and landscape of Antelope Flats and was looking forward to seeing the area in person. It did not disappoint. The landscape with the Tetons in the background is amazing. The barns and old homes are interesting and serve as remarkable subjects for photos. It is worth a good hour to roam around the area and soak in the majesty of the landscape and try your hand at capturing a few great pictures of the barns and other structures. It is a must see for anyone visiting Grand Teton National park.
107,Antelope_Flats,Aug 2018 , Family,NoCal ,The road less travelled,"If you're looking for perfect vistas, few cars, and lots of history and nature, take the Antelope Flats road off 89, and start at Mormon Row. We rode bikes from there, but you can drive as there are a number of well paved roads in the area. You are not as close to the Tetons as other turn-outs, but you'll be enjoying some amazing views and historic landmarks almost alone."
108,Antelope_Flats,Jul 2018 , Family,"Mesa, AZ ",You can See Why,"Most visitors to Grand Teton National Park only see the Tetons on there way to Yellowstone. However, there are many hidden gems to be seen in Grand Teton National park. Antelope Flats is one such gem. The flats is a rugged but beautiful place. You can see in quiet reflection why settlers from the East would arrive here and put down roots. They have left a rich history and heritage in the place. Take a few minutes drive off the main road to see and experience this place. Better yet, take a few days to experience the riches of Grand Teton"
109,Antelope_Flats,Jun 2018 , Family,"Adelaide, Australia ",Evening & sunrise - one of the best places to visit,"Been to the Tetons 3 times - always come out here for Sunrise or Sunset - always love it. Missed the wildflowers this year which truly add to the magic, but its magnificient nonetheless. Even if your not into photography & dont want to get ""that"" shot its just beautiful out here."
110,Antelope_Flats,Jul 2018 , Couples,"Marietta, Georgia ",Quiet and reflective,This was by far the best part of the trip for me. You can see the old barns and houses of the past and see awesome views of the Tetons. Not a lot of visitors so you can sit and stay as long as you want. The stars at night make the trip here worth it
111,Antelope_Flats,Apr 2018 , Family,Texas ,The best viewpoint for the Tetons.,"If you drive north out of Jackson 15-20 miles you will find Antelope Flats, where you will find a Mormon Settlement, and this old barn with the Tetons as a background. Continue on the road and you might see hers of elk, wolves and other critters."
112,Antelope_Flats,Jul 2018 , Couples,"Rockwall, United States ",Beautiful scenery,Loved driving through the area. Lots and lots of wildlife. In addition to the bison and pronghorn antelope we got to see a moose and even saw a wolf! The beautiful barn on Mormon Road makes a great photo op in the morning with the sun shining on it.
113,Antelope_Flats,Jul 2018 , Couples,"Los Angeles, CA ",An absolute must see,Off the beaten path but totally worth it to experience the barns on Mormon row. T.A. Mouton's famously painted and photographed barn is a must see.
114,Antelope_Flats,Jul 2018 , Family,Alexandria ,Pretty place to take a picture,"Or, a pretty place to take a picture of people taking pictures. Or, a pretty place to take a picture of people taking pictures of people taking pictures. Also lots ground squirrels."
115,Antelope_Flats,Jul 2018 , Couples,"Manchester, CT ",Yellowstone Vacation,The area had two location of old farm houses and barns. I take a lot of barn pictures. You can get the Grand Teton Mountains in the picture which is great. ( I saw this in a local advertising magazine)
116,Antelope_Flats,Jun 2018 , Couples,"Huntsville, AL ",A must do for photographers!,"The Grand Tetons National Park is one of the best of our national parks and appeals to almost everyone. However, among photographers, Mormon's Row ranks high as a photo op. The two ""must do"" shots are the TA Moulton barn and the John Moulton barn. They were brothers and built themselves great looking barns. The barns with the Grand Tetons for a background make postcard quality photos. If the weather is right, you can also get cool sunrise, sunset, or both types of shots. Rub shoulders with professional photographers while you are there. Feel free to ask them advice about camera technique and composure, as long as you are courteous and don't get in the way of their shots! Most of them love to share their knowledge, but don't ask that question when their eye is up to their viewfinder."
117,Antelope_Flats,Jul 2018 , Family, ,Late evening ride through,We rode.through Antelope Flats early in the day and did not see wildlife. We went back late evening and through and seen lots of wildlife! Loved every minute!
118,Antelope_Flats,Jun 2018,not available,"Sacramento, CA ",Great sites! A photographers delight,"Loved walking around the buildings on Antelope Flats. You could just imagine what it must have been like when there were 30 or more structures in this area. We lucked out with having great weather, with a slight breeze, and poofy clouds all at the base of the amazing Tetons. This is a great place to go if you want to a low key day in the outdoors."
119,Antelope_Flats,Jun 2018 , Friends,"Newnan, GA, ",Bison herd there,"if you want to bison they were here every time we drove by. Later in the daywear got to see them crossing the road. Sometimes they are further away and sometime right next to the road. I would take binoculars just o case, but chances are really good they will be very close. We loved this spot!"
120,Antelope_Flats,Jul 2018 , Family,"Melbourne, Australia ",Old time sake,These old places and sheds from the early pioneers are just great and provide you insight into early days in the area and what hard living would have been all about. Great scenery around these places and at different time if the day will give you some excellent photo shots
121,Antelope_Flats,Jun 2018 , Family,"Colleyville, TX ",Great picture venue.,This is by far a perfect picture location. Morning Noon and evening you get different types of shots. Photographers who know what they are doing show up.
122,Antelope_Flats,Jun 2018 , Couples,"Wichita, KS ",THE iconic shot,"This is definitely THE iconic picture that everyone should get in the Tetons. There are better viewpoints of the Tetons elsewhere, but the scenery combined with the history and visual appeal of the old barns is just awesome. Come during the morning or evening for soft lighting when the sun isn't high in the sky."
123,Antelope_Flats,May 2018 , Couples,"San Diego, CA ",Our First Bison Sighting,We started our 4 day safari with an evening here. Just beautiful and our full rainbow was portentous as we saw all the animals on the park brochure!
124,Antelope_Flats,Jun 2018 , Solo,"Lynchburg, VA ",Antelope Flats,I had seen photos of Mormon Row for many years and had thought I would never get to see the area. I made it in June and fell in love with the scenery ! The old barns and houses made for beautiful photos with the Teton Range in the background! Beautiful !!
125,Antelope_Flats,Sep 2017 , Couples,"Missouri City, TX, ",Good drive,This is just one of the great drives while in the Tetons. While on our drive we saw elk and they are always fun to watch. You also will see the remnants of a Mormon town with barn and homesteads. All of this with a backdrop of the most beautiful scenery all around you.
126,Antelope_Flats,Jun 2018 , Family,"Maho, St Martin / St Maarten ",Worth the Drive,Easy to get to. We used the gypsy app. Accessible for those of all ages. The scenery is amazing. Worth the drive.
127,Antelope_Flats,Jun 2018 , Couples,"Stillwater, OK ",Fantastic,Antelope flats is an amazing area to visit. The Mormon barns are a favorite to photograph. The bike trails are wonderful and we also took a drive up to some of the camps site.
128,Antelope_Flats,May 2018 , Family,"Clearwater, FL ",Great place to photograph,How can you go wrong with the amazing Grand Tetons as a backdrop?! The ever-changing sky over the most beautiful mountains! It's just a sight to drink in!
129,Antelope_Flats,Feb 2018 , Family, ,Wildlife Photography,Posters state that this is the best place to see Bison. We were disappointed as we did not see Bison in this area. We did see Bison on Gros Ventre and Teton National Park North of Jackson.
130,Antelope_Flats,Feb 2018 , Solo, ,The old Mormon barns,The road to Antelope Flats takes you to several of the old Mormon barns that make a beatiful scene with the Tetons in he back ground.
131,Antelope_Flats,Feb 2018 , Family,"White Lake, MI ",Worth the hike,A must see while in the Jackson area. We hiked out to the barns as the roads are closed in the winter. Just beautiful scenery in every direction. It was about a 2 mile hike in total from where the road is closed round trip.
132,Antelope_Flats,Aug 2017 , Friends,"Phoenix, AZ ",Wildlife Viewing,Buffalo and antelope roam free. Do not think about approaching buffalo..they will gore you. They sometimes cause traffic jams .
133,Antelope_Flats,Jan 2018 , Couples,"Peru, IL ",Drive to see some moose,We took a drive to see the moose early in the morning because our waiter said they were hanging around the area. We ended up seeing 12 and then we returned in the afternoon and we saw a juvenile one. We also spotted some big horn sheep and a ram and some elk. We didn’t see any antelopes but it was a nice drive
134,Antelope_Flats,Dec 2017 , Couples,"Florissant, CO ",Best view in America,"If you can do only one thing, this is it. To stand and look at Gods creation is what makes life worth living. The drive to the flats is wonderful down the back roads you may even see a moose or two."
135,Antelope_Flats,Dec 2017 , Couples,"Nanaimo, Canada ",Picture worthy for the photographer,Great spot to capture a picture of the old barn with the Teton range in the background. Watch out for gopher holes in the field.
136,Antelope_Flats,Dec 2017 , Couples,"Belt, Montana ",Great for photographers,"We spent three days on the Flats, photographing wildlife. The roads are well-maintained, and if you're willing to spend the time, you can find quite an assortment of wildlife photo opportunities. If you're so-inclined, you can book a tour at one of the wildlife tour companies in Jackson."
137,Antelope_Flats,Oct 2017 , Couples,"Jupiter, FL, ",a MUST see when visiting the Grand Teton,"Mormon Row Historic District  A once vibrant community. Homesteaders, who settled here near the turn of the 19-century, clustered their farmers to share Labor and Community.....as you walk imagine 33 homesteads surrounding a church and school. Structures from six homes remain here.."
138,Antelope_Flats,Oct 2017 , Couples,"Niota, TN ",GREAT photos!!,"I was so excited to be able to find the log barn on Mormon Row. I had wanted to take my own photos there. We have a farm, so we really enjoyed looking over the corrals and cattle loading area. The view of the Tetons is wonderful from there."
139,Antelope_Flats,Oct 2017,not available,United States ,Beautiful Area,We traveled through Antelope Flats recently and were lucky each time to see moose. It's a great area for photographing the Tetons in the background. We love the entire GTNP area and all that it has to offer.
140,Antelope_Flats,Oct 2017 , Couples,"Canby, OR ",Good opportunity to see elk,Get off the highway and check out this an other areas. Old buildings from original settlement days and great views. You might get lucky and see elk or moose.
141,Antelope_Flats,Sep 2017 , Friends,"Saint Louis, MO ",MOULTON BARN,"I have been coming to Jackson, Wyo and photographing this barn for many many years. The park service has now added a drive/park slab of cement, porta potties, and rather changed the natural rustic appearance of the grounds. The best place to photograph this is down the road and back in the field. Up close you don't get the beautiful perspective that you do from far away. The best time to photograph the barn is at first light when the sun rises and hits the barn with that beautiful first light of day. Hope for a beautiful blue sky with lots of fluffy clouds and you will have a winner of a photo. Sometime the buffalo the roam around and you have to be aware. I have had them, in the past come close, and I just sat there, very quietly and didn't move. He went away. This is probably the most photographed barn in the USA."
142,Antelope_Flats,Oct 2017 , Couples,"Hamilton, New Zealand, ",Iconic,"This is one of THE places to get a shot of the Teton - with an old barn.  But you need good weather, no point going if you can't see the tops.  First try was a wipe out, next day was perfect. Teton with a snow crown and barn.    The road to the barns is very rough, but short. Come in from the north end and exit back the same way, only a few minutes off the main road."
143,Antelope_Flats,Sep 2017 , Family,"Los Angeles, CA ",This barn has the best view of The Tetons,"This most photographed barn did not disappoint. We were lucky enough to experience an early snowfall that dusted the top of The Tetons for a postcard perfect image. Not to be missed, really! Bison and elk frequent the area."
144,Antelope_Flats,Sep 2017 , Couples, ,Pretty drive,We were tooling around and staff at the hotel recommended this drive. It was scenic and we were glad we took it. The barn is supposed to be a beloved barn that is photographed extensively.
145,Antelope_Flats,Sep 2017 , Family,"Douglasville, GA ",An old familiar place.,You cannot enter a gift shop or gallery without seeing an image of this area displayed for sale. It is easily accessible and you can make your own memory with little difficulty.
146,Antelope_Flats,Sep 2017 , Couples,"Rockford, IL ",Breathtaking Views,Take the time to stop and explore the area. Be sure to bring a camera as the views are simply breathtaking.
147,Antelope_Flats,Sep 2017 , Couples,Montana ,Worthwhile Stop on Teton Park Itinerary,Interesting Mormon historical perspective of the Park. Amazing photo op when the weather cooperates. Best photos early morning.
148,Antelope_Flats,Sep 2017 , Couples,"Pittsburgh, PA ",Takes you back in time,Going to see all the old barns and buildings was very interesting. They are very well made and probably had to be to withstand the weather.
149,Antelope_Flats,Sep 2017 , Couples,"Stevensville, MD ",Great for Photographers,"This area provides photographic opportunities to get pictures of the historic Moulton Barns with the Grand Tetons in the background. Wildlife viewing is also possible including Bison, antelope, bears and elk."
150,Antelope_Flats,Sep 2017,not available,"California, ",Recommend- History and possible animal viewing at dusk,▪️Location: Take right turn on Antelope Flats road while driving north on 89.  ▪️Parking: Can accomodate 10 or so cars. Sufficient when we were there during Sept.  ▪️Ranger? Not attended while we were there at dusk. Been there with a ranger before.  ▪️Highlights: Possible animal sightings and historical Mormon Row history and buildings.  ▪️Cost: Free.  ▪️Recommend? Yes
151,Antelope_Flats,Sep 2017 , Couples,"Cincinnati, OH ",Iconic photo op,This photo op has become so popular they have added a parking area & a small walk way to avoid walking in the street. It is a must visit. When you are finished drive a short distance further to see moose or bison roaming the flats. It is hit & miss but worth it if either are out.
152,Antelope_Flats,Sep 2017 , Friends, ,A beautiful view,"These are vast flat lands populated by sagebrush, bison and other wildlife. Stopping anywhere will provide a great view of the Tetons."
153,Antelope_Flats,Aug 2017 , Family,"Chicago, IL ",Great view of Teton in background,Don't make the mistake i made by driving THROUGH Mormon Row. It's all gravel and it was waste of time. What you do is just drive on Antelope flats rd and see the farm houses at sunrise/sunset. We also saw group of bisons nearby.
