,place,date,category,place ,Tagline,Review 
0,Laurance_Rockerfeller_Preserve,Oct 2021 , Couples,"Weatherford, OK ",Nice place for a walk,"This park has some nice, wooded hiking trails, but not much more. It would be nice if there were more signs along the way describing what we were seeing. The visitors center was closed for the winter, even though this was early in October. We did have to wait about twenty minutes for a parking spot to become available."
1,Laurance_Rockerfeller_Preserve,Sep 2021,not available, ,Nice walk and amazing views,We headed out towards the lake - it was a nice walk with amazing views. The visitors center is also a must see. The architecture was breathtaking - nestled in the mountains/valley. And the varied scenery was incredible.
2,Laurance_Rockerfeller_Preserve,Sep 2021,not available,"Baltimore, MD ",Nice Loop Trail to Phelps Lake,"There is a parking lot that holds about 40-50 cars (so be okay waiting if you're not there early, although they have a good waiting system with a line for cars to wait). There is a bathroom at the parking lot and a small visitor center.    We did the approximately 3 mile loop trail to Phelps Lake. It's relatively easy with some small ups and downs, we probably did it in about 2 hours with some s. There are a few lookouts to stop at along the way (including a small waterfall). The lake itself is beautiful and there are a few ""off trail"" paths to go down to the waterfront itself (the marked path doesn't get you to the water itself). Overall a very nice hike with less of the hectic crowds than Jenny Lake. We also saw a bear on the way there right on the side of Moose Wilson Rd. They recommend you bring bear spray on this hike since bears frequent this area."
3,Laurance_Rockerfeller_Preserve,Sep 2021,not available,"Tampa, FL, ",Phelps Loop Lake Trail a Great Loop Hike | Great Views,"The starting point for Phelps Loop Lake Trail . the bathrooms are actually pretty nice here. - I would highly recommended to take the trail that fully circumnavigates the lake so you can catch all the spectacular views, it is well worth it. Unfortunately, we did not see much wildlife during our hike but the constant changing views of the lake made up for it! Bring water (goes without saying right) it's about 5.5-7.0 miles around the lake and back to the parking area."
4,Laurance_Rockerfeller_Preserve,Aug 2021 , Family,"Rochester, MN, ",Get there early or eat lunch in the car,It is a nice hike and I have heard many say it is like a less crowded Jenny Lake hike. Disappointed in the parking situation though. I counted the vehicles and there were closer to 40 than their limit of 50 yet we had a 1 hour and 20 minute wait with 5 cars in front of us when arriving at 9am. Of course getting there something closer to 7am would avoid that but unfortunate… there are a couple restrooms on the trail that are composting. Trails are pretty well marked. We did the shortest 3 mile loop in just about an hour without an aggressive pace. The trail is rocky with several inclines and declines but pretty easy as trails go.
5,Laurance_Rockerfeller_Preserve,Jul 2021,not available,"Chapin, SC ",Phelps lake and Jumping Rock,"This was a moderate hike to Lookout point, then down to the beautiful lake . My daughter,spouse and three granddaughters all made the 25 jump into the lake and earned their new screensavers"
6,Laurance_Rockerfeller_Preserve,Jul 2021 , Family,"Los Angeles, CA ","Wildlife, Whitewater, and Wildflowers!","Dream hike!  Stunning, uncrowded hikes along a beautiful, rushing river to a lovely hidden lake!  The “Center” is the starting point for various hikes to/ around Phelps lake. (It’s like Jenny Lake’s lesser known and less crowded little brother.)  We took the easiest and fastest loop, which was about 2 hours with little stops for pix etc. The river is gorgeous and travels dramatically downhill.  On the way back we watched from a bridge as a deer snacked on some grass and go down into the river for a drink!  There is a small parking lot at the center. We waited in line of 10 cars (30 min) to park. You can park on the highway and walk into the center parking lot, starting point for all hikes. (Plus nice bathrooms, water fountain.)"
7,Laurance_Rockerfeller_Preserve,Jun 2021,not available, ,Great start the Teton National Park,"We stopped to use the bathrooms (composting, be prepared). What we found was a beautiful easy hike and an educational center that was informative, spacious, and beautiful. We highly recommend that you visit."
8,Laurance_Rockerfeller_Preserve,May 2021,not available,"Douglass Hills, KY ",Ni e hike to the lake,Great hiking here. It is rated moderate but relatively easy for the entire family. There are also multiple options depending on how long you want to hike.
9,Laurance_Rockerfeller_Preserve,May 2021,not available,"Plantation, FL ",Worth the time,"Thanks to TripAdvisor I put this hike on our things to do list. We went early as stated and it was nice and open. The view of the lake was beautiful! I could stare at it all day. We hiked around the lake and then 2 other routes. The lake itself is 4 miles. The Creekside hike was nice and relaxing to hear on the way back. About 8 miles total. Moderate, not much elevation."
10,Laurance_Rockerfeller_Preserve,May 2021,not available,"Jackson, WY ",Great wildlife viewing in this area,"Road is a bit rough but wildlife viewing was really good. Saw Moose, elk, beaver and a big grossly bear"
11,Laurance_Rockerfeller_Preserve,Mar 2021 , Couples,"Houston, TX ",A must visit site!,"This is a great hike for the whole family. You can do a short hike to Phelps Lake or a much longer hike around the whole lake. Put lunch in your backpack and head off through a beautiful wooded trail along parts of a trickling stream. Make sure you take bear spray with you. I have seen bears on more than one occasion. After your hike, stop in at their visitor’s center to learn more about the Rockefeller family and their generous donation of land for our Park’s system. Make sure to save time to watch the all seasons slide show showing the park and it’s animals in all four seasons. Then step back into the zen like room where you can sit and listen to all the sounds of the many wonders of GTNP. They only allow so many cars to park in their lot. Get their early or take a book and wait in line, in your car, for the next parking place."
12,Laurance_Rockerfeller_Preserve,Sep 2020,not available, ,Worth your time,This entire area around the Grand Tetons is sight after sight of the Beauty of Creation everywhere. worth your time.
13,Laurance_Rockerfeller_Preserve,Oct 2020,not available,"West Chester, Pennsylvania, USA ",Great Place,We didn't intend to go to the preserve but stop after passing it while out for a drive up Moose Wilson Road. Beautiful scenery and a great hike to Phelps Lake. Next visit we will schedule some time to spend more time around the lake and the preserve.
14,Laurance_Rockerfeller_Preserve,Oct 2020,not available, ,What a treat!,The Lawrence Rockefeller Preserve is so nice. We visited there last week and thoroughly enjoyed our 8 mile hike around Lake Phelps. Very beautiful location. Quiet. A little off the beaten path. Well worth the extra effort to visit.
15,Laurance_Rockerfeller_Preserve,Oct 2020,not available, ,Amazing views and serene surroundings,We drove by this beautiful preserve a couple of days ago and we had the best experience. The area is magnificent and the views are amazing.
16,Laurance_Rockerfeller_Preserve,Oct 2020,not available,"Atlanta, GA ",Wish I had discovered it sooner!,Discovered the preserve on my last day in Jackson and did not have enough time to explore the preserve as much as I would like. One of many reasons to go back to Jackson. It is definitely on my list to revisit. Not nearly as crowded as the rest of the Grand Tetons. Very tranquil. On the Moose Wilson road so you may get lucky and see some moose on your way there.    Small parking lot so get there early.
17,Laurance_Rockerfeller_Preserve,Sep 2020,not available,"San Francisco, CA, ",An absolute must!,"We didn't know about this place until we met some hikers at the Taggart Lake. They highly recommended this place to us so we checked it out that same day. This is a beautiful place and the hike is great to Phelps Lake. We we a huge bull moose that crossed our path. We of course stood clear and gave lots of clearance. On our hike back, we saw a young grizzly bear eating berries across the creek. I love this place!"
18,Laurance_Rockerfeller_Preserve,Sep 2020 , Couples,"Palm Coast, FL ",Special Hile,"One of the best hikes we did during our stay. Varied terrain, beautiful mountain lake and lower traffic level relatively speaking."
19,Laurance_Rockerfeller_Preserve,Aug 2020,not available,"Dallas, TX ",Beautiful hike,"Would definitely recommend coming here. If you're driving from Teton Village, it's a short and easy drive through the park to get to the preserve. We did the Woodland Trail hike to Phelps Lake and then the Phelps Lake trail. Gorgeous views, easy hike! Especially good for your first day in the area."
20,Laurance_Rockerfeller_Preserve,Aug 2020,not available,"New York City, NY ",Beautiful hike to Phelps Lake - kept our distance from baby bear!,This is a lovely and moderate hike with the gorgeous payoff of an uncrowned and beautiful mountain lake. A great way to spend the afternoon for a family of four including our teenage son and college daughter. We saw a baby bear on a rock 10 minutes in but know enough to keep our distance and move on - mama bear is out there somewhere! The trailhead center was closed but the restrooms were open and very nice and clean.
21,Laurance_Rockerfeller_Preserve,Aug 2020,not available, ,Great place to park to hike to jumping rock on Phelps Lake,"We used this lot as a parking area for our hike to the jumping rock on Phelps Lake. Great place to park (with bathrooms and water filling station) to start a hike to the rock ledge on Phelps. Two mile hike in with stunning views. The rangers at the lot are very friendly and informative. They have trail maps and pamphlets. Get there early as the lot fills up, but if full the rangers line you up and people are always coming and going so it is not a long wait."
22,Laurance_Rockerfeller_Preserve,Aug 2020,not available,"Atlanta, GA ",Great Devils Canyon to Phelps Lake Hike,Park at Devils Canyon. Have to wait at Rock parking. We drove the extra miles to this more remote lot and then hiked up and down to the lake. 1200 feet vertical and 2 black bears.
23,Laurance_Rockerfeller_Preserve,Jul 2020 , Family,"Eugene, OR ",Part of a Yellowstone tour.,Saw a sampling of the reserve as a part of a Yellowstone tour. Stunning scenery. Would like to go back and explore this area and the Tetons more
24,Laurance_Rockerfeller_Preserve,Jul 2020,not available,"Atlanta, GA ",Phelps Lake Hike,Phelps Lake Hike was spot on. We had a great time and enjoyed the scenery along the way. I highly recommend this hike!
25,Laurance_Rockerfeller_Preserve,Jul 2020,not available,"Greenville, SC ","This was a nice, easy hike.","Easy to miss the entrance on Moose Wilson Road. The wait for a parking space was a pain, but the lower volume of hikers, and the easy grade was nice. Loved the view of the lake."
26,Laurance_Rockerfeller_Preserve,Jul 2020,not available, ,"Beautiful trails, saw a bear!","This preserve is in the Phelps Lake area bordering the Tetons National Park. We went on the Aspen Ridge Trail and loved it. It appeared to be a less traveled route, but easy to follow. Beautiful view of the Teton range. Walked up on a Black Bear digging into a dead stump; we were within 30 feet-just made noise and kept moving slowly away! Phelps Lake is gorgeous and has several areas to sit, take pictures or swim if you are inclined. Great place to hike!"
27,Laurance_Rockerfeller_Preserve,Jul 2020 , Friends,"Chicago Heights, IL ",Would go back early,We went one day and there was a wait for parking so we returned another day around 8am with plenty of parking available. The visitor center was closed due to covid but the trails were nice. I’d like to go back when the visitor center is open.
28,Laurance_Rockerfeller_Preserve,Jul 2020 , Couples,Boca Raton ,Lovely morning walk,"We started our hike at 7am and only a couple of other cars were there. The lake creek path was beautiful and an easy walk to the lake. We had hoped to see wildlife and didn’t, but the birds were singing and the atmosphere was so calm. We returned through the woodlands and enjoyed the sounds and crisp morning air. Someone on the path said they spotted a baby bear. I don’t know if I wanted to see it or not!! Walk was about miles in total."
29,Laurance_Rockerfeller_Preserve,Jul 2020,not available,"Nashville, Tennessee, United States ","Preserve closed, but hike around was awesome","You can hike along the river to Phelps Lake and it's super quiet, pretty and enjoyable. Would recommend!"
30,Laurance_Rockerfeller_Preserve,Jul 2020,not available,"Longmont, CO ",It doesn't get much better than this!!,"It doesn't get much better than this. Although a very popular tourist hike, I am glad we decided to adventure to the LR Preserve last week. Yes, we got there and had to wait about 40 minutes for a parking spot to open, but nobody can complain about the view you have while you wait. Also a shout-out to the two park rangers who were very kind and helpful.    Don't overlook bear spray and making sure you are doing all the recommended things while in bear county. The group in front of us saw a black bear and her cub. I think sometimes this is disregarded since there is a high level of hikers on this trail.    We will be back someday when we can enjoy more time and visit the visitors center."
31,Laurance_Rockerfeller_Preserve,Jul 2020 , Family,"Memphis, TN ","Beautiful, secluded trails & lake","Beautiful place to hike! The summer wildflowers were stunning, lots of streams along the way to the beautiful lake. It wasn’t crowded because they only allow the number of cars that will fit in the parking lot. Phelps lake is stunning. We took the Woodland Trail to the jumping rock (we didn’t jump in but we saw people who were going to!) The view from that rock is spectacular!"
32,Laurance_Rockerfeller_Preserve,Jul 2020,not available,"Houston, TX ",Summer 2020 Perfect Time to Visit!,"We have been lucky to have visited the LR Preserve a number of times. During normal times, one must wait 30-60 min+ for a parking space as they control their parking and access. However, it appears that during the pandemic (as of 7/1/20) the visitors building is closed. While the visitors center is lovely, the real gem is the walks in the surrounding pristine WY wilderness: rushing rivers, lakes, mountain vistas, lush woods full of wildlife. We pulled up around 2pm today and popped right into a parking space! The trails are still fairly heavily trafficked, but we have had worse, and the scenery is just a huge bang for the buck if your looking for a 3 mile walk that every member of your family will enjoy. If you're lucky enough to travel this summer, take advantage of this unprecedented access to the LR Preserve hikes. Stay safe!"
33,Laurance_Rockerfeller_Preserve,Jun 2020,not available,"Atlanta, GA ","Great place for a hike close to Jackson, right at base of Tetons.","Great choice of hikes fairly close to Jackson. We went twice during the week. The visitor center was closed due to Covid, but the trails were all open. They are extremely well laid out, following the contours. There are two going up to Phelps Lake, and there are several spots to rest an/or picnic. At the lake, there are options to circle the lake, or branch off in other directions. The park guide has times and distances for all the legs, so you can plan your adventure accordingly. Very professionally done."
34,Laurance_Rockerfeller_Preserve,Jun 2020,not available,"New Orleans, LA ",Phelps lake,Great hike to pristine Phelps Lake! There are two trails that make a loop with lots to see along the way!
35,Laurance_Rockerfeller_Preserve,Oct 2019 , Couples,"Bend, OR ",Fantastic Staring Point for a Hike,"We missed open season by about a week, so we weren't able to see the inside of the visitor center. Even so, this is a fantastic place to start a hike as there are several trails of varying length and difficulty that you can access from here. There are maps at the visitor center and plenty of signs along the paths to keep you on track. You're warned in many places to be on the watch for bears, so you really should have bear spray (we didn't and I would have felt better had we planned better). The views of Phelps Lake and the snow capped mountain peaks are absolutely breathtaking. They also provide restrooms at the parking area; very basic accommodations but welcome when you're out hiking."
36,Laurance_Rockerfeller_Preserve,Oct 2019,not available,"Mattoon, IL ",stunning,we did this as a drive through trip stopping to take pictures as we went. there are many trails to take for those who are more active than me
37,Laurance_Rockerfeller_Preserve,Sep 2019,not available,Dubai ,Such a great place,The visitors center has a great architecture- it is fantastic that it has been donated to the use of public... the trails are nice bith long and short offers choice to everyone...
38,Laurance_Rockerfeller_Preserve,Sep 2019,not available,"Reidsville, NC ",We saw moose in the field every time we went there,"When you drive up to the preserve, look in the big field on the left. We saw moose there morning and night. We also saw some fellow travelers go lie out there for some stargazing. This is far from civilization and I wanted to do it myself, but it got cloudy."
39,Laurance_Rockerfeller_Preserve,Sep 2019,not available,"Bossier City, LA ",Amazing views,"This is just a part of the Jackson Hole experience you have to see to appreciate. Stunning views of the mountains, beautiful sky, and September is the right time to do it."
40,Laurance_Rockerfeller_Preserve,Sep 2019,not available, ,a unique place,"If you're visiting Teton National Park, going to the preserve is a must! It's a gorgeous, pristine outdoor space with an outstanding visitor's center - complete with fireplace and quiet room. Very special."
41,Laurance_Rockerfeller_Preserve,Sep 2019,not available,"Toano, VA ",Informative - Rangers Helpful,We walked around the center the first day and it is really nice with all that the Rockefeller did for the area. The second day we hiked out to the lake and the rangers let us know there were bears in the area and to be careful. Wonderful view of the lake something that can not be seen from the car. Hike was easy.
42,Laurance_Rockerfeller_Preserve,Sep 2019 , Couples,san diego ca ,About the visitor center,"I see that most reviews here talk about hiking or the parking lot. I wanted to provide a review of the visitor center which is unique and focuses on the sensory experience of being in nature as opposed to facts and figures. It has inspirational quotes on the walls and video and auditory immersion experiences of the area over the seasons. Very relaxing and meditative experience. A bonus is a lodge type room with a fireplace and books and big windows to just relax or chat. So if you'd like this type of experience, be sure to visit the preserve visitor center."
43,Laurance_Rockerfeller_Preserve,Aug 2019,not available,"Chicopee, MA ",Not enough parking,When we arrived we were told to pull to the side and there was 3 vehicles in front of us and that the parking was full and we would have to wait until people leave. Would have loved to visit and walk around but we couldn't leave the car unattended so after waiting about a half hour we just left.
44,Laurance_Rockerfeller_Preserve,Sep 2019,not available, ,Beautiful and relatively few people,"Really pretty walks through the woods, along streams, up to Phelps lake and great scenery there. Very peaceful."
45,Laurance_Rockerfeller_Preserve,Aug 2019 , Couples,"Grayson, GA ",Make the effort to take the hike with a ranger,This is a great place to visit. It's even better if you can take the ranger led hike. You learn about the area as well as the Rockefeller family and their contribution to the Park. The visitor center is also unique.
46,Laurance_Rockerfeller_Preserve,Aug 2019 , Couples, ,Thank you Rockefeller Family,If a walk along the trails doesn’t impact your life - nothing will. Take the tour provided daily by the Park Rangers.
47,Laurance_Rockerfeller_Preserve,Aug 2019,not available,"Elkview, WV ",Beautiful Hiking Area,"Beautiful preserve and worth a visit. However, even midweek in the summer, the parking lot was full. Recommend going early morning or late afternoon."
48,Laurance_Rockerfeller_Preserve,Aug 2019,not available,"Lifton, UK ","Beautiful, serene walk and lake","We walked from the Visitor Centre to Phelps Lake. We were given a leaflet detailing the trail upon arrival at the car park by a very helpful volunteer. The car park was busy at midday, but we were lucky enough to find a space.  The trail was well marked and very pretty. Phelps Lake was picture-postcard perfect and we spent a very happy afternoon exploring and paddling! We did take bear spray, but didn't encounter any wildlife on this trip, apart from a deer and the ubiquitous Chipmunks and Squirrels. We walked as far as the popular jumping rock on the far side of the lake, but I should point out that the Laurance Rockefeller Preserve are not keen on this being the focus of your visit. The rock itself is approximately 26ft high and your leap into icy water is not something you should consider doing unless you are a very competent swimmer."
49,Laurance_Rockerfeller_Preserve,Aug 2019,not available,"Austin, TX ",awesome view,"this is a great place to take pictures, view the Grand Tetons, which are just awesome in person, pictures won't tell you how great they look, and with the lake in front of them, wonderful place to sit and relax, take a few pictures and make great memories"
50,Laurance_Rockerfeller_Preserve,Jun 2019 , Family, ,Beautiful,"We parked at the preserve and hiked to the lake. On the way we saw two bears!!! BRING YOUR BEAR SPRAY. It’s a very pretty hike, totally worth it. Parking can be tricky so come early or be patient :)"
51,Laurance_Rockerfeller_Preserve,Aug 2019,not available,"St. Paul, United States ",Great place to visit!,I read about this stop long before heading to the Tetons and so glad I did!! They say only about 300 people get in here a day due to the limited parking available. We were in there by 9:20am and I would say for sure by 10am it was probably full. The area I think is probably great for hikers!! I can't give a full account on that because we have one person in a wheelchair in our party. We did however take in the full visitor center and spent some time watching their videos inside and then taking to staff. The staff was amazing and friendly. Looks like they have some really great trails for hiking and it you hike I would head out this way. If you do need to worry about accessibility I can tell you that you can make part of the hike. The staff told us that we would be able to get thru some of it so we looked to see how far we could go and so glad we did. We hiked the path until we can to a bridge my son could get on but not down on the other side because there are steps. You would be basically trying to get to a lake. But there are some fun things to see along the path and then you can be one of the few to say you have been there!
52,Laurance_Rockerfeller_Preserve,Aug 2019 , Couples, ,Gorgeous,This is worth the stop. Beautiful views. Pristine. Great hiking. Read about the history of Rockefeller’s contribution to the park. Quite amazing.
53,Laurance_Rockerfeller_Preserve,Jul 2019 , Family, ,Phelps Lake is a wonderful hike!,The loop/ring trail at Phelps lake is a moderate/easy hike. Just beautiful. Wear your swim suit in the summer to go swimming in the crystal clear water. Took kiddos... amazing! Done in about 2 hours.
54,Laurance_Rockerfeller_Preserve,Jul 2019 , Couples,"Lutz, FL ",Best Kept Natural Secret,"From Moose Junction, drive past Jenny Lake into an unassuming parking lot. Take either Phelps lake Trail or Woodland Trail- plenty of wildflowers and deer. Phelps Lake is the treasure at the end of the rainbow hike. Rangers available and education center well worth it."
55,Laurance_Rockerfeller_Preserve,Jul 2019 , Family,"Parkland, FL ",Hiking day trip,Good hiking trails up and over the mountain and around the lake. Gets a bit crowded later in the day. Interesting nature center and pleasant staff.
56,Laurance_Rockerfeller_Preserve,Jul 2019 , Friends,"Tucson, AZ ",Gorgeous area to visit,We stayed in Teton Village and the preserve was an easy drive just down the road for us. What an amazing place to hike from. Parking is small and can be challenging but it was worth the wait. Thus the 4 vs the 5 review. A comprehensive visitors center will guide you to the various hiking options. We hiked around Phelps lake to find the “ rock” a local had told us about to jump off of into the clear cool water. Well worth the experience. We’d return again and again.
57,Laurance_Rockerfeller_Preserve,Jul 2019 , Family,"Lionville, PA ",Whole area is beautiful,The preserve is located on Moose Wilson road outside the entrance to Grand Teton National Park. It is a beautiful area teaming with wildlife. At the entrance to the preserve we saw a moose and plenty of mule deer great stop before you get to GTNP.
