,place,date,category,place ,Tagline,Review 
229,Laurance_Rockerfeller_Preserve,Jun 2017 , Couples,"New York City, NY ",Phelps Lake Start,"Get to the parking lot early, they have space for only 40 cars. By 9:30 the lot was full. The hike is easy/moderate loop. Creek side of loop goes along a rushing water creek. Not many mosquitoes. Alas, no bears seen."
230,Laurance_Rockerfeller_Preserve,Jun 2017 , Family,Connecticut ,Be patient for parking,Long hike but not too difficult. Parking is terrible but be patient. Spots will become available soon. Nice attraction and worth it.
231,Laurance_Rockerfeller_Preserve,Jun 2017 , Family,"Pittsburgh, PA ",Outstanding place for a short hike,"The hike ti Phelps Lake is a bit f a hidden gem among the many trail available in GTNP. The cascading creek from the lake is beautiful and makes for a scenic walk all the way up. Once you get to the lake, and see the Grand Tetons it is even better. This is a fairly easy hike with some rocks, and gradual elevation gain."
232,Laurance_Rockerfeller_Preserve,Jun 2017 , Couples,"Jersey City, NJ ",Beautiful visitor center. Crowded trail around lake.,"Like every Rockefeller preserve I visited, this is lovingly maintained and and enjoyable, perfectly-chosen piece of land. The hike around the lake is most popular, and it might be nicer if they closed the parking lot at a certain point to let more people enjoy it in peace (there are lots of families with kids romping through here and it felt a little like an amusement park; whereas, if they paced the visitors out a little, it would give one the sense of quiet nature, in which the Laurence Rockefeller was so keenly aware of providing.) The property is worth visiting regardless, the hikes are easy, the waterfall and river are inspiring, and the staff are delightful and helpful."
233,Laurance_Rockerfeller_Preserve,Jun 2017 , Couples,"Fredericksburg, VA ","Hidden gem, worth the wait to park","This is a really special, unique place right next (in?) Grand Teton National Park. Located up the Moose Wilson Road, it is a beautiful and well thought out nature preserve, designed to allow visitors to really reflect on the beauty of nature and it's serenity. Rockefeller left the property to the park with specific instructions on how it was to be developed. This includes a limit of 50 parking spots so it is never over crowded. Well maintained nature trails, and a really top notch visitor center."
234,Laurance_Rockerfeller_Preserve,Jun 2017 , Family,"Atlanta, GA ",Worth the wait for parking!,"The parking lot for this area fills up fast and very early in the morning. If the parking lot is full, the park rangers will line you up and you'll have to wait with your car until a parking spot becomes available. My family waited about 40 minutes, but it was definitely worth the wait. Great easy hike to the beautiful Phelps Lake. The entire reserve is lovely."
235,Laurance_Rockerfeller_Preserve,Jun 2017 , Family,"Dallas, TX ",Great hike around Phelps Lake,"Our family spent a day hiking around Phelps Lake. It was 6.8 miles round trip, which was a pretty long way but doable for our kids (12, 11, 7). The trail is very well maintained, easy to follow, and provides great views of the lake and surrounding mountains. The visitor center is also worth a quick peek. I recommend starting early because by the time we returned (early afternoon) there was a line for parking. When we arrived (early morning) we pulled right in and started hiking. Overall, its a really nice way to spend a day in the Tetons."
236,Laurance_Rockerfeller_Preserve,May 2017 , Family,"Maple Valley, WA ",Lovely,My husband and I spent a few hours hiking around the preserve. It was peaceful and beautiful-- very glad we went and highly recommend to others.
237,Laurance_Rockerfeller_Preserve,Jun 2017 , Friends,longmeadow ,Great early morning hike/walk,"Was looking for a quick easy hike near our lodging in Teton Village...the 15 minute drive ( into the park...you need a park pass to go here) brought us to the preserve...there is a lovely 3 mile loop to Phelps Lake which which took us about 1 1/2 hours. Beautiful lake views reward you...no animal encounters , but maybe it was a quiet time of day (10:30)..the parking lot was nearly full when we arrived, and there was a wait when we departed...so go early!  The inside of the building had aome interesting exhibits and information about the property and the Rockefeller family.  Very enjoyable. ...trail was rockier and rootier than we expected...some up and down...big rocks for kids to climb up on along the trail....pretty wildflowers."
238,Laurance_Rockerfeller_Preserve,Jun 2017 , Family,"Alma, WI ","Beautiful area, great Rangers",We came to the Preserve to finish our kid's Junior Ranger program. The place is fantastic with sound rooms of the parks & models of the mountains.    The Ranger gave a presentation on the upcoming solar eclipse. He really engaged the kids.    Lousy weather kept us from the hiking trails though.
239,Laurance_Rockerfeller_Preserve,Jun 2017 , Family,"East Greenbush, NY ",Wonderful Place,Very scenic and the visitors center was very informative. The Rangers were very friendly and helpful. The hiking trails were well-maintained and well-marked.
240,Laurance_Rockerfeller_Preserve,Jun 2017,not available,"Dallas, TX ",One of our favorite hiking trails,This trail is right before you enter the park and the visitor center is incredibly neat if you have a chance to go inside before or after your hike. It has this really cool 3D map and beautiful photos. The trail itself is a really easy hike alongside a river which is beautiful. It's mostly shaded and we saw tons of wildlife. There was apparently a mama bear with some cubs nearby. We did not see her but did see moose and mule deer as well as lots of birds. Definitely recommend it!
241,Laurance_Rockerfeller_Preserve,May 2017 , Family,"League City, Texas, United States ",Beautiful scenery,Beautiful area for hiking. The scenery is breathtaking. All the trails are well taken care of. Rangers are very helpful and trails are well marked.
242,Laurance_Rockerfeller_Preserve,Jun 2017 , Couples,"Greenville, SC, ",Great Visits Center and Wonderful Hiking,My wife and I hiked two of the many trails and had a fabulous day. The visitors center has display like none other you've seen. This is a worthwhile spot to take the time to hike and visit.
243,Laurance_Rockerfeller_Preserve,Jun 2017 , Family,"Houston, TX ",Amazing hike and visitor center,"The Preserve is not far from Teton Village or Jackson Hole and is well worth the short drive. Definitely get there very early so you can get a parking space as they are limited. The hike into Phelps Lake is beautiful and an easy walk for families. The lake itself is well worth the hike. It is about a 3 mile loop. We saw a beaver, deer, and a moose, but luckily we never encountered bears. I highly recommend a visit to the Preserve!"
244,Laurance_Rockerfeller_Preserve,Jul 2016 , Couples,"Sturbridge, MA ",Great spot for an easy hike - hidden gem!,"We visited the Preserve while on our trip to GTNP in July. We took the trail along Lake Creek to Phelps Lake. It was a non-strenuous hike through a very scenic area. The lake is a beautiful shade of turquoise blue, framed by mountains behind it. Bring water with you, and wear comfortable shoes, as the hike itself will take over an hour. You will see some wildlife while on this hike - a deer walked directly across our path on the back side of this trail, close enough that we could have reached out and touched her (do not do this). We were also warned in advance that a bear had been spotted along the trail slightly further up, but was gone by the time we arrived in that area. There are restrooms in the Visitor Center. Parking is limited, so arrive early if possible. The rangers will only allow in as many cars as there is parking, so during busy hours, there is a line of cars waiting to get in. We waited for about 20 minutes, but it was worth it. This park is in a more remote area of Teton, and we did come across a moose on the way in (which this area is known for!). Highly recommend!"
245,Laurance_Rockerfeller_Preserve,May 2017 , Couples,"Fort Myers , Fla ",Nice Walk,"Pleasant walk/ hike , not too strenuous through the forest. Good for anyone. Visitor center and rest area available."
246,Laurance_Rockerfeller_Preserve,May 2017,not available,"Lubbock, TX ",Hidden Gem!,"Beautiful location, interesting history as to how the preserve came to be. Nice hiking trail. Good restroom in parking lot, BUT the one on the trail was not open last week of May:( Well worth the time to hike to the lake. Rough road coming in from the south! Go before noon to avoid crowds."
247,Laurance_Rockerfeller_Preserve,May 2017 , Friends,San Rafael ,Rockefeller Preserve,ok-good bathroom stop. was surprised they are selling bumper stickers that say Buffalo instead of Bison. Don't they know the difference?
248,Laurance_Rockerfeller_Preserve,May 2017 , Couples,"Bedford, PA ",Osprey nest!,"My husband and I got up early and went out on a hike to Phelps Lake. The trials were rocky but otherwise well maintained. It was an easy hike which was about 3 miles round trip. We were thrilled to see the Osprey nest and ""Mom"" was chipping like crazy to let us know not to mess with her. Very beautiful lake with mountains."
249,Laurance_Rockerfeller_Preserve,May 2017 , Couples,"Dover, TN ","Wonderful views of Tetons, lake and creek!","We hiked to the lake last Saturday, May 13th. On that day the center and bathrooms were closed but the trails were open.    We walked the Woodland trail, about a mile, to the lake and the Lake Creek trail, about 1.3 miles, back. The Woodland trail still had lots of snow and ice on it. Also there were several trees down on it. However, the Lake Creek trail was in much better shape. We enjoyed it much more. We did hike some on the trail around Phelps lake!    The views of the Grand Tetons, the lake and creek are wonderful."
250,Laurance_Rockerfeller_Preserve,Oct 2016 , Couples,"Jackson, MS ",Be sure to visit this,"This facility will not disappoint. Wonderful eco-sensitive architecture and well thought out plan. Of course when money is not an object, great things can be achieved! but do not let that sway you from visiting. ALL park facilities should be done like this one!"
251,Laurance_Rockerfeller_Preserve,Oct 2016 , Friends,"Jackson, WY ",Beautiful hiking/running trails but annoying and nosey volunteers!,"I've visited this preserve many many times over the years, mostly to hike or run the trail system and to swim. Each time I arrive I'm greeted by an annoying, nosey usually older/ bored retired person. They grill you about what your doing there, what your plans are for the day, what color underwear you have on, and how many times you've had sex. They stop you to chat and create a long long line to park. It's annoying and unnecessary in my opinion. It's a national park, let the citizens of our nation visit the park without feeling like the CIA is interrogating us."
252,Laurance_Rockerfeller_Preserve,Oct 2016 , Family,"Jackson, WY ",Must see while visiting Jackson,A terrific place to experience Teton National Park. A wonderful interpretative center. Hiking trails that allow easy access to some of the most beautiful areas in Teton National Park. Hike all the way to Phelps Lake for a nice afternoon hike.
253,Laurance_Rockerfeller_Preserve,Aug 2016,not available,"Vernon, TX ",Don't miss this preserve,We visited the Rockefeller Preserve on our first day in the Tetons. It was a great start to our trip. The trail is fairly flat and easy. You are rewarded by a beautiful lake view after a 45 minute walk. This preserve seemed to have less traffic which added to our enjoyment.
254,Laurance_Rockerfeller_Preserve,Jul 2016 , Solo,"Twin Falls, ID ",Great place,"When in the Tetons you have to go here very beautiful we took the hike to the lake loved it there it was awesome. We were coming back from the lake and a bear was on the trail, the preserve is vert well done."
255,Laurance_Rockerfeller_Preserve,Jul 2016 , Family,"Colorado Springs, CO ",Come to Your Senses,"The beauty and simplicity of the visitor center is an artful expression of the natural world that surrounds it, and a delight to the senses. Sit quietly in the circular room and gaze at the outside wall. See what happens. We went right on the trail to Phelps Lake, the path less traveled. Spent one very special day here with two of my teen children. Lost track of time and found myself. What an absolutely amazing place!!"
256,Laurance_Rockerfeller_Preserve,Aug 2016 , Family,"New York City, NY ",Worth the trip,Great place to enjoy nature and wildlife. The lake was beautiful. make sure you have enough time to visit the museum.
257,Laurance_Rockerfeller_Preserve,Jun 2016 , Couples,"New York City, NY ",Don't miss!,"Mother Nature's way of telling us...""anything you can do, I can do better."" Serene, ""into the woods"" experience. Brooks, streams, foot bridges and, of course, the architecture of a magnificent forest."
258,Laurance_Rockerfeller_Preserve,Oct 2016 , Couples,"Indianapolis, IN ",Terrific easy hiking!,"We usually schedule vacations in the early fall to take advantage of smaller crowds, lovely weather, and potential wildlife sightings. We took the hike to Huckleberry Point as our first day in Jackson hike - not much change in elevation, and gave us some time to adjust to altitude. The lake was lovely, with the mountains in the background - and so quiet! We stumbled upon a herd of deer - there were recent bear sightings, but thankfully none of that for us. The visitor center had already closed, but the location was quiet, peaceful, beautiful and very clean. Highly recommend"
259,Laurance_Rockerfeller_Preserve,Oct 2016 , Couples,"San Diego, CA ","Stunning scenery, great trails","Went in early October and it couldn't have been more picturesque. The leaves were golden, air was crisp, and snow on the Tetons. We took one trail out to Phelps lake (~1.5 miles) and another one back, both easily walkable. There are a few trails to choose from depending on how far you want to go. Bring your lunch and eat on a rock by the lake. Unfortunately the visitors center was closed for the season, but still worth the stop to enjoy nature and the view. Has a fairly large parking lot and bathrooms."
260,Laurance_Rockerfeller_Preserve,Sep 2016 , Couples,"Andover, MA ",An amazing gift form the Rockefeller family,"One could spend hours just in the visitors center. An interesting design with space to meditate, you find peace even before you head out to the preserve. It is well worth the walk to the lake for wonderful scenery and wildlife.  The staff is very helpful, I took a photo of a bird which we could not identify, they enlisted a few ""experts"" on hand to help figure out what bird it was.  The only draw back is that they ( along with other sites) do not allow guides to go with visitors. We were on a National Geographic trip and were used to have experts to answer our questions as well as lead us to the best spots."
261,Laurance_Rockerfeller_Preserve,Oct 2016 , Couples, ,Loved the preserve!,Definitely worth the stop! Take some time to check out the trails. There are several to choose from - just don't forget the bear spray!
262,Laurance_Rockerfeller_Preserve,Oct 2016,not available,"Pleasant View, UT ",Beautiful hike to Phelps Lake,We visited the Preserve and did the hike up to Phelps Lake. The hike itself was gorgeous and once you got to the lake the views were stunning!! I would call this trail moderate as there were some inclines but nothing extremely strenuous. It was totally worth it!! You might even see some wildlife along the way.
263,Laurance_Rockerfeller_Preserve,Oct 2016 , Solo, ,Sunshine to hail,A quick trek into Phelps Lake gave us an idea of the changing nature of a fall day in the Tetons. It started out sunny and warm and ended chilly and hailing! It provided a good reminder to bring adequate clothing for whatever conditions you may encounter!
264,Laurance_Rockerfeller_Preserve,Oct 2016 , Couples,"Chagrin Falls, OH ",We visited every day of our trip!,"Lovely hiking and views. The center was closed for the season at the end of September, so we were sorry to miss it. Recommend taking a map from the bin, as not all of the trails are well marked."
265,Laurance_Rockerfeller_Preserve,Sep 2016 , Couples,"Jackson, WY ",Phelps Lake Hiking,Great launching off point to access Phelps Lake in a fairly easy hike that can run from an hour to multiple hours. Beautiful mountain lake with great fishing and splendid visuals. Summer makes the small parking lot problematic to park there as have to wait in line. But seems to move fairly quickly.
266,Laurance_Rockerfeller_Preserve,Sep 2016 , Couples,"West Chester, PA ",Wonderful Preserve,"We were staying in Moose, WY, and the LSR (Laurance S Rockefellar) was only a few miles down the road--what a wonderful area. We saw moose beside the road every time we drove by. The LSR has a number of hiking trails that are lovely--through wooded areas beside streams. Be Bear Aware however--they were there every day that we went there. Parking can be an issue as well-- its a very small parking area and we always had to queue up to wait for parking--the Visitor Center is nice--lots of reference books too."
267,Laurance_Rockerfeller_Preserve,Sep 2016 , Couples,"Guilford, VT ",Lovely Spot,"Great welcome center informative, friendly, clean. It's a beautiful spot with excellent views. Found it by chance but really enjoyed it."
268,Laurance_Rockerfeller_Preserve,Sep 2016 , Couples,"Lansdale, PA ",Quiet beauty,"The visitor center is worth experiencing. Trails are nice, though we didn't go very far on the day we were there. Scenery is wonderful, plants and insects abound. So grateful to the Rockefellers for letting all of us visit!"
269,Laurance_Rockerfeller_Preserve,Sep 2016 , Family,"Raleigh, NC ",Back bear sighting,"Nice, easy walks thru the preserve. Not disappointed with wild-life sightings. Parking may be a problem tho, as only X number of cars permitted. When we left, there was a line waiting for a space in the parking lot."
270,Laurance_Rockerfeller_Preserve,Sep 2016 , Couples,"Dallas, TX ",A Visit to Laurence Rockefeller Preserve,"This is found in Grand Teton National Park. It is a 1,100 acre refuge on the southern edge of Phelps Lake. It used to be an old dude ranch. It has great hiking trails and a building that shares some thoughts on national parks."
271,Laurance_Rockerfeller_Preserve,Aug 2016 , Couples,"Burbank, WA ",Nice launch point for hiking and history,"This area of the Teton Park is quite unique. There is an interesting, although not large, visitor center with a variety of exhibits. An interesting video collage is fascinating to watch and learning about the history of how the land became part of the park as a bequest from the Rockefeller family is great to know.    The Center is probably best used as a launch point for hikes into the Tetons. The short hike to Phelps lake above the Center is nice and can be a great way to introduce kids to the wonder of nature. Beyond the lake you can go deeper into the Tetons and actually hike into Death Canyon and elsewhere and come out at other trail heads.    The one thing that you should know is that there is limited parking at the Center's parking lot. This is by design to control the number of hikers and visitors to the area. If you arrive early you're likely to get a parking spot without the wait. Later in the morning and through the day you will have to wait in line until there is an opening when someone leaves the parking lot.    It's a beautiful area that is worth the wait, if you have the time and patience needed."
272,Laurance_Rockerfeller_Preserve,Sep 2016 , Friends,"Philadelphia, PA ",Beautiful preserve especially with autumn enhancements...,What makes this place so great is that it is handicapped accessible for a vast portion of it. So the exquisite scenery is available to all. Coming in the fall gave it wonderful color and you didn't have to go very far to appreciate it. The avid hikers had a longer path. The main entry facility had a four screen presentation of the area during all seasons. It is a great place to visit for everyone!
273,Laurance_Rockerfeller_Preserve,Sep 2016 , Friends,"San Antonio, TX ",Don't miss the visitors center,"This is a beautiful area that had been kept by the Rockefeller's for their private use, but was deeded to the park by Laurance to benefit all the people who visit Grand Teton National Park. The well maintained trails take visitors through varied environments in the area. Be sure to visit the visitor center which has a great library."
274,Laurance_Rockerfeller_Preserve,Sep 2016 , Friends,"Minneapolis, MN ","A beautiful, peaceful escape",This was one of my favorite hikes while visiting the Grand Tetons area. Parking is very limited (and controlled by the park rangers) so trails are not crowded and you can really enjoy the experience. The lake creek trail was just beautiful - touches all the senses. The lake view when you arrive is stunning. A very easy loop trail. We waited about 35 minutes for a parking spot to open up - well worth the wait! We also saw two moose on the Moose-Wilson road that you take to get here.
275,Laurance_Rockerfeller_Preserve,Sep 2016 , Couples,"San Francisco, CA ",A True Treasure,Wow... What an amazing place to visit! It was a highlight to our trip to Yellowstone and Teton National Park. This is a special place for quiet walks in nature and to appreciate the local environment. What a wonderful gift and legacy from the Rockefeller family. Five star!!!!!
276,Laurance_Rockerfeller_Preserve,Sep 2016 , Friends,"Naples, FL ",LRP,"I visited the week with a friend, I've been here a few times in the past. It is like a library, no gift shop. Very informative. We started up one of the trails & were rewarded with seeing a black bear with 3 cubs. Parking is limited but well with the wait to visit the area."
277,Laurance_Rockerfeller_Preserve,Sep 2016 , Couples,"Englewood, CO ",Fun pretty hike,"If you want a simple, easy, short, but very beautiful hike, go to LRP. You can add on to your hike to make it longer, or just go a short way, so it appeals to many different people. The only negative is that parking is not plenteous, and it is strictly regulated by the rangers. You have to line up for spaces and when a spot is vacated, the first car in line gets the spot. I'm not sure if they don't allow motor homes, so check this out first before going. The drive there is quite lovely as well. When we were there the leaves were starting to turn, so it was gorgeous. Because it's a fairly flat, well maintained trail, you can actually look around while you hike instead of watching where you walk! While we waited in line to get a spot, we took turns going through the visitor center which is a really interesting building, but has very little of interest inside. The lake is spectacular and the fact it is such an accessible hike everyone should take a little time to hike a short little hike, or add a bit of mileage to make it a bit longer. I've heard if you go early you can get parking easier. We also noticed there was no line for a spot as it got later in the afternoon. We went around lunch time, so there were about 8 cars ahead. We only had to wait about 20 minutes, so don't let the line discourage you."
278,Laurance_Rockerfeller_Preserve,Sep 2016 , Couples,"Fort Worth, TX ","Moose, Elk, and Bear!","Do yourself a favor and drive down Moose-Wilson Road. We saw a moose, a black bear (20 feet from the road,) and two elk. Be sure to stop along the way for amazing photographs."
279,Laurance_Rockerfeller_Preserve,Aug 2016 , Family,Arizona ,A MUST Do Hike,"This is an approximately 3.5 mile hike with less than 1000 feet increase in elevation. We do this hike multiple times each time we come to JH. The view up at Phelps Lake is gorgeous. You sometimes have to wait up to an hour for parking but honestly, it is so worth it! My 84 year old mother has been doing this hike every summer since they opened up this trail to the public. I hope I'm still doing it too when I'm 84!"
280,Laurance_Rockerfeller_Preserve,Sep 2016,not available,"Denver, CO ",Mid-day hike in Sept.,Glorious late summer day. Arrived at 11am and waited about 40min. for a parking spot. yes as you will have seen in many previous reviews that if you do not get their early you will wait for a spot to open. We just waited and took in the beauty of the area and were regaled with great stories and tips by the staff manning the entrance. Getting to Phelps lake is a fairly easy mile and a bit and then there are multiple options for long or short trails or just hanging by lake edge and again take in the stunning beauty and appreciating the generous gift of the Rockefellers to the GTNP.
281,Laurance_Rockerfeller_Preserve,Sep 2016 , Friends,Chicago ,Great Hiking,We hiked counter-clockwise around Phelps Lake and into the Death Canyon. It was gorgeous. We think it was about 9 miles.
282,Laurance_Rockerfeller_Preserve,Sep 2016 , Couples,"Melbourne, Australia ",An easy discovery walk,"It is a great reserve, a legacy of a soulful and generous man with wisdom and money. Enjoy an easy 1.5 hr walk to Phelps lake and back (you can also add the walk around the lake if time and strength permits, bring food and drink then). There is a free walk with a ranger at 9:30 am (check if it is on, they also take bookings). The ranger provides plenty if information and points out features we would not otherwise noticed."
