,place,date,category,place ,Tagline,Review 
377,Laurance_Rockerfeller_Preserve,Aug 2015,not available,"Texas Gulf Coast, TX ",Delightful Hike,What a wonderful area! A short hike takes you to the beautiful lakeshore. An easy way to explore the Tetons. Watch for bear!
378,Laurance_Rockerfeller_Preserve,Sep 2015,not available,"Jackson, WY ",A hidden gem of sensory discovery,"The LSR is housed in a small silver LEED building off the Moose-Wilson Road, just over a mile from Phelps Lake. Insurance designed it to engage visitors' senses, not their cerebral cortex. It features very intimate panoramic videos of the local forest & its residents during all four seasons. Buses are not allowed on this access road, and parking is limited to about 18 cars at a time. It holds a natural history library in addition to its enchanting exhibits."
379,Laurance_Rockerfeller_Preserve,Jul 2015 , Business,"Jackson, WY, ",A shrine to conservation,"When Lawrence Rockefeller announced in 2001 he was donating his 1,100 Inholding on the shores of Phelps Lake to Grand Teton National Park, it can be imagined some family members were dismayed who would miss the prime vacation getaway they had enjoyed for decades. Similarly Members of the local historic preservation movement were sad at the proposed movement of structures from the first guest ranch in Jackson Hole, the 1908 JY ranch, causing them to lose their in situ integrity. But Mr. L had a vision resulting in the entire region being returned to its undeveloped state.  With the construction of a visitor center, you might imagine a little bit of self congratulation on the Rockefellers part might be evident. But rather than that, the modest displays instead speak of the immediate region's impact upon all people. A moving poem by Terry Tempest Williams requires traversing the whole building to read. A circular meditation room with the sounds of the woods surrounding you allows you to experience the wealth of the area in an economical time. thousands of photographs of plants, animals and birds resolve to form a mosaic view of the lake and canyon when the viewer backs away from it. A 3-D relief map of the mouth of death Canyon invites you to explore further, along with handout maps to guide you on the easy to long nature trails. Finally, a reading room stocked with the works of leading local and global naturalists and conservationists is a priceless treasure for the curious of heart to discover with joy."
380,Laurance_Rockerfeller_Preserve,Nov 2015 , Family,"Bloomington, IL ",Peaceful and meditative,"The Rockefeller is off the Wilson-Moose between Teton village and Moose, WY. It is a short quiet walk from parking lot to the center. A beautiful and creative center to honor the Rockefeller family and its contribution to helping preserve the natural beauty of western Wyoming. Take another short walk to the rushing creek just west of the center. Im ADA and found the paths doable with my cane but could be very challenging to someone confined to a wheelchair."
381,Laurance_Rockerfeller_Preserve,Apr 2015 , Family,"Oxford,Ms ",A Great way to spend a morning or afternoon,"A very modern ,informative museum. Only a couple of years old  and Great exhibits. Great for kids ,also !"
382,Laurance_Rockerfeller_Preserve,Oct 2015 , Couples,"Woodstock, VT ",Great hike to Phelps Lake,"While driving along the Moose Wilson Road, headed south from Moose, we encountered the entrance to the Laurance Rockefeller Preserve on the left. We were late in the afternoon and the visitor center was closed, but the bathrooms were available. We looked around and read some information and realized that there were trail connectors to the Phelps Lake Loop Trail right there. You have a choice of two trails to get to Phelps Lake. We had come prepared to hike so took the Lake Creek Trail to get to the Lake and the Woodlands Trail to get back to the parking lot. Both trails were wide, scenic, moderate in climb and rewarding. All in all approximately two and a half miles total through a variety of woodland environments and tree types. The view across Phelps Lake toward Death Canyon is outstanding. There is a nice small rustic patio made with large stones right there along the lake and rustic log benches as well."
383,Laurance_Rockerfeller_Preserve,Oct 2015 , Couples,"Logan, Utah ",Wonderful visit during the summer,"This is a relatively new attraction very near the entrance to Teton National Park. A fee is required, and parking is limited - they recommend you come early to get a parking place, because you can only park in designated spaces. There is a wonderful visitor center which is very informative and attractive. The trail is very well kept, and essentially wheelchair accessible. The trail goes for (estimating) a couple of miles, mainly following a beautiful stream and is relatively level. We would definitely come here again. It is only open during the Park season, which is essentially the summer. We did visit it in October, and did quite a bit of free hiking, but the visitor center and restrooms were closed."
384,Laurance_Rockerfeller_Preserve,Oct 2015 , Couples, ,drive through wildlife!!!,we didn't even get out of our vehicle before seeing a bunch of elk (25 cows and 1 bull)... and on the other side of the parking lot was a stunning moose. incredible!
385,Laurance_Rockerfeller_Preserve,Jul 2015,not available,"Groton, MA ","A shrine to nature, a national treasure.","One really should not visit Jackson Hole without spending at least a morning in the Rockefeller Preserve. Our family and two others did the hike around Phelps Lake on a gorgeous, not-too-hot July morning. Very pleasant, mainly flat. Follow the trail clockwise and about 3/4 of the way around, there's a huge rock with about a 30-foot drop into the lake. Safe for jumping—our guys loved it. There's also a little beach less than 1/4 mile before the rock.    *** Of special note here is the visitor center, which is unlike any NPS visitor center I've ever been through. It's very much a quiet, meditative place, where one can ponder in gratitude the love of nature that prompted Rockefeller to ensure that these acres would be restored to their natural state and preserved for generations to come. Our teen boys didn't go inside the building when we visited, so before we left Jackson for home we returned so they could experience it—they loved it, too."
386,Laurance_Rockerfeller_Preserve,Aug 2015 , Couples,"Cedar Hill, TX ",Do not miss this place!,The hiking is spectacular. The Rockefellers donated this beautiful land. After our hike we visited the center which offered tons of information I found very interesting. Don't miss the slide show around the corner room. Great photos and sound!
387,Laurance_Rockerfeller_Preserve,Sep 2015 , Couples,"Greensboro, NC ",How wonderful that this land was saved for the National Park!,"This was of course once the private vacation property of the Rockefeller family, but because Lawrence Rockefeller donated it to the National Park, all can enjoy its natural beauty. We hiked a lovely trail to Phelps Lake, with its views of the snow-covered Tetons. Just spectacular."
388,Laurance_Rockerfeller_Preserve,Oct 2015 , Couples,"Monument, CO ",Quiet spot away from the crowds,"This is a good place to hike or ride horses on the southwest end of Teton National Park. Although we did not spy much wildlife, the solitude of this spot is heartening."
389,Laurance_Rockerfeller_Preserve,Oct 2015 , Family,"Seminole, FL ",Plan your visit.,"Arrived there two days late, the Preserve was closed for the season.  Must go before Oct 15th. Very picturesque."
390,Laurance_Rockerfeller_Preserve,Jun 2015 , Family, ,Unique experience in Grand Teton Park,A nice place to unwind and relax inside when the weather is too hot or raining. All the exhibits are well done and interesting and they even have recordings by LSR himself. They purposefully have a small parking lot to reduce the number if people visiting at one time. I love it.
391,Laurance_Rockerfeller_Preserve,Sep 2015 , Friends,"San Carlos, CA ",A cathedral to nature,"This beautiful information center was unlike any I'd ever been too. The building itself was gorgeous and we found it a perfect place to relax and celebrate nature. Do not miss the slide show with accompanying sounds of nature or the quiet room where nature sounds are piped in with multi-channel sound so you can quietly reflect. In addition, there is a great nature library to sit and read to simply enjoy a fire on a cold or rainy day."
392,Laurance_Rockerfeller_Preserve,Oct 2015 , Family,"Lynnwood, WA ",What a Stunning Place to Visit!,"Stunning and easy hike, nature at its finest! We took the relatively easy three-mile loop trail from the visitor's center to the lake and back. Nicest park facilities in the nation!"
393,Laurance_Rockerfeller_Preserve,Sep 2015,not available,"Tuscaloosa, AL ",Preserve Center Worth Jolting Ride,"Wow! Cool place! It is small but very well done. It is hard to get to. We went at the end of the fall season, so they probably were trying not to have to scrape the roads again before snow. But the road was terrible. My friend and I almost got sick in the back seat. But once you're in the parking lot, there is a nice restroom which does NOT stink yet is very green. Then you walk a very short way to the center. Inside, a giant fireplace warms you as you listen to a docent give a short talk. This one was about how animals stay alive in the winter. I learned that bears actually use everything in their digestive and excretory systems while they are hibernating. Then a young bear came to feed on the chokeberries around the building. Then we came back inside and enjoyed the video loops of the preserve in all seasons. There are quotes from Rockefeller on the walls that give you a chance to pause and think. I really enjoyed the sound room - an almost acoustically perfect area to listen to the sounds of nature and rest your eyes from the overload on that sense. Great coffe-table books everywhere near the fire. Loved it!"
394,Laurance_Rockerfeller_Preserve,Oct 2015 , Couples,"Wetherby, UK ",Perfect for a short hike,"The time of year and the weather helped, as the place was quiet. The Lake Creek and Woodland Trail Loop is an easy 3 mile circular walk with a gorgeous lake half way round,  but there are plenty of other trails if you want something a bit more strenuous."
395,Laurance_Rockerfeller_Preserve,Sep 2015 , Friends,"Jackson, WY ",Go..... Amazing hikes.,"Stunning, every part of this area... The walk to Lake Phelps is beyond description... Carry bear bells and spray, have seen a few up in that area... Be prepared to bee touched by the beauty..."
396,Laurance_Rockerfeller_Preserve,Oct 2015 , Couples,"Newton, MA ",Beautiful walk,"Very nice hike in GTNP; need to be wary of bears though, there are lots of bushes along the way with berries that are a popular food source."
397,Laurance_Rockerfeller_Preserve,Sep 2015 , Friends,Winston-Salem ,"A great, short hike","We hiked to the lake and enjoyed the well-maintained path to a gorgeous lake which was the ""front yard"" of the Rockefellers retreat. It was fun to imagine what it must have been like when there was a lodge sitting on the lake's edge--a breathtaking view from the shore."
398,Laurance_Rockerfeller_Preserve,Sep 2015 , Couples,"Frisco, Texas ",Come in September and be amazed by the aspens.,"What a blessing to have philanthropy with this much forethought. Of the 40 national parks we've visited, the Jackson Hole area of Wyoming has the place dearest to my family's hearts. This preserve gives you the chance to see moose, black and brown bears, elk, and lots of dear. If you've never spent a quiet moment in the woods and heard elk bugle then this is a perfect place to start. Bring your hiking boots to take advantage of the amazing secret places you can reach with good boots and a camelbak."
399,Laurance_Rockerfeller_Preserve,Jul 2015,not available,"New York City, NY ",It's now my desktop wallpaper!!!,"The hikes at the Rockefeller Preserve are not necessarily the most difficult, but they are among the most beautiful. When we reached Phelps Lake, the view literally took my breathe away. And because it's the ""Rockefeller"" Preserve, it is the most pristine and well cared for set of trails you can imagine. Wildlife abounds - a grizzily with her cub crossed the trail about 50 yds ahead of us."
400,Laurance_Rockerfeller_Preserve,Aug 2015 , Couples,"Macungie, PA ",Hiking,Perfect day of hiking to Huckleberry Point. Beautiful and easy hike.  Bring Bear Spray. Get there early because parking lot fills up fast.
401,Laurance_Rockerfeller_Preserve,Aug 2015 , Couples,"Pine Grove, PA ",One of the best short hikes.,Really nice hike to a beautiful lake. take a lunch and enjoy view. If late summer and good berry crop expect bears and closed trails.
402,Laurance_Rockerfeller_Preserve,Aug 2015 , Family,"Philadelphia, PA ",Must do,Must do activity! Beautiful! Black bears love the Hawnthorn berries in the fall. Fabulous visitor center building. Beautiful lake.
403,Laurance_Rockerfeller_Preserve,Sep 2015 , Couples,"Ammerbuch, Germany ",wonderful visitor center and good hike,"This is the most beautiful visitor center we have seen. Excellent architecture and new ideas like a listening room with birds, elk, ducks and weather sounds. Nice foots and installations. Definitely worth a visit and you should add a hike in the areas around Phelps lake. Limited parking."
404,Laurance_Rockerfeller_Preserve,Sep 2015 , Couples,"Coastal South Carolina, SC ",Good first day hike.,"Nice, easy hiking. Parking is limited, so be patient. Good hike to get adjusted to altitude if you are a flat-lander."
405,Laurance_Rockerfeller_Preserve,Sep 2015 , Family,California ,The power of nature and tranquility,Exhibits are few but superb. Great setting. Very friendly and helpful rangers. We enjoyed learning about the Rockefeller family.
406,Laurance_Rockerfeller_Preserve,Aug 2015 , Family,"Doylestown, PA ",Amazing but Arrive Early!,Wake up early. Very early. Enjoy your hike and then visit the center. This is an amazing place that is truly preserved by limiting the number of visitors. Wonderful hikes. We did the trail to Phelps Lake...then just kept going all the way around. Really enjoyed it. If I lived in the area this would be my go to area for afternoon hikes...if only I could get a parking spot
407,Laurance_Rockerfeller_Preserve,Sep 2015 , Friends,"Clinton, NJ ",Loved it !,This was a wonderful experience. The number of simultaneous visitors is limited so the peace and serenity of the preserve can be appreciated! Loved it
408,Laurance_Rockerfeller_Preserve,Sep 2015 , Couples,"Kissimmee, FL ",A Must See when in Grand Teton Park,Amazing facility. Beautifully done exhibits on nature both visual and audible displays. Library with many informative books. Nice trails with photo opportunities and ranger led educational series. Located off Moose Wilson Road which is a hot bed of wildlife.
409,Laurance_Rockerfeller_Preserve,Jun 2015 , Family,"Eastvale, CA ",Hidden Gem......,"No words to describe this gem .. The three of us sent out to visit the center, which is modern and clean. We ended up heading out to hike and wound up going on a two plus mile hike. We jokes to Lake Phelps , no words can decribe the views the scenery. One of us three was not in the best of shape, though he made it there and back, with little effort."
410,Laurance_Rockerfeller_Preserve,Sep 2015 , Friends,"Oklahoma City, OK ",Bears! Bears! Bears!,"Lots of great, easy, short trails but just driving down Moose Wilson Road to get to the Reserve you will likely see bears. Look for the berry bushes (trees) next to the road that are shaking and it is likely a bear.. .they ended up closing Moose Wilson Road the last day we were there due to increased bear activity close to the road. I highly recommend hiking any of the numerous trails in this area AND carrying bear spray. We saw a total of 4 bears from the road - all black bears. The visitor center is worth the stop... Oh! And be prepared for ""wildlife traffic jams"" for people watching the wildlife.."
411,Laurance_Rockerfeller_Preserve,Sep 2015 , Couples,"Greer, SC ","Great Trails, Great Views","Several beautiful trails lead out of here and they are well-marked. The Preserve is accessed from the Moose-Wilson Road, so the best place to get on the road is at Moose Junction. Parking is limited here; we hiked in early afternoon and managed to get a parking place. There are bathrooms available and a Visitors' Center. Wonderful spot for photos of the Tetons and beautiful Phelps Lake."
412,Laurance_Rockerfeller_Preserve,Sep 2015 , Family,"Honolulu, HI ",Rockefeller Preserve hike,"Relatively short and easy hike with great views and wildlife sighting. There is a visitor's center worth a stop, too."
413,Laurance_Rockerfeller_Preserve,Sep 2015 , Couples,"New York City, NY ",Excellent trails and beautiful visitor's center,"As we were traveling with my in-laws and toddler son, we were looking for a shorter, less challenging hike. We decided to hike the 3 mile loop to Phelp's Lake. The trails are in excellent condition and the view of the Lake is beautiful. We heard that there were many recent bear sighting in the area and saw a black bear quite close to the visitor's center. Make sure to get there by 9:30am or you may have trouble finding parking as the lot can only accomodate 40 or so cars. Definitely worth a visit!"
414,Laurance_Rockerfeller_Preserve,Sep 2015 , Family,"Hurst, TX ",Teton Visit,"variety of trails, 2 to 7 miles in length. Black bears frequent this area. Bathrooms & water at trail head."
415,Laurance_Rockerfeller_Preserve,Aug 2015 , Friends,"Wichita, KS ",Very Cool Place,"We decided to go here on a whim one day and I'm glad we did. They have a small visitors center that is pretty cool. We took the trail to Phelps Lake, which had a lot of scenic views on the way. Once we got to Phelps, we sat on the rocks and took in the sights. After resting for a little bit, we decided to walk the trail around the lake. We got about 20 yards on to the trail when a female Mule Deer scared the crap out of us, by jumping out from behind a boulder along the trail. We walked the rest of the way without animal incident. It was a long hike, and our feet were pretty sore by the end of it, but you had beautiful views of the lake the whole way. I would definitely recommend going."
416,Laurance_Rockerfeller_Preserve,Aug 2015 , Friends,Durham ,Access and Beauty,"This preserve is another pristine bit of wilderness. We were only there a brief time on our journey in the park, but enough time to recognize the gift that this place is to the visitors in the park. The trail is accessible and easy."
417,Laurance_Rockerfeller_Preserve,Aug 2015 , Couples,"Budapest, Hungary ",Hiking splendor,"Gorgeous setting, wonderful hike through a beautiful wilderness, moderate intensity, indigenous black bears on view along with other wildlife."
418,Laurance_Rockerfeller_Preserve,Sep 2015 , Family,"Washington DC, DC ",Gotta love those bears,Trip was first week in September which is apparently best time to see bears because of berry season. We got to the preserve around 830am. We were detained at the visitor center for two hours because of a momma bear and her cub. The momma bear we could see as she was on the trail. But the cub was in a berry tree right outside the center so we got some live entertainment. Even had to go inside once the bear crossed the wooden walk. The hike was nice to the lake though we saw no more bears but a few eagles.
419,Laurance_Rockerfeller_Preserve,Jul 2015 , Friends,"Jackson, WY ",Fun way to spend an afternoon,"On the Moose Wilson road, the hike to Phelps Lake is great and he length can vary according to your desire. Wild flowers galore during the season, July and early August best."
420,Laurance_Rockerfeller_Preserve,Aug 2015 , Family,"Boston, MA ",Bears!,"Good trails, and when we were there (late August) the berries were ripe in the bushes all along the visitor center, so bears were frequenting the area. We saw one quite close."
421,Laurance_Rockerfeller_Preserve,Sep 2015 , Couples,"Dallas, TX ",Don't Miss This Place,"It only takes a few minutes, but what is in this center will astound you. It is not just another memorial, they have done a good job of linking nature to the enrichment our lives."
422,Laurance_Rockerfeller_Preserve,Sep 2015 , Family,"Central City, IA ",Black bears all over,The bears were all over eating berries. l  Lots of easy hiking trails but the most by the creek were fairly dense so make a little noise to let the bears know your coming. They weren't shy but we didn't want to surprise any We also saw elk and pine squirrels right by the visitor center.
423,Laurance_Rockerfeller_Preserve,Sep 2015 , Couples, ,Enjoy this extraordinary place!,"Beautiful, spectacular and thoroughly exciting. We saw moose, pronghorn antelope, deer, lots of elk including a couple of large bulls and a bear that came a little closer than I would have liked. It was a black bear that was just passing through and was vey uninterested in us."
424,Laurance_Rockerfeller_Preserve,Sep 2015 , Couples,"Bethlehem, PA ",Nature's best,"Moose Wilson Road is a great place to see bear and moose; however, do not be surprised to see hundreds of other cars riding back and forth on the same road as you are on. It is about 9 miles long.    The LR Preserve is a great place for family and kids."
425,Laurance_Rockerfeller_Preserve,Aug 2015 , Solo,"Naples, FL ",Wildlife,Excellent place to see Bears in the park. Many nice trails and sights. We went early and always saw wildlife.
426,Laurance_Rockerfeller_Preserve,Aug 2015 , Friends,"Fuquay-Varina, NC ",Great Place to visit!!!,One of the best and well done museums I've been to and includes great hiking/walking trails!!!! don't skip it!!!
427,Laurance_Rockerfeller_Preserve,Aug 2015 , Family,"Englewood, FL ",Nice place to hike; saw a bear,"We stopped here for a quick hike to Phelps Lake. While we were there, a bear was visiting near the visitor's center. We got to spend quite a bit of time watching the bear eat berries from the nearby bushes. It's a serene place, but tends to be rather busy and popular. Parking is limited to about 40 cars, but we had no trouble getting a spot in the late afternoon."
428,Laurance_Rockerfeller_Preserve,Aug 2015 , Business,"South Lake Tahoe, CA ",Serene & Beautiful,"One of the many beautiful walking places to visit in the Grand Teton National forest....quiet, beautiful, serene, understated,"
429,Laurance_Rockerfeller_Preserve,Aug 2015 , Family,"Seattle, WA ",Serene,"Breathtaking preserve, beautiful visitor's center! We came here in mid-afternoon and although the parking lot was full, we waited only a brief time for a spot to park. The preserve has an easy hike to Phelps Lake. Although the park is crowded, we never felt it on the hike or eating lunch at the lake. There is something magical in the air here. It's the Grand Tetons so of course it's beautiful, but there is something some special here. The park has a warning for bear activity. We were fortunate to see an adolescent black bear near the bathrooms adjacent to the visitor center. Give the visitor center a look, there are great books for adults and children. Also, this is not a place to clean out the car. The facility is zero waste and including the composting toilets."
430,Laurance_Rockerfeller_Preserve,Aug 2015 , Couples,"Austin, TX ",Great pictures,Just drove through but there were nice views and early morning wildlife. We saw Bison by the road on one side and small deer on the other.
431,Laurance_Rockerfeller_Preserve,Aug 2015 , Couples,"Dallas, TX ",One of the Best National Parks We've Every Visited!,"Our first trip to Jackson Hole but it won't be our last - staying away from the touristy center of Jackson, we ended up going north into the National Park and took a side trip to the Laurance Rockefeller Preserve. Absolutely beautiful and very peaceful, you have a choice of several short hikes either up to and back from the lake or further afield. However, none of the hikes are overpowering. I'm very glad the Rockefeller family chose to donate this area to the benefit of all future generations. We'll definitely go back. Good tip - get here early because parking is limited and you will have to wait in line for an available spot if the lot is full."
432,Laurance_Rockerfeller_Preserve,Aug 2015 , Couples,"Avon, CO ",RELAX,"How wonderful that he set aside this area for all of us to enjoy, and so smart in keeping it small!! Outstanding staff and great information for us to absorb!! Very worthwhile trip and great route down to Jackson!!"
433,Laurance_Rockerfeller_Preserve,Aug 2015 , Family,"little rock, United States ",Get Here Early,This is a beautiful hike to a beautiful lake. You need to get there early to get a parking spot. During this time of year you really need to watch for bears. The Hawthorn tree's are bearing fruit and the bears love it and they are all around the area. The Rangers and staff are very helpful. There are several trails and different levels of difficulty. The trail to the lake is very family friendly. You can take a 7 mile hike around the lake to extend your 2 mile hike to the lake.
434,Laurance_Rockerfeller_Preserve,Aug 2015 , Family,"Scottsdale, AZ ",Good place to see wildlife,"Just drove though the preserve as it was pouring down rain. It had a place to stop and get information and learn more about the preserve. We saw a deer and a black bear on the way to the preserve, which was awesome!"
435,Laurance_Rockerfeller_Preserve,Aug 2015 , Couples,"New York City, NY ","Awesome Hiking, etc.!","Excellent hiking in this pristine nature preserve with several riparian features. And, don't miss the excellent visitors center."
