,place,date,category,place ,Tagline,Review 
66,Moose-Wilson-Road,Sep 2018 , Couples,"Chicago, IL ","Great Road for Wildlife, But Go Slow!","An absolutely beautiful road to drive. You’re not going to get scenic views of the mountains, but you will drive along a tight, mostly dirt road that hugs the trees, which means ample opportunity for wildlife. In a half hour, we saw a cow moose and her calf and a racoon. Other people that same day saw bears, elk, and a bull moose. It is a must drive. However, unless you have an off-road vehicle, be careful. Everyone should drive the speed limit or under. Don’t let people behind you rush you. They can wait. It’s for their own safety. Wildlife can dart out at any moment, killing you, themselves, and/or totaling your vehicle. So, better safe than sorry. Anyways, you’re in the wilderness. Enjoy it! Why the rush?"
67,Moose-Wilson-Road,Jun 2019 , Family,"Minnesota City, MN ",Hidden Gem,"Just as the name suggests, its a great opportunity to see a moose and possibly fairly close. Not a guarantee and a little off the beaten path, but worth it if you are lucky enough to see one or two"
68,Moose-Wilson-Road,Jun 2019 , Couples,"Frankfort, IL ",Winding Narrow Road,"This road really looks like you should see wildlife on it but unfortunately, we didn’t. The road is very narrow and you have to be careful because there are lots of curves. We were on it in the daytime, I’d warn you to never drive it after dark if it is unfamiliar to you. Maybe you’ll get lucky and see some things! I rated it very good because how could it not be with the Grand Tetons all around it?"
69,Moose-Wilson-Road,May 2019 , Friends,Arizona ,Beautiful Drive!,"Take this slow going, scenic drive for chances of spotting wildlife and beautiful landscapes! And yes...Moose!"
70,Moose-Wilson-Road,May 2019 , Couples,"Mesa, AZ, ",Vacation,At the start of our vacation in Jackson hole we drove just a little bit up the street and took a ride here. We saw our first Moose
71,Moose-Wilson-Road,Sep 2018 , Couples,Paradise  ,I love this road,I first traveled on this road when it was just gravel. Now it is a paved backroad. It is a lovely route.
72,Moose-Wilson-Road,Jun 2018,not available, ,Great backdoor to the park,"This road is literally less traveled that other roads into the park. It is a dirt road that is well graded. No need to worry, you rental car will be fine. You may actually see Moose and Bears on the side of the road!"
73,Moose-Wilson-Road,Sep 2018 , Couples,"Monmouth, OR ",Wildlife galore,"Bears, Moose, Elk, Deer, Antelope, Birds, its all here! Go slow, The road is narrow, very narrow in places, and some folks are not good about sharing, so be fore warned. There is abundant wildlife there, especially in the evening!"
74,Moose-Wilson-Road,Oct 2018 , Solo,"Indianapolis, IN ",No Moose! But worth driving up and down this road!,"Determined to see a moose, I drove this road 4 times on 2 different days. I ran into lots of folks who'd ""just seen one"" but I never actually saw a moose myself. (""You just missed them...they went that way..."") The road in the fall was gorgeous. So many beautiful trees and then it began to snow. Wow! A small lovely road."
75,Moose-Wilson-Road,Oct 2018,not available,"Greater Sydney, Australia ",We followed a recommendation from the Visitors Center,"We were driving a hired AWD vehicle so took this good dirt road alternative to Jackson and were fortunate to see a young bear cub pup at play beside the roadway, not sure where Mum was, but this was a highlight of our visit, as well as the phenomenal scenery."
76,Moose-Wilson-Road,Oct 2018,not available,Sydney ,Moose family!,"We were so lucky on our first day in the Grand Tetons to see a whole family of moose. There was mum, dad and youngster, just beside the Moose Wilson Road. Mum in particular was enjoying eating the vegetation in the swamp, and very vocal about it too!"
77,Moose-Wilson-Road,Sep 2018 , Couples,"Florence, KY ",Moose or Elk,"Didn't see any moose but saw lots of elk. Everyone has ""fake"" moose cutouts along the road. Kept hitting brakes until I figured out what was going on."
78,Moose-Wilson-Road,Sep 2018 , Couples,"Lemont, IL ","Elk, bears, moose!","If you are in the Tetons, you have to take the Moose Wilson road at least once. Go morning or sunset and you will surely see wildlife. We saw bear crossing at mid morning even! Go slow. Take your time. Even if you don’t encounter wildlife...the road through the dense forest is beautiful. Another reason to head west!"
79,Moose-Wilson-Road,Sep 2018,not available,"Sheridan, WY ",Lots of traffic,Went just before dusk hoping for wildlife. Lots of cars going both ways. Did not have many places to pull over and look around. I wouldn’t make it a must see on my next trip.
80,Moose-Wilson-Road,Sep 2018 , Couples,"Coffs Harbour, Australia ",Our stay at Wilson,We had a Air b n b at Wilson on the Moose Wilson Road. After being at Jackson Hole we were so glad that we were staying at Wilson it is much quieter! This road is a lovely drive especially in Autumn ( fall ). It also is part of the Grand Teton Loop Rd
81,Moose-Wilson-Road,Oct 2018 , Family,"Greenville, SC ",Wildlife live here,We saw a moose and her calf along this road. They were just grazing along and taking their time. Wonderful.
82,Moose-Wilson-Road,Sep 2018 , Couples,"Independence, KY ",Wildlife Central!,"Oh my goodness, the bears were everywhere on this road...up close and personal! This is a paradise for wildlife seekers and probably a nightmare for the poor Park Rangers monitoring this area! We did not see any moose in this area but we did see many elk."
83,Moose-Wilson-Road,Sep 2018 , Couples,"Port Orchard, WA ",You will likely see moose,"We took this road and seen moose both times we were on it, both were different moose. Easy to access, a must if your close. The scenery is absolutely amazing!"
84,Moose-Wilson-Road,Sep 2018 , Couples,"United Kingdom, ",Be patient and factor in the road conditions and the rangers,"This road is very narrow and windy and there are few places to stop, so if you do see wildlife you'll be lucky if you can stop safely. Factor in that the rangers are also keeping an eye on what's around and moving people on or further back accordingly.    That said we drove the road 3 times and got a glimpse of a bull moose behind a tree, a mother and calf sitting in the grass, a bear cub running across the road (mum had already crossed) and a bear up a tree by the side of the road where we couldn't stop and two people were already blocking the road.    There are places where you can park and get out and walk and there is birdlife, so I also watched Mergansers in the pond and a Heron catching fish/frogs etc. There are lots of people, but its still a great place to see wildlife."
85,Moose-Wilson-Road,Oct 2018,not available,"Kansas City, MO, ",Best place in the park for wildlife viewing,We saw so many moose here. Also saw a black bear with 3 cubs feasting on Hawthorne berries. Saw an elk as well. In the past I spotted a great grey owl here. Road is fairly narrow in places.
86,Moose-Wilson-Road,Sep 2018 , Couples,Fort Atkinson ,Okay - if you see wildlife. Otherwise just a road.,"We didn't see anything. While I realize that animals aren't on display and don't follow a human schedule, it isn't like some areas of Yellowstone where you will see wildlife no matter when you go. Given that your road options are limited it is a positive that it is a low stress route."
87,Moose-Wilson-Road,Sep 2018,not available,"Orlando, FL ",Tooooooooo many people,"Definitely great for wildlife but overly crowded. People are crazy. Had black bear eating in berries on edge of road in tree, cubs behind her in Aspen. Wonderful site but within minutes overwhelmed with people, including stupid people who were too close for safety and of respect to the poor bear trying to get ready for winter. I would say a toxic combo. Only did it once because of people insanity."
88,Moose-Wilson-Road,Sep 2018 , Family,"Melbourne, FL ",Wildlife!,"We drove this road several times during our stay. For all those times, only once did we not see game (mid-day) - bears, moose, elk. The rangers do have a strong presence here, so it can sometimes be a little frustrating, as they wave you on without your being able to see the animals. And there can sometimes be traffic backed up, due to people trying to view. The bears seemed to be the biggest issue, as they were usually in the trees."
89,Moose-Wilson-Road,Sep 2018 , Couples,"Marysville, OH ",Definitely a Must!!!!!,"We drove this early in the morning from Teton Village/Wilson end to Moose and back. The aspens were gorgeous and there was a lot of beautiful, natural plants and bushes in fall colors. We saw a bear with 2 cubs up in the aspens next to the road, literally above our heads. Two rangers were directing traffic giving cars plenty of time to take pics. We saw a bull moose in the marshy area and close enough to get good pics. The road is initially dirt but quickly becomes paved. No problems on dirt portion."
90,Moose-Wilson-Road,Sep 2018 , Friends,"Washington, D.C. ",Go slow and see wildlife,"My sister in law lives in Teton Village so this road was our normal pass each day. What we saw....moose, bear, fox...."
91,Moose-Wilson-Road,Sep 2018 , Couples,"Chicago, IL ",Wildlife viewing backroad to and from Jackson Wyoming,Moose-Wilson road is an alternative route to and from Jackson Wyoming and the Grand Teton National Park. It proved to be an excellent wildlife viewing opportunity. We saw Moose and Black Bears up close and personal! Getting to the road from Jackson takes you by Teton Village and an opportunity to view wildlife of a different kind! This is a scenic route worth your time.
92,Moose-Wilson-Road,Sep 2018 , Couples,"Linthicum Heights, MD ",Morning or Evening is a must,"If you want to see animals, this is the stretch of road. We stayed in Wilson, so we would drive this stretch from 7 pm to 8 pm every night. We saw bear, moose, deer and elk constantly. We looked forward to doing this every night. Tip: if you are looking for animals, pull over when you can to let other cars go by you that may not be animal watching. Be polite."
93,Moose-Wilson-Road,Sep 2018 , Couples,"De Pere, WI ",Wildlife Viewing Opportunity,"In our trips to the Grand Tetons National Park the Moose-Wilson Road has provided us with more wildlife viewing than any other location in the Park. We usually start near the Moose Visitor Center and drive to the Laurance Rockefeller Preserve and turn around. The Moose-Wilson road continues beyond the Rockefeller Preserve (all the way to Jackson), but the road gets rougher and we have not seen wildlife along this stretch of the road.    We usually drive the roadway at least three times per day when we are in the park  .  As you drive the road from the Moose Visitor Center your first opportunity will be the sawmill ponds. There is a good size parking lot at the location, which overlooks a pond and wooded area. You will have a good opportunity to see moose at this location but unfortunately the moose while visible will be a long ways away.    As you continue on the road, the next two miles follows a low marshland. Look for moose, bear and coyote along this stretch.    On our recent three day trip to the park, we viewed the same two moose on each trip through for two days, we saw a small coyote twice (once eating berries along the road), and on our last trip we saw a black bear with her three cubs in a tree eating berries.    If you drive the road and don’t see anything, don’t give up. Wait a few hours and drive it again."
94,Moose-Wilson-Road,Sep 2018 , Couples,"Inverness, UK ",Disappointing,"Billed as very narrow and winding, we decided to take this road winsome trepidation. Shouldn’t have worried though as it is a straightforward drive and there was no difficulty passing traffic coming the other way - of which there was a lot. The volume of traffic may have explained the absence of wildlife. The thickness of the woodland also meant that the drive was not particularly scenically attractive    We were staying East of the Teton pass so at least this route had the distinct advantage of not having to drive through Jackson to get back to our B&B."
95,Moose-Wilson-Road,Sep 2018 , Couples,"Clermont, FL ",You never know what to expect,"We participated in a Wilderness Caravan offered by the park service and this was our last stop. As the sun went down, we saw a moose and calf as the sun set. We returned the next morning to find a mother black bear and 3 cubs feeding in the brush. Lots of great pictures during both visits."
96,Moose-Wilson-Road,Sep 2018 , Solo,Queensbury ,Tetons,A must when traveling the Tetons. Many animals including moose. Narrow road being worked on currently. Unpaved in areas.
97,Moose-Wilson-Road,Aug 2018 , Family,"White Plains, NY ",Watch out for that wily,"COYOTE! And the Osprey, and the moose! It's a beautiful road, but winds, and you must be quite careful to not harm any wildlife or yourself! Drive safely in this beautiful atomosphere."
98,Moose-Wilson-Road,Oct 2017 , Family, ,Worth the side line,We stopped for a short while - it was definitely worth the side stop 😊    If you love wildlife or to tick boxes - we found this easy as 🥧
99,Moose-Wilson-Road,Jun 2018 , Couples,"Macon, GA ",What an adventure,"We had some time to kill so someone had suggested to us to take this road. First curve we saw a huge moose. Later we saw a bear. The road is a little rough, so travel slow. But you are almost guaranteed to see wildlife."
100,Moose-Wilson-Road,Aug 2018 , Friends,"La Quinta, CA ","A little rough and narrow at times, but worth the drive.","We visited Teton National Park and took the main road into the park. Upon leaving we took the Moose-Wilson Road, which can be rough and narrow at times but it's the best road to view Moose if they are in the area. Then stop at Calico for dinner!"
101,Moose-Wilson-Road,Aug 2018 , Solo,"Danville, CA, ",Great Short Cut When Open,"We were staying in Teton Village. For the first few days, the Moose Wilson road was closed because the bears were on the road eating berries. So to go into Grand Teton or Yellowstone, we had to drive south, through Jackson then north into the parks. On the last day, Moose Wilson Road opened. It's a very narrow winding road. You have two slow when approaching cars coming the other way. For the first part, there are some nice views. Then the vegetation gets pretty thick. It does save some time. And it was a nice change of pace from the more circuitous route."
102,Moose-Wilson-Road,Jul 2018 , Family,"Westfield, IN ","Beautiful (but bumpy) ride, and no moose for us",We drove in during early evening hours on Moose Wilson but unfortunately did not see any moose on our drive. Either way the road is beautiful!
103,Moose-Wilson-Road,Jul 2018 , Couples,St Louis ,Went looking for Moose,Took the Moose Wilson road looking for moose and was not disappointed. Took the road on three occasions and saw Moose every time. Usually very close to the road. There are signs that flash when Moose are in the vicinity.
104,Moose-Wilson-Road,Jul 2018 , Family,Stamford ,Scenic drive but no moose,"We drove here about an hour before sunset and although it was picturesque, we didn't see any moose. We had the Gypsy app and the commentary on this road was good. I was glad we did it to see another part of Grand Teton."
105,Moose-Wilson-Road,Jul 2018 , Family,"Pittsburgh, PA, ","3 Elk, 1 cow and one Bull Moose plus a bald eagle",Try getting to the gate by Teton village area undo an hour before sunset. We went twice once in the afternoon and saw nothing. Returned in the evening and saw two moose and a bald eagle gram a fish out of the water.    The road is easy to drive speed limit is 20 mph. Take it slow and hopefully you get lucky
106,Moose-Wilson-Road,Jun 2018 , Family,"Palmdale, CA ",Good spot for moose sightings,"It's hard not to see wildlife in the Jackson/Grand Teton area....bison, pronghorn, and mule deer are plentiful. If you want to see a moose, this road is aptly named. We drove it two separate times during our stay in Jackson and saw moose both times.    Our Tip: Go just after sundown (dusk)....in late June this was around 9:00. We saw a big moose munching on some bushes right near the road in someone's front yard.    If you plan on driving the full length of the road, be advised that the road condition deteriorates quickly once you pass Jackson Hole Ski Resort and enter the National Park....it gets really bumpy.    Also, make sure to check out the water just south of Teton Pass Highway (right before you turn on Moose Wilson). We saw a cow and calf here as well."
107,Moose-Wilson-Road,Jul 2018 , Family, ,Lives Up to Its Name,This road has a scenic overlook for moose habitat- we were very excited to see 2 moose along our drive! Road can be narrow at times and part of it is dirt road but certainly doable. Beautiful views of wildflowers and river along the drive into Teton.
108,Moose-Wilson-Road,Jun 2018,not available, ,Had heard we would see moose(s) along the way. we saw 1...1 only!,Had heard we would see moose(s) along the way. we saw 1...1 only!  In all of grand teton this one was the only one we saw.. maybe they were all somewhere else for a meeting or party! :)
109,Moose-Wilson-Road,Jul 2018 , Couples,"Nine Mile Falls, WA ",Narrow road,This is a short cut from Wilson to moose and it bypasses Jackson. They say no rvs but a pickup camper will do fine as long as others are not hogging the road. Several peoples jaws dropped as we passed..
110,Moose-Wilson-Road,Jul 2018 , Family,Maryland ,"Take your rental car, SUV preferred","We took Moose Wilson Road from the inner parkway of Grand Teton NP to Jackson Hole area. The first stretch was paved narrow road, but the last mile or two was all gravel and very bumpy. I kept telling myself glad it was a rental car and SUV. We were hoping to see moose along the way, didn't see any wildlife at 2:00PM or 6:00PM."
111,Moose-Wilson-Road,Jun 2018 , Family,"Bowling Green, KY ",Challenging but Interesting,"This is a rough-riding road full of massive pot holes but lined with wildlife. We saw deer, bears, and an osprey. There is a speed limit posted but not necessary because the road is so rough you have to drive slow."
112,Moose-Wilson-Road,Jun 2018 , Friends, ,So scenic,I love taking this back road route to and from Teton Village. It can get a bit rough though. And they were doing construction this last trip so things can get a bit backed up but it is always so worth it to me. It’s such a beautiful drive and always tons of wildlife along the way! A must do at least once if you’ve never tried it!
113,Moose-Wilson-Road,May 2018 , Couples,"Uniontown, OH ",Get off the beaten path and away from the crowds!,"Yes, it's a slow-moving back road, but you get away from the crowds and get the feeling of really being out in the woods. We drove this 3 times and each time it was beautiful. Just be careful of heading east to west around rush hour if you are planning to drive through Jackson Hole. The traffic looked to be backed up for miles and miles!"
114,Moose-Wilson-Road,Jun 2018 , Couples,"Wichita, KS ",Great drive for wildlife spotting!,"We drove this road twice and were lucky to see a large moose just off the road. Take the drive slow as the unpaved portion of the road is pretty rough in some spots. I would never drive this road in a rental car or low clearance vehicle, but an AWD SUV handles it just fine. Be careful and watch for potholes and large mammals! The road is mostly forested, so you are not doing this drive for scenery, just for wildlife. I would recommend this as a great drive to make on a cloudy day when the surrounding scenery is obscured by clouds."
115,Moose-Wilson-Road,Jun 2018 , Couples,"Santa Cruz, CA ",Slow and quiet,"This lovely road is off limits for buses, rvs, and cars with trailers--so it's quiet and slow. It's actually a dirt road for a big section. Very, very pretty views. If you want a feast for your senses, stop at the Rockefeller Reserve. This is part of the National Park, but is completely different than the other visitor centers. Stroll through several rooms that don't TELL you things--they invite your senses to see and especially HEAR. And once you have sat quietly and acclimated your senses, take the hike to Phelps Lake. Suddenly you are seeing. You are hearing. The Forest is alive. Because the parking is very, very, very limited (on purpose), the trails are quiet; the lake overlook is quiet--just one or two other families. This is the antidote to the Jenny Lake crowds. The hike is easy though, so families can enjoy it. Can't recommend it enough. Get there when it opens at 9!"
116,Moose-Wilson-Road,Jun 2018 , Family,"Ringgold, GA ",You will see a moose!,We love this road. We drove it three times while in Jackson last week. We saw two moose! One was right next to the road and very close. The other was at the moose pond just south of the junction. Beautiful road between Moose and Teton Village.
117,Moose-Wilson-Road,Sep 2017 , Couples,"Missouri City, TX, ",Rough road,We drove this twice in September when we were in the area for a few days. We didn't see any animals but we still enjoyed the pretty drive through the trees. It was a little of a rough road with our rental car but not that bad.
118,Moose-Wilson-Road,Jun 2018 , Family,"Carrollton, KY ",Boys trip 2018,Lots of wildlife and great views. Have to drive slow but seeing moose and beavers was worth it. Enjoyed the trip and would recommend.
119,Moose-Wilson-Road,Jun 2018 , Family, ,Pretty cool,Drove this road at least twice and saw wildlife both times. Only problem we’re those who were inconsiderate and didn’t move their cars over far enough and didn’t care to move and let anyone through.
120,Moose-Wilson-Road,Jun 2018,not available, ,Road condition is excellent right now.,"About a mile of this road is unpaved near the town of Teton Village, which they had recently graded in June. Passenger cars can easily access the road. The road is a nice short cut from Teton Village to the national park and ends near the visitor center. Many people use this road to view wild life; however, we never had much luck. We saw an elk or two and that was pretty much it, although we did meet people who did see moose at one of the pull outs. You cannot just stop in the middle of the road! It's a very narrow, 2-way road, so only park when there's an obvious turnout. The area is pretty and there's a few trails here (park at the The Laurance S. Rockefeller Preserve).    I've read accounts of how rough the road was and I assume that the unpaved portion deteriorates at some point. So, if you're uncertain about the conditions, call the park to get an update. There's a park booth at the start of the road just past Teton Village."
121,Moose-Wilson-Road,Jun 2018 , Family, ,Something different every time,"I first visited the Tetons in September, and there is almost no better place to enjoy a drive through the colorful aspens than this road. It is also the home of many different creatures that are often easily spotted here. We saw a young black bear. It walked right in front of our car. There are also owls, moose, and varied songbirds that are commonly seen here. I visited this place last week and observed a spectrum of flowers and colorful birds. It is one of my favorite places in the park."
122,Moose-Wilson-Road,May 2018 , Couples,"Cleveland, OH, ",Disappointed,Drove this road twice in one day in May 2018 and saw no moose anywhere. Saw some pronghorn and elk but thats it.
123,Moose-Wilson-Road,May 2018 , Couples,"Portland, MI ",Vacationing,Started vacationing with Jackson Hole Hideout bed and breakfast! Luxury before outdoor experience that will be remembered for a lifetime!
124,Moose-Wilson-Road,May 2018 , Couples,"Atlanta, GA, ",Muddy and rough this time,Drove it a couple of times and only saw an elk but the road was rough and muddy due to recent rains.
125,Moose-Wilson-Road,May 2018 , Couples,"Boston, MA ",Interesting Small Gravel Road,"The main reason to travel this road is to go from Moose to Teton Village, where the ski resort is. Also the Rockefeller Preserve is along here. The gravel part of the road is fine, but some drivers seemed challenged by it. Not as scenic as the Jenny Lake loop and so forth."
126,Moose-Wilson-Road,May 2018,not available,"Aurora, CO ","Tough road, no moose in sight","We drove past the paved road to the dirt road. This was midday and we did not see any moose. Many other people so see moose on this road. Best times to see wildlife is early morning or.sunset, as advised by our park guide."
127,Moose-Wilson-Road,May 2018 , Couples,"Maybell, CO ",First Visit!,"Found this alternate route for our way back to Jackson from the Park. Very narrow road, in fact, they don't allow cars with trailers or lengthy Class A campers. We saw a moose but so did everyone else which caused a traffic jam."
128,Moose-Wilson-Road,May 2018 , Friends,"Boise, ID ",Open for the season!,"Moose Wilson Road just opened while we were touring the park. On the first drive through we saw 2 moose (meese? messen?) grazing in the willows. The road is a fun drive, even if it doesn't save you time, but with Jackson Hole having construction on Gros Ventre and the intersection with the Highway going over the mountain to Victor, ID, it may be your only construction free way around those obstacles."
129,Moose-Wilson-Road,Sep 2017 , Couples,"Alton, New Hampshire, United States ",Did not disappoint,I had expected to see wildlife the length of the road but the greatest sightings were at the pull off closest to the parks pay to enter toll area. We saw several moose at this location and got great photos.
