,place,date,category,place ,Tagline,Review 
130,Moose-Wilson-Road,Oct 2017 , Friends,"Menifee, CA ",Iffy,"This road connects the Teton Village area with the small town of Moose, just outside the Grand Teton Park. The road in parts is dirt and at times is not passable without a 4 wheel, small low cars are not advised. This year as in most it is graded."
131,Moose-Wilson-Road,Sep 2017 , Couples,"Muscle Shoals, AL ",Beautiful but narrow,"This is a great drive if you have the vehicle for it. We were in a 4x4 Tahoe. The day we went, snow was melting and the part of the road that turns into gravel was messy. Our white vehicle was no longer white. Parts of the road a very narrow. We did see two sets of mother black bear and their cubs. This made the mud worth the drive. I would not recommend this drive in a car, but we saw several people in cars making the drive."
132,Moose-Wilson-Road,Sep 2017 , Couples,"Miami, FL ","Quite Bumpy, but good for seeing wildlife","We had to take this road on most days to get out of Teton Village and to Yellowstone or just going north. We saw a grizzly and her two cubs two separate days, then we saw a cub right by the road on a 3rd day. Saw Moose from far, but they were laying down and were hard to see. Finally, we did see an elk bull and several female elk. They were were bugling and that was amazing!!! Best to see them in the early morning or late evening. It is a rough road with lots of potholes, but they may keep it this way to slow down traffic."
133,Moose-Wilson-Road,Sep 2017 , Friends,"Ballycastle, UK ",Bumpy,Drove this road twice this week and saw neither bears or Moose! Just unlucky I suppose! It is known as a top wildlife viewing area but the wildlife doesn't always oblige. Part of the road is badly potholed and care is needed. I'd recommend taking a look and hope that the animals are on view.
134,Moose-Wilson-Road,Sep 2017 , Couples,"Austin, TX ",Don't miss it!,"We drove home from Grand Tetons to Jackson via this road at dusk. Don't miss it! We saw several moose - kind of causing a traffic jam on this narrow mountain road, so there were park rangers out to direct traffic!"
135,Moose-Wilson-Road,Sep 2017 , Business,"Chicago, IL, ",Moose,I have driven this road before. It's a bit crowded. And it's real bumpy at points. But I saw two moose. One was a male with full horns. Worth a try for sure.
136,Moose-Wilson-Road,Sep 2017 , Family,SF Bay Area ,Moose Siting,One of the things I wanted to experience on this trip was to see a moose in the wild. I asked at the Visitor Center where they had seen them lately. I was told Moose Wilson Road. We went one morning at around 9:30. The ranger we stopped to talk with said that they were out earlier in the morning. We went back the next morning at 8:00 and there they were. It was an experience I won't soon forget.
137,Moose-Wilson-Road,Sep 2017 , Couples,"Stevensville, MD ",Great Opportunity for Wildlife Viewing,"The area is a top spot for wildlife viewing and hiking. We have been on this road several times over two separate trips to the area. We have seen Bears, Elk, and Moose. The road is about 10 miles long and is one entrance to the Grand Teton National Park. There are viewing opportunities all along the road, but the most popular area is a pulloff near the main Grand Teton entrance side to the road. This area is really popular for possible bear and moose sightings. While cars can access this road, there is about a 1.5 mile stretch this not not paved and can be rough in areas."
138,Moose-Wilson-Road,Sep 2017 , Couples,"Pahrump, NV, ",Great Road,"We took this road and enjoyed the scenery. Into the drive down this road, we came across a large group of people we scopes and long lens on cameras...they were looking at a mother bear and two cubs in a tree. We stopped and watched, eventually seeing the mother bear come down followed by here cubs. They paused and waddled off up the hill....was very interesting and exciting."
139,Moose-Wilson-Road,Sep 2017 , Couples,"Pittsburgh, PA ",Saw mommy and baby bear,"We stopped here a few times in the 2 days we were here looking for moose. We never saw a moose but we did see a mommy black bear with her cub. The cub was swimming in the water, it was the cutest thing. We stayed til they wandered off."
140,Moose-Wilson-Road,Sep 2017 , Couples,"Bristol, RI ",Beautiful Scenery,"Beautiful scenery even if you don't see wildlife. The road is narrow & bumpy as other travelers have already noted. We saw 3 black bears in three different places, one was eating in the field just beyond the river near the parking area. The other two were close to the road in other spots. Have to be careful of the traffic jams when everyone stops to see the wildlife. We didn't see any moose here although someone else said they saw a small calf. We did see a large herd of elk just beyond Teton Village heading toward Jackson and two moose (cows) also on Rt 22 just past the Snake River bridge, late afternoon."
141,Moose-Wilson-Road,Sep 2017 , Couples,"Newport Beach, California, United States ","Parts of it are not paved, so be forewarned...","This is the quickest and easiest way to get to the park from Teton Village. There is one section of the is road that is not paved and is a little rough in places with pot holes. Small cars need to drive very carefully so as not to bottom out. We did see some moose, a black bear and a deer while driving this road, so wildlife seems to be pretty abundant in the area. Keep your eyes open and drive slowly."
142,Moose-Wilson-Road,Sep 2017 , Couples,"pittsburgh, pa ",Moose Wilson Road,"A chunk of this road is rough gravel but not bad if you drive slowly. There is a Moose Habitat along the road where we saw a mama bear and her cub splashing in the water but alas, no moose. But we did notice that people came back at different times during the day as we did. It was fun to chat with the rangers and the tourists. The drive provides beautiful scenery and the opportunity to see various wildlife. The rough gravel part of the road did not diminish the experience."
143,Moose-Wilson-Road,Sep 2017,not available,"Placida, FL ",Great little secondary Road,"This road or section that I'll refer to is only nine miles long, and honestly is more like a driveway with some bumps than a true road. But it has been surprisingly busy with wildlife on my few drives. You'll want to go slow and look but you could find some wildlife and at the very least some decent wildlife views. Or the 40 mile views you'll find further up in the parks but more of an up close look. Try it and I hop you like it."
144,Moose-Wilson-Road,Aug 2017 , Friends,"Madison, WI ",Wildlife everyday,We were in the Tetons for a week and traveled Moose/Wilson Rd 3 times. Shortly after getting on the road by Moose visitor center there is a small gravel parking area overlooking a pond area but we never saw any moose in it. Each time we saw Moose ( cow & young ) both in the ponds and on the road a little furthur past the parking area. We also saw a black bear eating berries in the brush just off the road. We have been on this road in the past and never came across any moose so this trip was great. We saw moose in the middle of the day not just morning or evening.
145,Moose-Wilson-Road,Sep 2017,not available,"California, ",Can be great for animal viewing,Narrow road that is unpaved for two of its ten mile length.  Slow driving.    We were fortunate to see a mother moose with two yearlings one day. Same day we saw a bear in the distance.    Another day we saw a bear sow and her two playful cubs.    Recommend.
146,Moose-Wilson-Road,Sep 2017 , Couples,"Dallas, TX ","Lots of wildlife, beautiful views.","Saw a bear swim in the creek and play with a stick, saw lots of osprey. Didn't see a moose but heard elk bugling - lovely drive."
147,Moose-Wilson-Road,Sep 2017 , Friends, ,Moose,There was a moose. We watched it for a long time. I think he was a juvenile. The people who were there said there was a visit from a grizzly bear.
148,Moose-Wilson-Road,Sep 2017 , Couples,"San Antonio, TX ",Excellent alternative route into Jackson from Park,"Considerably more rural route with numerous wildlife viewing opportunities. As of September 2017, a fairly extensive portion of road is in relatively poor condition with large potholes. Does emerge some distance from Jackson"
149,Moose-Wilson-Road,Aug 2017 , Family,Overland Park ,Access to Back-Country trails and Quick Way Between Teton Village and Moose,"This is worth the trip between Teton Village and Moose Junction. Mostly paved, it's still a dirt/gravel road at the south end. This is the only access (except hiking) to Death Canyon and Granite Creek trailheads. The Lawrence S. Rockefeller Preserve is also off this road. Even the paved section is narrow and twisty. Trailers and motorhomes are prohibited on this road. Over the years we've seen a bear with cubs and moose, so it worth a drive just in case you get lucky. Another benefit we found is you get into Jackson from the west on WY 22 and on this trip the backup to Jackson from the north on US191 was about 2 miles long. From the west, there was effectively no backup. No guarantees!"
150,Moose-Wilson-Road,Sep 2017 , Couples,"Edison, NJ  ",Never saw any wildlife,"Oh well, never saw any wildlife on this road although so many people told us we would. Looks like it would have been a place to view moose especially because of the terrain."
151,Moose-Wilson-Road,Sep 2017 , Friends,"Wilmington, NC ",Rough Road,"The road was rough, but beautiful scenery. Unfortunately, we didn't see any moose, but the road saved us a lot of time going to Yellowstone and Tetons parks."
152,Moose-Wilson-Road,Aug 2017 , Family,"Kailua-Kona, HI ",Nice backroad,"No campers, trailers, or big trucks allowed. Nice backroad from Wilson to Teton park. Need to go slow, you never know when a moose will pop out"
153,Moose-Wilson-Road,Sep 2017 , Couples,"Sde Eliezer, Israel, ",Beautiful,This road is a great part of the park and has a high chance of spotting a moose.  We've seen a couple while driving by.
154,Moose-Wilson-Road,Sep 2016 , Couples,"Newport, OR ","Yes, we did see Moose along this road","We were here early evening and did see a few moose. If you want to take a memory back with you from along this road, bring a camera with an excellent lens."
155,Moose-Wilson-Road,Jul 2017 , Friends,"Birmingham, UK ",Pleasant drive,"A pleasant drive we included in our day trip whilst staying in jackson,    the road is not paved all the way, and broken so very bumpy - but take it slow and you should be fine, although i wouldnt recommend for low slung cars or RV's    But with so many other better scenic drives around i wouldnt recommend going out of you way to see.    We saw some deer but no moose."
156,Moose-Wilson-Road,Aug 2017 , Family,"Leighton Buzzard, UK ",So much wildlife,In the space of 30 minutes we saw 2 moose a heron birds of prey and a bear. The road is narrow and gets congested. Best to go at dusk
157,Moose-Wilson-Road,Aug 2017 , Friends,"Louisville, KY ",Grand Teton's.,"Nice area, got to see moose, elk & deer. Didn't get to stay long enough to get to do a hike. There were several trails to enjoy. Not recommended to take your pets on the trails, they don't mix with the wildlife."
158,Moose-Wilson-Road,Aug 2017 , Family,"Texas Gulf Coast, TX ",Fantastic Back Road!,"Always love driving this road through the former Rockefeller ranch. Today we saw a bear cub eating by the road! We have also seen beaver and moose! Very peaceful drive- no trailers, long vehicles, or speedy driving. Beautiful cascading waterfall."
159,Moose-Wilson-Road,Jul 2017 , Family,"Orrville, OH ",Unpleasant Experience,"My family protested when I turned onto this road, but I took it anyway. I should have listened. The road was narrow, bumpy, and felt almost as busy as a city freeway during rush hour. A few miles in my sharp-eyed daughter spotted a moose and calf that no one else had apparently seen yet. But in the short time it took to turn the vehicle around to get a better look a jam on both sides of the road had begun to form with people running about everywhere. Not my sort of wildlife viewing. We decided to pass on by. Shortly thereafter we met an RV that nearly forced us off the road. I caught a glimpse of the driver and noticed his wide-eyed terror stricken expression. Perhaps next time he will heed the signs forbidding travel to RV's. Unless the road is leading to a destination, I would highly recommend not taking it; or if traveling from the east not continuing beyond the first overlook. I don't think the stressful drive was worth it, even though we saw a moose."
160,Moose-Wilson-Road,Jul 2017,not available, ,Part of the road is under construction,"This road is very narrow and curvy. We did not see any wildlife while on the drive but it was raining that day. We were told that there is a moose and calf that are seen here on occasion. We saw moose not here, but by the Jackson Lake Lodge and by the ferry at Jenny Lake. You can only go so far and then the road is closed for construction and you have to turn around."
161,Moose-Wilson-Road,Jul 2017 , Couples, ,Must see,"Was hoping to see some bears, but didn't. Probably because we drove it in the afternoon. Nice scenic drive. I would recommend driving it early morning or in the evening."
162,Moose-Wilson-Road,Aug 2016 , Couples,"Island of Malta, Malta ",Where are rhe Moose?,"It was a scenic drive, at the end of a long and tiring day but we saw no Moose. In reality we should have left it for an hour later as it was not dusk yet and Moose do tend to come out at night to this area. We saw deer and elk."
163,Moose-Wilson-Road,Jul 2017,not available,"Fort Worth, TX ",Moose,Saw the cow twice but never saw the calf. It's wildlife so sometimes they cooperate and most the time they don't.
164,Moose-Wilson-Road,Jul 2017 , Couples,"Aurora, IL ",Sightseeing,Nice drive until we got past the Rockefeller Preserve. Then the road was terrible. It was closed the next day for roadwork.
165,Moose-Wilson-Road,Jul 2017 , Family,"Efland, NC ",Not bad,Expected. to see wildlife but didn't. Road turns to gravel so be prepared. Glad we had the experience.
166,Moose-Wilson-Road,Jul 2017 , Couples,"Bellingham, WA ",Take This Road!,"I've traveled in this area twice now and taken this road both times. Each time, we saw two moose. Be aware there is a stretch of road that is dirt/gravel."
167,Moose-Wilson-Road,Jul 2017,not available, ,You have to be lucky to catch Moose here,"When I heard the name of the road, we thought we will be seeing quite a few Moose around here, because Teton is known for it's Moose. However, before we took the route we talked with a ranger who told us that timings matter as the places the road overlooks don't always have the shade and chances of watching a Moose is better when there's shade and water involved. So, we turned back and took this trip around 6:30 in the afternoon. The road is really very narrow and bumpy but we were lucky as we saw Moose at the first spot of Snake River. But again, remember, try to go there early in the morning or before sunset, otherwise you will be left disappointed."
168,Moose-Wilson-Road,Jul 2017,not available,"Verona, KY ",Saw nothing - must go early/late,We wasted our time animal searching twice on this long bumpy road. Don't go unless you're extremely early (we went at 7am) or immediatley before sunset (we went around 7:30pm). You might get lucky but we saw nothing but a deer.
169,Moose-Wilson-Road,Jun 2017 , Solo,"Worcester, UK, ",Overwhelming experience and worth the 6 hour round trip,"I drove down here, both ways, from early sunrise in the hope I might see a Moose. While I was talking to others during the same route they said they had seen a grizzly bear and her three cubs the day before.    Driving down towards Teton Village I saw a couple of Elk stags in the distance. I wanted to get closer because they were situated behind a fence about 50 yards in front of me, but out of respect I kept my distance. Just wish I had had a camera with a long sense as I only had my iPad 3 with me. I took a few short but the quality of the camera on the iPad was not as good as I had hoped.    By the time I drove back the stags had gone. I drove on and eventually saw a Female Moose sitting behind a tree just the other side of the river. I hung around for ages in the hope that it would get up and move but I had to give up and move on myself.    Eventually I drove a little further up the road and just as a I stopped the car I saw a female Moose with her calf a few yards below me by the river. I remained patient and eventually the moose stood up and began feeding and I shot a few snaps and lots of video. This one experience made my holiday. I hoped to see a male Moose but sometimes you can't have everything in life; but the pictures I have will remain with me forever.    I would recommend this trip to anyone either at first light and up to about 8am and at dusk, once the sun has gone down. Moose will keep out of the sun in the day and come to the reeds to feed when it is cool enough. Good Luck, my waiting was definitely worthwhile and I would recommend this to anyone interested in wildlife."
170,Moose-Wilson-Road,Jul 2017 , Couples,Jackpot ,Moose and Bear!,"A bit of a bumpy, part gravel road but a great drive if you want to see animals! Take your time and you will probably see Moose. It is a slow drive on a narrow road, so it is perfect for seeing the animals. I would definitely do the drive again! We saw a bear & 3 moose."
171,Moose-Wilson-Road,Jul 2017 , Family,"Pearland, TX ",Moose !,Excellent place to find moose. Lovely drive past marshy areas and streams. Big pullout with parking next to viewing spot Really lovely
172,Moose-Wilson-Road,Jul 2017 , Family,"Saint Louis, MO ","Moose, elk, and bear!","Drove along this road several times in the morning and in the evening. Saw a few moose and a few elk close enough for pictures. Missed seeing a bear twice on this road, as people had just stopped to take pictures and then the bear retreated back into the forest."
173,Moose-Wilson-Road,Jul 2017 , Couples,slc ,Saw some elk!,"This is a place where we usually see some wildlife, last time we saw several moose close to the river, lovely meadows and grassy lands. Nice drive...."
174,Moose-Wilson-Road,Jun 2017 , Family,"Lutz, FL ",Road closed for high water,"Went June 2017, road closed for high water from spring floods. Was able to make it part way down from the Mormon barns, but that is as close as we could get."
175,Moose-Wilson-Road,Jul 2017 , Family,"Roseville, CA ",Saw a moose with her baby,Beautiful drive down a narrow road that is mostly paved until the last mile or so! The reviews said you would see a moose and we sure did with her baby! About 20 yards from the road! The drive is tree lined with amazing wild flowers and a small river!
176,Moose-Wilson-Road,Jun 2017 , Couples,"New York City, NY ",Bumpy in Parts,"This is the scenic way but a good part is not paved and narrow. Some cars drive in the middle of the road at a fast speed, causing others to swerve. Did see a female moose on the road."
177,Moose-Wilson-Road,Jun 2017 , Friends,"Greenville, SC ",Always see a moose,If you want to see a moose drive this road early or late and you just about always see one. Watch for cars pulled over and get in on the action.
178,Moose-Wilson-Road,Jun 2017 , Family, ,narrow dirt road not suitable for large cars or nervous drivers,"The road is appropriately narrow to keep speed slow in a national park, but it is also the highway bypass to Teton Village from the north. The traffic is horrible because stupid large cars and trucks cause havoc. If you have all day to drive on a narrow road and seldom see anything other than the dust of the car in front of you, give it a try"
179,Moose-Wilson-Road,Jun 2017 , Couples,"Huntsville, Ala. ",Moose Heaven,"Go early, be patient, and be rewarded - Moose 30 feet from our car feeding on tree leaves - awesome."
180,Moose-Wilson-Road,May 2017 , Family,"Orlando, FL ",Timing is everything!,"We drove this road a few times, the first was midday and we didn't see a thing. Knowing that the best times to spot wildlife are right around sunrise and sunset, we drove it again at 8:30pm and saw a Red-tailed Hawk, geese, 2 young foxes playing, elk, deer, and a moose. The road is paved except for a short section and doesn't take long to drive. Please drive slowly, the animals are often in or near the road, the foxes were darting in and out of the road chasing each other when we saw them."
181,Moose-Wilson-Road,Oct 2016 , Couples,"Townsville, Australia ",Great for Wildlife spotting !!,"We were lucky enough to spot some (2) Moose, Bisons and Elks as well as birds. The scenery is also beautiful and there are a couple of easy trails to be done."
182,Moose-Wilson-Road,Jun 2016 , Family,"Bradenton, FL ","If you have time, take the side road",What an incredible area. A little off the normal roads travelled by the tourist caravans. Take a leisurely drive down the road for some great sightseeing of the mountains and meadows.
183,Moose-Wilson-Road,Sep 2016 , Couples,"Colorado Springs, CO ","In the Tetons-- Gros Ventre Road, Kelly WY -- Good for spotting Moose","If you take in the old Moulton Farmhouse and classic barn on Mormon Row (off Antelope Rd), complete the loop by driving along Gros Ventre (pronounced Grow Vahnt) Rd, which travels along the Gros Ventre River. It is a favorite Moose area, and your chances of seeing one, are as good as anywhere in the Tetons. We saw 6 there on a trip in Sept."
184,Moose-Wilson-Road,Sep 2016 , Couples,"Houston, TX ",Great as a road trip,Traveling through this road give you the opportunity to see and stop at many places and have great views of the mountains and lakes.
185,Moose-Wilson-Road,Oct 2016 , Couples,"Seattle, WA ",A must for wildlife lovers!,"I've visited two straight years, both times in October, so I cannot comment on other seasons. But this was a can't miss place for wildlife -- moose, beavers, bears in particular. Go early or late in the day, drive slowly, be prepared for other tourists, and be alert. Others are correct about the potholes (the size and abundance of which cannot be overstated (and I was in a Ford Expedition!)), but those only are unavoidable if you come up from Teton Village. If you start by the visitor center, you can turn around by the Rockefeller Preserve and do it all on paved road."
186,Moose-Wilson-Road,Oct 2016 , Couples,"Leland, NC ",Bumpy,There is great scenery from the mountains to the foliage to the wildlife. But much of the road is not paved and can be a bumpy ride. Not to be missed though.
187,Moose-Wilson-Road,Sep 2016 , Couples,"Partlow, VA ",Adventurous Drive,"Take a winding, sometimes dusty road between Teton Village and Moose, throw in the beauty of the forest and the chance of spying wildlife and you have an adventure. Also a good shortcut to airport or The Parks if coming from Teton Village. A few places to stop, but the National Park Service usually accommodates stopped cars and people trying to get a photo whenever wildlife decides to amble through. We've seen many moose, a couple of bears and beavers. Sometimes we just enjoy the forest."
188,Moose-Wilson-Road,Oct 2016 , Solo,"Lewisville, North Carolina ",A Must for Photogs!,I'd been told about Moose Wilson Rd by some fellow photography buffs before I even got off the plane in JH. It definitely didn't disappoint with the wildlife & general scenery that was a bit off the beaten path!
189,Moose-Wilson-Road,Sep 2016 , Family,"Denver, PA ",Lucky to sight a mom moose,We were lucky to sight a mom moose here with her baby in the brush behind her. A really special treat. This road often has wildlife on it.
190,Moose-Wilson-Road,Oct 2016 , Couples,"Henderson, NV ",suggestion for avoiding potholes,Just did this earlier this week. Potholes are real axel breakers if you don't go real slow. My take is to start at the NORTH end which is the best part anyway and then turn around when you reach the Rockefeller nature preserve(there's a big sign and driveway on the left). The pavement goes past this for a little way but when you reach the unpaved section it isn't as nice anyway. The trees were pretty but we didn't see any animals at all hence the average rating.
191,Moose-Wilson-Road,Oct 2016 , Couples,"Dalton, OH ",Sadly the tourists are what makes this such a bad experience,"I never in all my life have seen such rude tourists as I have seen on this road. We twice saw photographers harassing the moose so bad they ran out in to traffic, with the mother and calf both nearly being hit by vehicles. Sadly, the wildlife enforcement seems to be understaffed and not aggressive enough towards these abuses which is sad. If you can get past some of the idiots in the park, it's a great experience, but it sometimes can be hard to do"
192,Moose-Wilson-Road,Sep 2016 , Couples,"Houston, TX ",Glad we made this drive one late afternoon,"moose, small bear, elk, nice fall foliage made this drive worth doing. Stop at Rockefeller Preserve and hike to Phelps Lake if possible. Saw a small black bear at the preserve at dusk"
