,place,date,category,place ,Tagline,Review 
62,National_Museum_of_Wildlife_Art,Nov 2020 , Friends,"Henderson, NV ",Such a charming museum,This museum was recommended to us by our tour guide. It did not disappoint. They offer wildlife artwork and sculptures from local artists and artists from around the world. There is something for everyone here. Some very beautiful art.    All staff are very friendly and welcoming. Covid precautions are taken with temperatures taken at the entrance and hand sanitizer is offered throughout the museum.
63,National_Museum_of_Wildlife_Art,Oct 2020,not available,"West Jordan, UT ",Unplanned Stop,We stopped at this museum after the gates to Yellowstone were closed due to a winter storm. We have seen it while driving through multiple times but never stopped. It was a pleasant way to spend some time after our other plans got redirected. The staff was friendly and we found some unique gifts to bring back in the gift shop.
64,National_Museum_of_Wildlife_Art,Oct 2020,not available,"Lakewood, CO ",What a Beautiful place!!!,"Even if your not an Art fan, A must see!!! The building is a work off Art, The grounds are wonderful!!! And the Art A+!!!"
65,National_Museum_of_Wildlife_Art,Oct 2020,not available,"San Antonio, TX, ",Nice Display of Art,"We stopped her on our way to the airport. We were running out of time, so we just had a look around. Very beautiful building with a lot of nice sculptures inside and out. We had a look around inside the gift shop as well as the main floor before needing to leave to catch our flight. It would be nice to stay longer...maybe next time! It cost $15 pp to get in."
66,National_Museum_of_Wildlife_Art,Oct 2020,not available,"Las Vegas, NV ",Must See!,"You could easily miss this gem alongside the road as you travel between Jackson and into the Grand Teton National Park, but this is definitely worth a stop in while you are in the area. The art is absolutely stunning- from the paintings to the sculptures! I really enjoyed the special exhibit they had entitled Urban Wildlife. The artists all had an explanation of the art and what they were thinking/envisioning while making the piece. I loved seeing the pieces of art from ""their"" intended perspectives!"
67,National_Museum_of_Wildlife_Art,Oct 2020,not available,"West Chester, Pennsylvania, USA ",Beautiful Art,"Lots to see, first a beautiful building that blends nicely into the surrounding area. There is a lot of beautiful artwork in the building, Carl Rungius painting are great and some beautiful sculptors."
68,National_Museum_of_Wildlife_Art,Oct 2020,not available, ,Beautiful Location & Art - Great time - Food at the Palate is excellent too!,National Museum of Wildlife Art in Jackson Wyoming is a special place.  The art is outstanding and the museum is just big enough to enjoy without being overwhelming. I was impressed by the quality and variety in the art. Very beautiful spot.  Also enjoyed the outside sculpture walkway with 2 dozen sculptures.
69,National_Museum_of_Wildlife_Art,Sep 2020,not available,"Valparaiso, IN, ",Beautiful Art,"I thought this was a walking trail thru the large statues only, turned out there is a great indoor art museum. You can park and walk the outdoor trail for free. We did the indoor as well. It was a fair entry price. The art was beautifully displayed and organized. I loved it. They have a wonderful gallery of Carl Rungius works. They were my favorite for sure. They had art from long ago to present day. They were doing their annual fundraiser show. If you want you can make a purchase of beautiful works."
70,National_Museum_of_Wildlife_Art,Oct 2020 , Couples,"Las Vegas, NV ",Wildlife come to life,This museum was a highlight of our time in Jackson Hole. We particularly loved seeing the work of sculptor Kenneth Bunn. This museum is a wonderful place to enjoy the work of many fine animals artists
71,National_Museum_of_Wildlife_Art,Sep 2020 , Couples,"Long Island, NY ",Beautiful art,"Very impressive art work and history, great place to visit on a rainy day, I wish I could afford some of the photographs. Very relaxing to take it all in"
72,National_Museum_of_Wildlife_Art,Sep 2020 , Couples,"Carlsbad, CA, ",Marvelous sculptures,COVID-19 convinced us to minimize indoor activities but the sculptures on their grounds were well worth the time. We’ll checkout the museum on our return visit!
73,National_Museum_of_Wildlife_Art,Sep 2020,not available,"Atlanta, GA ",Very interesting Museum,Very unique experience in Jackson! They have both indoor and outdoor exhibits that are fun for all ages (children to older adults). The restaurant in the museum has a wonderful menu and delightful food. Masks are required indoors.
74,National_Museum_of_Wildlife_Art,Oct 2020,not available,"Arlington, United States ",Lunch and Self Tour of this Museum,"What a wonderful experience !! I highly recommend planning a few hours when in Jackson Hole to take a tour of the magnificent artwork and have a delicious lunch as well at this museum. What amazed me the most was some of the artwork on display that was done in the early 1800s by artists who traveled to this region of Wyoming. Upon their return to the Eastern United States, they would then paint what they witnessed for those back East to get a glimpse of what they saw. (Mirrorless digital cameras I guess were not around 200 years ago...) All kidding aside, this should be a ""must see"" for anyone traveling to Jackson Hole."
75,National_Museum_of_Wildlife_Art,Sep 2020,not available,"Brookings, OR ",This is a Must in Jackson!,Absolutely one of the best museums that I have seen in a very long time. The art inside and outside the building was breathtaking! I loved all the bronze statues and the art was truly the best! Definitely a must see in Jackson!
76,National_Museum_of_Wildlife_Art,Sep 2020,not available,"San Francisco, CA, ",Exceeded my expectations!,This place exceeded my expectation. We spent more time that we expected. It is modern and very nicely designed. It has a big collection or art and very informative. I think it is a must when in Jackson.
77,National_Museum_of_Wildlife_Art,Sep 2020 , Solo,"Arlington, VA, ",A worthy collection,"The NMWA is an easily-accessible museum right outside Jackson. It is built to look like an outcropping on the hillside where it’s located. There are panoramic views from multiple viewpoints inside and outside the building. The exterior grounds include bronze animal sculptures. The bulk of the collection is paintings and sculptures in about ten small galleries. Aside from a handful of ancient pieces, most of the works date are from the last few centuries, from Romanticism to contemporary works. There’s also a gallery of new paintings and sculpture for sale, an inviting guest lounge with a fireplace and view of the mountains, and an upscale restaurant.    The quality of the collection was mixed, with some of it looking barely better than paint-by-number, but there are real gems here including works by Rousseau and Georgia O’Keefe. The museum also has very helpful signage and an app-based “self-guided tour” that really helps to engage with the works and understand how they fit into the genre or even an individual artist’s oeuvre. This museum is the right size and variety for a narrow-focus collection and was very different than anything I have seen before. It was well-worth the two hours it took to see everything here."
78,National_Museum_of_Wildlife_Art,Sep 2020 , Couples,"Central Florida, FL ",Must do Museum and restaurant both!,"Restaurant was amazingly delicious!  Art was lovely.  Comfortable, quiet and casual.  A must do on a day off from play to just relax and reflect."
79,National_Museum_of_Wildlife_Art,Aug 2020 , Family,"Chanhassen, MN, ",Outdoor Sculpture Trail,We arrived close to closing time so instead of paying the $14 per person we were allowed to walk the outdoor sculpture garden/trail which is set just above the National Elk Preserve.
80,National_Museum_of_Wildlife_Art,Sep 2020,not available, ,Wonderful wildlife art,This is a quality museum with multiple excellent exhibits. The building and view are art work in themselves. Restaurant is excellent for lunch and also with a wonderful view.  The staff is well informed and can answer any questions you may have regarding the art pieces in the museum. Give yourself time to fully experience the museum.
81,National_Museum_of_Wildlife_Art,Aug 2020 , Family,"Georgia Coast, GA ",Best views,"These views are breath taking! Not far from town square in Jackson Hole, worth a short drive just to see the view! We missed the museum it was closed already by the time we got here but there is tons of really neat statues outside of huge animals and the views are indescribable! We took tons of pics here and family selfies and stared in awe for as far as you could see. Tons of wild life down in the plains below too if you have binoculars you could probably really see some stuff! Bring your cameras and come at sunset; you will not regret"
82,National_Museum_of_Wildlife_Art,Aug 2020,not available,"Allentown, PA ",After hours tour,"We had a private event at the Palate Restaurant and afterwards they gave us a private tour of the museum. The guide was knowledgeable and made it very interesting. The Museum is across the road from the Elk Refuge. The guide explained that the elk are only there in the winter and spend summers in Yellowstone. There was a wide variety of art, something for everyone."
83,National_Museum_of_Wildlife_Art,Aug 2019 , Solo,"Topeka, KS ",You will love this place if you like wildlife art!,"Amazing architecture and building design provide a wonderful setting for this world class Museum of wildlife art. Excellent and informed staff… Options for entry… Headsets available… An excellent café on site. I could spend an hour in the gift shop alone… Looking at the one of a kind, artistic, creative and beautiful offerings.    Highly recommend you see any and all outside temporary and permanent exhibits as well. Besides you might see the resident marmosets that dash around on the walls and across the drive.    If you don’t care for wildlife art… This is not your place. However, I believe you will be pleasantly surprised and pleased when you cross the threshold into this incredible museum of wildlife art in multiple mediums."
84,National_Museum_of_Wildlife_Art,Jul 2020 , Family,Missouri ,Definitely worth a stop,"If you’re anywhere near Jackson, I’d recommend that you drive 5 min out of town and visit this beautiful place. The sculptures are extraordinary and the building itself is just a unique place that looks like it grew out of the hillside."
85,National_Museum_of_Wildlife_Art,Jul 2020 , Friends,"Chicago Heights, IL ",Painting and sculptures,"We were in Jackson during the Covid pandemic and visited the museum for something to do. It’s mostly paintings and sculptures. If you’re a true art person, you’d probably enjoy this museum."
86,National_Museum_of_Wildlife_Art,Jul 2020,not available, ,What a Treat!,"Although I am not a big fan of Western art, I thoroughly enjoyed the museum. The sculpture was stunning, and the views from the museum were beautiful. I learned so much about American artists, and the history of the difficulty in having wildlife paintings accepted by artists' organizations was fascinating. A lovely visit."
87,National_Museum_of_Wildlife_Art,Jul 2020 , Family,"Severna Park, MD ",Wildlife Enthusiasts Museum,Wonderful art work combined with informative timelines. Earthly deco inside with an option for a self guided outdoor sculpture garden - worth the walk. Don’t skip the children’s art display - simply delightful.
88,National_Museum_of_Wildlife_Art,Jul 2019,not available,"Cheyenne, WY ",Beautiful museum,"I went to this museum with my sister, 12yo nephew and 4yo grandson, and we all enjoyed it. Beautiful artwork, great outdoor space with sculptures, and fun kids area."
89,National_Museum_of_Wildlife_Art,Mar 2020 , Couples, ,A must do!!,This museum was 6 stars! Very well done! The staff that works there was so passionate about what they do! Made the whole experience wonderful! The student learning exhibit was amazing!
90,National_Museum_of_Wildlife_Art,Jul 2019,not available,"Sedona, AZ ",Inspiring Works of Art,"I was pleasantly surprised by the incredibly beautiful and inspiring works of wildlife art in this museum. The artists work was varied in medium, wildlife displayed and the overall setting simply spectacular. We could have spent many additional hours exploring and contemplating. This is a MUST SEE if ever there was!"
91,National_Museum_of_Wildlife_Art,Feb 2020 , Friends,"La Canada Flintridge, CA ",Definitely worth visiting!,"To start with the building is beautiful. The exhibits of photography are fascinating. The art work and sculptures are truly remarkable. Go hungry, as the restaurant is excellent!"
92,National_Museum_of_Wildlife_Art,Feb 2020 , Friends,"Benicia, CA ",The most beautiful museum I have seen!,"If you love wildlife and nature, this museum is a must visit. The sculptures are amazing, and the wildlife and nature art is stunning. The gift shop is a must visit, as well! We had lunch at the museum restaurant, Palate, and we had such an excellent meal, including the frybread dessert. Highly recommended!"
93,National_Museum_of_Wildlife_Art,Feb 2020,not available, ,"Great museum, more interesting than I had expected","I enjoyed it more than I had expected, it's a great beautiful museum. The restaurant is also recommended, delicious food"
94,National_Museum_of_Wildlife_Art,Feb 2020,not available,"Rabun Gap, GA ",stopped by when in the area,A very nice place to visit was with friends who were more into art and sculptures than I was. Very interesting and a great place to stop by and explore.
95,National_Museum_of_Wildlife_Art,Feb 2020,not available,"Corinth, MS ",Great Wildlife Museum,Great place to go. If you don't have a car will require Uber or Taxi... It is across the road from Elk tour in winter. That is also a great thing to do in winter months...
96,National_Museum_of_Wildlife_Art,Feb 2020 , Solo,"Hemet, CA ",Exquisite!,This is such a wonderful museum that I had to return for a second visit. The paintings and sculptures are unlike any I have seen in the world. Just magnificent!!
97,National_Museum_of_Wildlife_Art,Jan 2020,not available,HUDSON ,Beautiful Building and Beautiful Art,"I thought this museum would be good, but I thought the art would have to be from fairly contemporary artists. I was, therefore, very surprised to see a Moran and a Wyeth etc. The Moran portrayed a buffalo stampede at night caused by a wild fire. The leading edge of the buffalo herd was miles wide. The scene was something that must have happened but that no human could have experienced and lived to tell about it...a real nightmare, but beautiful I was really taken in by it. The dining area was very attractive but we didn't eat there. I can easily recommend the museum to anyone who likes wildlife art. I was surprised that such a small town could have such great pieces...someone must have been very generous."
98,National_Museum_of_Wildlife_Art,Dec 2019 , Solo, ,Beautiful Museum well worth a visit,It was a snowy day with low visibility outside so decided to visit this beautiful wildlife art museum. The art is stunning and highly recommend a visit. Loved the sculptures and paintings.
99,National_Museum_of_Wildlife_Art,Sep 2019,not available,"Valhalla, NY, ",Nice Museum,It was an overcast rainy day as we headed from Yellowstone to Jackson. As such our float trip on the Snake River was cancelled and we didn't spend as much time in the Grand Teton's as a result we stopped here on our way into Jackson.    This is a great option if the weather isn't the best. Lots of nice paintings depicting western wildlife and wildlife themes in several different art forms. When we were there they were running an art contest which took up several of the galleries so I'm not sure what would be hung there if the contest wasn't going on.
100,National_Museum_of_Wildlife_Art,Oct 2019,not available,"Huntington Beach, CA, ",Unexpected Pleasure,"Another hotel guest happened to ask what we had planned for our stay in Jackson. When I mentioned touring Grand Teton National Park he said, ""Well don't miss the National Museum of Wildlife Art if you have time. And that is how we ended up stopping by.    The facility itself is a work of art in itself perched as it is on the hillside above Route 191. It the rock facade blends in with its surroundings. From the street it does not appear that big but looks are deceiving.    Entering from the parking lot you walk (or use the elevator) down a majestic stair case while a bronze mountain lion glares over your shoulder. The museum houses both paintings and sculptures with descriptions of the era in which the artist worked and the significance of their work. In addition there is a sculpture garden outside the building that you can walk through while overlooking the National Elk Refuge.    There was a very modest entrance fee of $12.00. It was very much worth the price of admission."
101,National_Museum_of_Wildlife_Art,Oct 2019,not available, ,Magnificent All Around!,"This was the biggest unexpected hightlight of my five-week road trip. The building, sculpture garden, and art collection are all stunning. Volunteers at the front desk were delightful and my retired military ID yielded a deep discount on the cost of admission.  I spent the better part of a day here and was fortunate to visit during their annual fund-raiser, in which dozens of top artists donate a portion of the sale of their work to the museum. I felt it a rare privileged to be able to examine wonderful pieces in a broad range of styles and mediums that will soon disappear from public view, into private collections.  The permanent collection features entire rooms of work by renowned wildlife artists Carl Rungious and Robert F. Kuhn (I have two new favorite painters!) and a current exhibit examines art through the ages, reaching back 25,000 years and around the globe.  If you enjoy art and love wildlife, this is a MUST SEE when visiting the Jackson/Grand Tetons area."
102,National_Museum_of_Wildlife_Art,Sep 2019,not available, ,An amazing collection--wish I'd had more time there,A beautiful art museum with an amazing collection of art. I especially enjoyed the Rungius wing. A must see for wildlife artists and appreciators. Allow plenty of time--I could've spent a whole day there!
103,National_Museum_of_Wildlife_Art,Oct 2019 , Couples,"Urbandale, IA ",Better than anticipated!,"I've been to Jackson Hole several times and never stopped, but my husband wanted to visit, so we did. Between my senior discount and his military discount, it was a pretty inexpensive couple of hours.  As with any museum, my attention to detail declined the longer we were there, but the first exhibit was the one I was most interested in, so I spent a lot of time on that one. And it was excellent.  I have to admit to some disappointment that painters like James Audubon and Maynard Reece were totally overlooked.  However, the Herb Alpert Totem exhibit was amazing."
104,National_Museum_of_Wildlife_Art,Oct 2019,not available,"Mattoon, IL ",beautiful art,every thing from paintings to statues that are life size. stroll at your leisure and take in all the art work and history
105,National_Museum_of_Wildlife_Art,Sep 2019,not available, ,Definitely add to Jackson itinerary,"This museum had been recommended to us and we were ""maybe"" about going. A rainy day provided the reason to go indoors and we are so happy we did. Exceptional collection of classics and contemporary exhibits absolutely worthy of a half day visit. Be sure to check out the outdoor sculptures as well."
106,National_Museum_of_Wildlife_Art,Sep 2019,not available,"Saint Louis, MO ",Very special place,"First, architecturally: This place is built into a hillside, unobtrusive, but remarkable. There are striking black totems that are visible from the road, which are the work of Herb Alpert ( yes, the musician and producer).    I suppose if works of art whose theme is the natural world are not your preference, you:MIGHT not enjoy the museum, but I really doubt it.    The museum is not large, and it can be appreciated in a reasonable amount of time. I truly loved it. They have an absolutely wonderful gift shop.    Topping off this experience, we had a delightful lunch at Palate, the museum restaurant which overlooks the National Elk Refuge. I had the Casper Power Bowl which was INCREDIBLY generous in all of its ingredients. My husband had Trout and Chips which were fabulous.    This place is very special to me."
107,National_Museum_of_Wildlife_Art,Sep 2019,not available, ,A must see when you are in Jackson,Wonderful paintings and sculpters; some I have only seen in books. Beautifully laid out museum. Don't miss it.
108,National_Museum_of_Wildlife_Art,Sep 2019,not available,"Indpls., IN ",Nice works of art,This museum is for lovers of wildlife art. There are some very good works throughout several galleries. One of the galleries is the children's discovery gallery which has a few hands-on activities. You have an option to do an audio tour by getting a device from the main desk (no charge.)    Outside the building is a sculpture trail with about 21 very good sculptures of wildlife. Not sure if you have to pay a museum fee to see these since they are outside. We enjoyed these as much as the art.    The museum sits off of Hwy 89 just a about 2 ½ miles from the town square in Jackson.
109,National_Museum_of_Wildlife_Art,Sep 2019,not available,"Seattle, WA ",Fabulous sightseeing,"A museum filled with extraordinary sculpture and art.In a perfect setting ,a highlight of the Yellowstone area visit. A MUST SEE"
110,National_Museum_of_Wildlife_Art,Sep 2019,not available,"Melbourne Beach, FL ",Don’t Miss,"On the top of a hill, this museum has so much to offer. There are several rooms to visit with great art. What I enjoyed most were the original paintings available for purchase."
111,National_Museum_of_Wildlife_Art,Sep 2019,not available,"Tampa, FL ",National Museum of Wildlife Art,Have been to Jackson Hole many times but never stopped at the National Museum of Wildlife Art until this trip. It is definitely worth the time if you want to see some beautiful paintings and pictures. The sculptures outside are full size wildlife and the view looking out across the Elk Refuge is remarkable. It's amazing how people interrupt what they see.
112,National_Museum_of_Wildlife_Art,Sep 2019 , Friends,"Springfield, MA ",Very Interesting Museum,"This unusually shaped museum is made of quartzite rocks from Idaho and sits on a bluff. Resembling an outcrop, it was actually inspired by the ruins of Slains Castle in Scotland. Who would have thought?    Inside are wonderful treasures depicting wildlife......magnificent paintings, bronze statues, ceramic pieces, pottery, etc. Our favorites were the large painting of one bison and the elk in the foreground with surroundings in darker colors. While there are hundreds of pieces spread throughout 14 galleries, two featured artists are Robert Kuhn and Carl Rungius. I would strongly advise having a docent bring you around because the stories of some paintings are very interesting. There is a gift shop, library and cafe.    Outside you will find numerous sculptures, some by the parking lot, some around the entrance, and others out back. There is a 3/4 mile sculpture trail well worth taking. Nice stop, well presented."
113,National_Museum_of_Wildlife_Art,Sep 2019 , Couples, ,Awesome art,Awesome collection of art. We went through on a rainy day for something to do and really enjoyed it.
114,National_Museum_of_Wildlife_Art,Sep 2019,not available,Dubai ,nice break when you are having a off day from hiking,the paintings and statues are very nice if you do like wildlife art. Unfortunately when we visited one gallery was closed. But still worth to visit.
115,National_Museum_of_Wildlife_Art,Sep 2019,not available,"Granbury, TX ",Must see wildlife paintings,Had always heard about this museum and was very pleasantly surprised at its scope and beauty. Such a wonderful venue to display nature paintings.
116,National_Museum_of_Wildlife_Art,Sep 2019 , Friends,"Rome, GA ",Excellent museum,This is a wonderful art museum with a good collection of art from the old west. We had a great tour with a nice docent who explained scope of the collection and highlighted many of the works. The museum is in a beautiful setting overlooking the National Elk Preserve. Worth a visit
117,National_Museum_of_Wildlife_Art,Sep 2019,not available,"Concord, CA ",Incredible art and sculpture,There are so many wonderful things to see in this museum and the app does a terrific job as a guide around the museum.
118,National_Museum_of_Wildlife_Art,Sep 2019 , Couples,"Reston, VA ",Quick visit,"We elected to look at the sculptures outside and in the lobby. It was a rainy day and super crowded.  I think the $15 admission is worth it, but I’d prefer to visit on a weekday."
119,National_Museum_of_Wildlife_Art,Sep 2019 , Friends,"Winston Salem, NC ",Nice little Museum,"It was a rainy day , so we stopped in because the outside building is shaped so interestingly. Nice little museum . If I had kids and was on vacation I probably would not stop . We enjoyed the artwork and the architecture inside and out . Had restaurant but not open when we were there ."
120,National_Museum_of_Wildlife_Art,Sep 2019,not available, ,Unforgettable Wildlife Art,Museum offers largest public exhibit of Carl Rungius art in US. Especially enjoyed the special Western Visions annual exhibit with the wide variety of artists. Outdoor sculpture trail includes 21 different animals.
