,place,date,category,place ,Tagline,Review 
0,National_Museum_of_Wildlife_Art,Feb 2022 , Family, ,4 hour teton wildlife review,tyler was a great guide and we had a fantastic day with him learning local history and seeing so many animals
1,National_Museum_of_Wildlife_Art,Feb 2022 , Couples,"Ooltewah, TN ",A Must,"This is a great way to spend a couple of hours if you are in Jackson Hole. See the videos first, then do the galleries. Unbelievable art whether you are into it or not. We've been driving by this place for years and finally decided to visit. Worth the price of admission which is very reasonable."
2,National_Museum_of_Wildlife_Art,Feb 2022 , Couples,"Kiawah Island, SC ",Worthwhile visit,Interesting museum in a beautiful location. Viewed the nationalgeographic exhibit which was interesting. Would like to return in warmer weather.
3,National_Museum_of_Wildlife_Art,Feb 2022 , Solo,"Coldwater, MI ",Time we’ll spent,A well told story about wildlife art In a beautiful setting on a bluff overlooking the elk preserve. Exciting bronze sculptures outdoors build anticipation for the fine collection inside. A very classy place.
4,National_Museum_of_Wildlife_Art,Sep 2021,not available,"Granby, CT ",Worth a Visit,"If you are in Jackson and have a few hours to explore this museum, it is definitely worth your time. There were some special exhibits that we really enjoyed. We also enjoyed lunch at the cafe there which was very good."
5,National_Museum_of_Wildlife_Art,Oct 2021,not available, ,A somewhat hidden gem -- we loved it,"It is hard to get any real sense of the museum as you pass by on the road because it is built into the hillside. But this turned out to be a favorite part of our trip and it is a fantastic excursion to save for a bad weather day. Overall this is a terrific museum that is much larger inside that it appears from the outside -- it has a soaring entry hall, large, beautiful exhibits, a good sized theater which showed several extremely interesting documentary films. They have a great range of historic wildlife art and well-done and interesting descriptions and commentary. There is a fabulous (if a little small) children's section. They also have a great sculpture garden outside. Finally, while we wouldn't visit the museum just for this they also have a very nice and pretty good sized gift shop with items you won't find in downtown Jackson. (Oh, and it may sound strange to say but they have the most artistic bathrooms we've ever seen. If you go you'll understand what we mean. Quite beautiful.)"
6,National_Museum_of_Wildlife_Art,Jan 2022,not available,Arizona ,Worth The Stop,Beautiful artwork throughout in a beautiful facility. Well worth the stop - you can get through this in about 60-90 minutes.
7,National_Museum_of_Wildlife_Art,Dec 2021 , Solo, ,Great collection and beautiful building,"An amazing collection of art. The staff was helpful, it was easy to social distance, they had free lockers for storing bags and coats (which they don’t allow in the galleries to protect the art). It was a $15 Uber ride from downtown. I would recommend!"
8,National_Museum_of_Wildlife_Art,Dec 2021,not available,"Clearwater, FL ",A Must Visit while in Jackson,This is a must see while in Yellowstone and Jackson WY area. It is a beautiful building inside and out with incredible wildlife art galleries. Restaurant Palate is excellent as well. With lunch allow 3 hours for your visit  .
9,National_Museum_of_Wildlife_Art,Nov 2021 , Friends,"Eastham, MA ",Outstanding exhibits,"This museum is a gem. The experience starts with the exterior—interesting stone architecture and outdoor sculpture gardens. The exhibitions are diverse—paintings, sculptures, mixed media—focused on wildlife regionally and around the world. The timelines showing the status of species relative to the human dimension, major impacts, as well as wildlife protection laws, was compelling. Activities for children are available as well, making this spot nice for a family experience."
10,National_Museum_of_Wildlife_Art,Sep 2021,not available,"Argyle, TX, ",Amazing Sculptures,"Our dogs were traveling with us, so we were limited to viewing only the outside sculptures. The artistry is amazing and is a wonderful tribute to the native animals. One of our dogs started barking and backing away from the wolf sculpture - that's how realistic it was!"
11,National_Museum_of_Wildlife_Art,May 2021,not available,"North Carolina Mountains, NC, ",Great art!,"Amazing artwork of all kinds; some from famous artists, some not so famous. The outdoor displays are great and we really enjoyed our time there.  Highly recommend stopping there!"
12,National_Museum_of_Wildlife_Art,Jun 2021,not available,"Tucson, AZ ",Glad we stopped!,First time visit to the museum and it was amazing...inside and out. Beautiful permanent and traveling displays. Sculpture outside also interesting. Would return if ever in the area and recommend to all.
13,National_Museum_of_Wildlife_Art,Oct 2021,not available, ,Fabulous! Just Fabulous!,"An amazing collection of exquisite art from world famous to lesser known artists. The collection combines art, appreciation of wildlife, and the landscape of this amazing area. I have visited museums around the world and I thoroughly enjoyed this one. It was far more than I was expecting. What a treat! Don't miss it!"
14,National_Museum_of_Wildlife_Art,Sep 2021,not available,"Marion, NC ",Interesting,We went to this museum on our own and we were won over by all the amazing artwork. Being able to see an original Thomas Moran and just take in the beauty of the sculptures and paintings was well worth the short drive from Jackson. You won't be disappointed making this a stop on your trip.
15,National_Museum_of_Wildlife_Art,Sep 2021 , Couples,"Tampa, FL ",Truly Wonderful,"A building designed to fit its surroundings. The stone structure itself is 2 stories built into the side of the hill it’s on. Parking is easy and free. Upon entering we were on the second level in a large, light and airy atrium and you can use an elevator or lovely curved staircase to go to the first level. We anticipated staying about 90 min but were there more than 2 1/2 hrs.    An interesting aspect was the notes on all the pieces. Graphic symbols were used to highlight whether the piece was of cultural, historical, artistic (or some combination) significance. Notes were easy to read and understand but we found so many of the works beautiful without knowing more. The range or artists was even larger than we anticipated and the art included sculpture as well as various styles and types of work.    A special exhibit of endangered wildlife by Andy Warhol was displayed. It’s his inimitable style but we were surprised he’d done such a collection and were intrigued by the story behind it. Another special exhibit of lego portraits by an Asian artist was hanging opposite it. In addition, there was a wide variety of pieces done by local artists and those attending the museum were encouraged to submit a vote for the one they liked best. Surprisingly, in spite of the large number of submissions, my husband and I decided on the same one.    We had already eaten an early lunch but the cafe looked inviting. The gift shop had quite a selection of reproductions as well.    Strongly encourage checking out this truly wonderful place!"
16,National_Museum_of_Wildlife_Art,Sep 2021,not available,"Cherry Hill, NJ ",Toughtfully planned museum,"The art collections, inside and out are worth a visit. It's a nice place to spend 1 or 2 hours. I recommend it."
17,National_Museum_of_Wildlife_Art,Sep 2021,not available, ,Grand Teton,We stopped in to see Andy Warhol’s and Ai Weiwei’s exhibit. They were magnificent. A nice cultural experience after a nice long hike! The building is beautiful and had a nice patio to enjoy the view.
18,National_Museum_of_Wildlife_Art,Sep 2021,not available,"Tampa, FL, ",Must See if you are a Art Enthusiast | Don't Miss Out on This Gem of a Museum!,"I was a bit skeptical about going to a museum dedicated to wildlife art but I was quickly proved wrong and pleasantly surprised at how rewarding and entertaining the artworks and sculptures were. The admission price for adults was just under $15.00 and it was worth every cent. What a fabulous experience.    many local artists are highlighted and plenty of wildlife portraits, many inspiring.    I really recommend a visit."
19,National_Museum_of_Wildlife_Art,Sep 2021 , Couples,"Matthews, North Carolina, USA ",Great time at the museum!,We loved this museum and spent about 3 hours there. The available (and free) audio guide that you access via a phone app is excellent as are the exhibits. We went here first on our arrival in Jackson and it was a great way to kick off our visit.
20,National_Museum_of_Wildlife_Art,Sep 2021,not available,"Austin, TX ","Great Art, Great food and friendly service","Lots of really fantastic wildlife paintings. Well worth seeing. Also, has a really nice restaurant with great food and wonderful service. Highly recommend."
21,National_Museum_of_Wildlife_Art,Sep 2021,not available,Colorado ,Spent 1-3 hours.,"We stop here every 3 years and never get tired of visiting.  Great collection of older and new art of all types. of animals..the lego ""paintings"" you see as you leave the galleries are really amazing.    It was fun to vote on a favorite piece as part of a special collection exhibit.    A must-stop as you are in a wildlife area! Get into the spirit."
22,National_Museum_of_Wildlife_Art,Sep 2021,not available,"San Antonio, TX ",Beautiful museum,"We found this museum to be a nice selection of wildlife sculptures, paintings, and exhibits. The staff was friendly and we enjoyed spending time admiring the beautiful displays inside and out."
23,National_Museum_of_Wildlife_Art,Sep 2021 , Couples, ,Tells the story of humans and animals and our complicated relationships through art. Definitely recommend for wildlife lovers.,"My husband and I both loved this museum. The focus is on the relationship between humans and wild animals, going as far back as pre-Columbian pottery. There was an interesting section on European art and its emphasis on ""menagerie"" depictions with themes of domination and control, followed by the shift to realism after Darwin's theories became widespread. Beautiful art for its own sake as well as for telling the story between animals and humans. Nice gift shop as well :) Very friendly staff."
24,National_Museum_of_Wildlife_Art,Aug 2021,not available, ,Wildlife Art Museun,"Wonderful museum with many different art forms, all focused on wildlife, mainly western US animals. Worthwhile place to visit."
25,National_Museum_of_Wildlife_Art,Aug 2021,not available,"Atlanta, GA ",Definitely worth the visit!,"Highly recommend going to the National Museum of Wildlife Art! It is not a large museum but very well curated and manageable. It will have something that should interest everyone and the people who work there are very nice and helpful. The building itself is a work art nestled into the base on the mountains. The sculptures, in order and out, are beautiful dynamic pieces. The inside covers a wide variety and the Warhol exhibit was really cool. Definitely worth stopping in."
26,National_Museum_of_Wildlife_Art,Jul 2021,not available,"Sudbury, MA ",July 2021 Family Vacation,"Very interesting collection of wildlife art, we were able to be there for the Andy Warhol art exhibit as well. Beautiful building inside and out housing an excellent art collection. Really enjoyed our visit."
27,National_Museum_of_Wildlife_Art,Aug 2021,not available,"Cleveland, OH ",Definitely worth a visit!!,"We stopped on a rainy day and so pleased we did not miss this Jackson Hole gem. Beautiful collections of local and national wildlife from the the late 1800's onward. We were lucky to catch the Andy Warhol special exhibit -- not something I would expect in a museum like this but were beautiful! Masks required, lots of room to explore, beautiful architecture inside and out."
28,National_Museum_of_Wildlife_Art,Aug 2021,not available,"Hackettstown, NJ ",Wonderful place to visit both outside and inside,If you are into museums (and even if you're not) the National Museum of Wildlife Art will not disappoint. I recommend going before the heat of the day sets in so you can comfortably walk the paths around the museum to enjoy all of the outdoor sculptures before going inside. The collection of art indoors was top notch. At the time we went there was an Andy Warhol endangered species exhibit which was very impressive. We spent about three hours total outside and inside. They have a lovely cafe on site as well.
29,National_Museum_of_Wildlife_Art,Aug 2021,not available,California ,"Interesting Museum Outside of Jackson, WY","Really excellent museum with a great cafe. Extensive art work inside and huge sculptures of animals outisde. They are currently showcasing wild animal artwork done by Andy Warhol, who was apparently a wildlife advocate. And it's juxtaposed against artwork done by a Chinese artist who developed animal portaits using Legos. And, the rest of the artwork, combined with background information on the development of the West was really interesting."
30,National_Museum_of_Wildlife_Art,Jul 2021,not available,"St. George, UT ",This One Is On Dan!,"Must admit it – I resisted the idea. Wife wanted to badly, but I held back. For three days!    Then I spoke by phone with a dear friend in FL. He recounted his last trip to Jackson Hole, WY and how he wished he was there with us now.    One of his all-time favs was just outside of town on the way to Grand Teton National Park. As he spoke, his infectious enthusiasm started to have an impact on me.    That is how I found a new personal fav – The National Museum of Wildlife Art on the fringe of Jackson, WY,    The displays of the museum are both outside and inside the building. Many are large, really large sculptures that are just awesome. Others are minute. All are of the finest quality I have ever viewed.    To be honest we did not spend the four hours enjoying the exhibits that Dan reported they had, but we really enjoyed the two plus hours we lingered.    Great show for a $15 admission fee!    We could not RECOMMEND IT MORE!"
31,National_Museum_of_Wildlife_Art,Aug 2021,not available,"Salt Lake City, UT ","Excellent art museum, focused on the outdoors","An excellent museum in a beautiful building, worth seeing no matter what kind of art you like. The collection is focused on landscape and wildlife art, with a large but not exclusive focus on US and Canadian artists. The works are mainly paintings, but the Museum has sculptures, ceramics, and more. It's terrific, and is located on a hillside above the National Elk Refuge."
32,National_Museum_of_Wildlife_Art,Jul 2021,not available, ,Great fine art collection,"The visiting collection from Warhol and Ai Weiwei were just ok, but the permanent collection is actually really great. Would recommend."
33,National_Museum_of_Wildlife_Art,Jul 2021 , Family,"San Antonio, TX ",Beautiful museum!,"Wonderful artwork, sculptures and museum! Loved it! The museum itself is designed artistically and has very interesting exhibits and artwork. Definitely worth a visit. I will go back if I'm in that area again. Quite impressive!"
34,National_Museum_of_Wildlife_Art,Jul 2021 , Couples,"Venice, FL ",Visiting the National Museum of Wildlife.,Nice relaxing morning at National Museum of Wildlife. Sculptors and paintings worth seeing if you have the time.
35,National_Museum_of_Wildlife_Art,Jul 2021,not available,Jenison ,Beautiful and well done museum,"This museum is treasure. Beautiful art, well thought to design and layout. I was very impressed and definitely would return."
36,National_Museum_of_Wildlife_Art,Jul 2021,not available,"Carrollton, TX ",Worth seeing,"Stopping here was a last-minute idea on our way out of town, but I'm really glad we did. We all really enjoyed it, including our 11-year-old son. The view is lovely from the top, and the artwork was very interesting. I like how they have it arranged in chronological order so you can see how art has evolved through time."
37,National_Museum_of_Wildlife_Art,Jul 2021,not available, ,Beautiful Museum,Wonderful museum with beautiful wildlife art and education. Our family enjoyed roaming the museum at our own pace and listening a long with the commentary you can add via the museum app. The outdoor statues and displays were very neat. We also enjoyed the Marmot crossing and saw a very cute little round Marmot during our visit.
38,National_Museum_of_Wildlife_Art,Jul 2021,not available,"Kent, WA ",Not to be missed,Our family of six adults visited the museum on our last day as the museum is located close to the Jackson airport. Amazing art of all types - mainly paintings and sculptures - was on display. We especially liked the temporary Andy Warhol exhibit highlighting species on the verge of extinction. Many thought provoking pieces make you think about human's impact to wildlife and nature.
39,National_Museum_of_Wildlife_Art,Jun 2021,not available,"Brandon, MS ",Nice visit,"Interesting artwork, beautiful statues and view outside. A lot of nature and wildlife paintings for the art lover."
40,National_Museum_of_Wildlife_Art,Jun 2021,not available,"Anna Maria, FL ",Don't miss this!,This is a gem! So much wildlife-themed art in so many styles in a unique setting with a nice gift shop and a very nice restaurant.
41,National_Museum_of_Wildlife_Art,May 2021,not available,"Sandwich, MA ",A Must See Museum in Jackson Hole,"This museum of western art is not only a beautiful and interesting structure, and it is a fascinating collection of landscape and wild life art. I love the Hudson River School of painters and learned that a number of them came to the west to paint. Some of their work is in this museum. Beautiful wildlife sculpture all around the outside of the museum along a walkable path. Loved it.!"
42,National_Museum_of_Wildlife_Art,Jun 2021,not available,"La Quinta, CA ",Time well spent!,It is a beautiful museum with a wide range of paintings and sculptures of the wildlife if the west. It was time well spent.
43,National_Museum_of_Wildlife_Art,Jun 2021 , Couples,"Orlando, FL ",Beautiful art,"Beautiful art and educational atmosphere. Well worth visiting for a few hours. There are a lot of bronze statues of various animals from this area and around the world. Plus, there are many paintings, oil, acrylic, and mixed medium."
44,National_Museum_of_Wildlife_Art,May 2021,not available,"Chula Vista, CA ",Enjoyed the Building More than some of the Exhibits,"The paintings from late 19th century was impressive, though I didn't care for the modern ones. The building itself and the view from the sculpture yard were great"
45,National_Museum_of_Wildlife_Art,May 2021,not available,"Fort Worth, TX ",Very Nice Museum,"Not a very large museum and one gallery was closed but it was still worth the visit. We arrived an hour before closing which is not enough time for a proper tour, but we did enjoy our time there. Recommend spending two or more hours."
46,National_Museum_of_Wildlife_Art,May 2021,not available,"The Woodlands, TX, ",Impressive Wildlife Museum,"The museum was impressive. Paintings, sculpture, the collection is vast and its a wonderful way to spend a few hours. Even hubby enjoyed wandering through the many rooms. We sat a few times and studied a few of the oil paintings that were amazingly lifelike. The bear and wolf were my favorites. We strolled through the outdoor exhibit of metal art afterwards and were impressed by the cleanliness of the entire area, inside and out. We didn't stay for a meal from the restaurant but the menu looked interesting. We highly recommend the museum if you are a fan of wildlife art."
47,National_Museum_of_Wildlife_Art,May 2021 , Couples, ,Great museum,"Great place to see. The art is amazing and well worth the time. The museum is very nice, well run and clean. The have a great little gift shop and a restaurant with a nice view."
48,National_Museum_of_Wildlife_Art,May 2021,not available,"Douglass Hills, KY ",Great rainy day activity,We were impressed by the size of their collection. It was a great way to spend a couple hours on a rainy day and to think about what a great eye these artists had for wildlife.
49,National_Museum_of_Wildlife_Art,May 2021,not available, ,"Great place for wildlife, art, and lunch.","We stopped here immediately after our flight into Jackson to kill some time waiting for hotel check-in. We ate at the on-site restaurant, Palate, which had tasty food and offered great views of the National Elk Refuge. The museum itself if quaint, but offers a great selection of art. The staff is very friendly and kind, and really made our visit enjoyable. If you have the time, I highly recommend lunch and a visit!"
50,National_Museum_of_Wildlife_Art,Apr 2021,not available, ,Tells a great story,"This in not just an art gallery. It tells the story of wildlife art over the centuries. Informative and yes, the artwork is great. The grouse photography display was a highlight but it's not permanent."
51,National_Museum_of_Wildlife_Art,Mar 2021,not available,"Kinmundy, IL ",Love This Museum,"The facility is lovely with a great view of the elk ranch across the highway. The staff members were very friendly and helpful. A docent, who gives a wonderful guided tour, is available on Tuesday. However, the signage is excellent along with access to recorded information. At the time we visited, it wasn't crowded, allowing for time to leisurely enjoy the art while feeling safe during COVID restrictions. Many different types of art were on display from high quality professional pieces to students' school art projects. Their assignments were thought provoking, and we enjoyed their interpretations even though their subjects weren't necessarily wildlife themed."
52,National_Museum_of_Wildlife_Art,Mar 2021,not available,"Tampa, FL ",Amazing Mesuem,"This is our second time here, and it is a beautiful museum in winter or summer. We love the outside sculptures as well. The gift shop has some great local artworks and always a stop when we are in Jackson Hole."
53,National_Museum_of_Wildlife_Art,Mar 2021,not available,"Atlanta, GA ",Fantastic museum with the friendliest staff,"Absolutely can't miss artwork, particularly if you're an animal lover or American history buff. The staff couldn't have been more accommodating. One of the best museum experiences I've had in the US."
54,National_Museum_of_Wildlife_Art,Feb 2021 , Couples,"Kingsville, MD ",Beautiful art,Reasonable price of admission with very friendly staff and outstanding exhibits. Fun for all ages and informative.
55,National_Museum_of_Wildlife_Art,Dec 2020,not available,"Jonesboro, GA ",Winter 2020,Great museum! The depth of artwork highlighting the animals around Jackson Hole was tremendous. Would recommend it for everyone. The grandchildren even enjoyed it.
56,National_Museum_of_Wildlife_Art,Jan 2021 , Couples,"Hanapepe, HI ",Excellent Museum and Day Trip Must See,"This museum was outstanding and well worth a visit as part of your must do list while visiting the Jackson Hole area and town of Jackson. The staff was super friendly, the walkways were kept clear during heavy snow and the restrooms are the cleanest and most modern in the area!!    The art collection is also First Class and the best I have seen for wildlife. We also had lunch at the restaurant and all meals were extremely well prepared, very tasty and complimented with a formidable list of wines! Try the trout fish and chips for sure! Great service for a good price. We will definitely return again!"
57,National_Museum_of_Wildlife_Art,Jan 2021 , Couples,"Fairfax County, VA ",Fabulous Art and Perfect Flow,"After receiving several recommendations to visit the museum, we took the plunge and popped in. Reasonable entry fee, free lockers and a friendly staff welcomed us. The exhibits and presentation blew us away. Such beauty and variety. Never have I seen such stunning artwork depicting the beauty of God’s creations. Give it a half day and take your time. No shortcuts. Hit every room; you’ll be glad you did!"
58,National_Museum_of_Wildlife_Art,Jan 2021,not available,"Reno, NV ",An amazing unexpected jewel! Must see!,"Reserve at least 3 hours to enjoy it properly. Didn't expect such a world class collection. And it is curated beautifully, with all the last technology and innovations of the museum world. The building itself is very integrated to the its surrounding. Don't let the size deceive you. The museum appears to be smaller than it really is."
59,National_Museum_of_Wildlife_Art,Dec 2020,not available, ,Wonderful Collection of Art,We were very surprised by the amazing exhibits and art works at this museum. Would highly recommend a visit if you are in Jackson!
60,National_Museum_of_Wildlife_Art,Dec 2020 , Friends,"Monticello, GA ",Amazing museum overlooking the Elk Refuge.,I love this type of art. The paintings are fabulous and the outdoor sculptures are amazing. The location and setting of the actual museum building fit perfectly into the surrounding environment. I would recommend this museum to anyone.
61,National_Museum_of_Wildlife_Art,Oct 2020,not available,"Moraga, CA ",Not a culture guy,I really enjoyed visiting. It didn't look like much from the outside although the building itself is beautiful with its stonework. but once inside it is remarkable how much art is presented.
