,place,date,category,place ,Tagline,Review 
96,Town_Square50,Oct 2020 , Couples,"Johnson City, TN, ",Real neat,"We enjoyed seeing this place. So interesting, the history of these antlers! There were more people than what we prefer as we like quiet and relaxed. But it was interesting to see. Many restaurants and shops."
97,Town_Square50,Oct 2020,not available, ,Interesting & Beautiful,"We visited Town Square this week. It's a beautiful place with plenty of antlers to see, and shops and restaurants to visit. Dress warm; it's cold."
98,Town_Square50,Oct 2020,not available, ,Great place to shop and eat,We visited Town Square a couple of day ago. It's simply a beautiful place with plenty of shops and restaurants to visit. Dress warm as it does get cold.
99,Town_Square50,Oct 2020,not available,"Delray Beach, FL ",relaxing place to walk through downtown,the center of town; one of the arches is lit in purple. Very safe town. We stayed in walking distance of downtown.
100,Town_Square50,Sep 2020 , Couples,"Long Island, NY ",Cute park,"Nice area, center of Jackson hole, lots of eateries but need to make reservations as it was very busy and due to covid which we did.Lots of shops to get souvenirs."
101,Town_Square50,Oct 2020 , Family,"Alpine, UT ",Cant miss it.,Cant miss this famous park if you are in Jackson. This is the famous picture of the antler entry’s and a must stop for a photo. Park sits in the center of town surrounded by stores and restaurants.
102,Town_Square50,Sep 2020,not available,"Jerome, ID ",Well-kept Iconic Park,"In town on business, I visited in early evening after dark. There were tables and chairs lining the streets around the square, something I had never seen. The ambiance was lovely and I totally enjoyed myself. Another person talked about how crowded it was - I heard from many locals that this was the busiest September they had ever seen, due to Covid Escapism. I also had trouble finding parking, and getting through town north or south is extremely difficult due to road construction and congestion. But the iconic park offers cool shady seating and nice views of the area around the square. I love going solo so fighting crowds isn't a problem for me. If you can walk, park a comfortable distance and see the square on foot. It will take less than an hour, unless you stop to shop."
103,Town_Square50,Oct 2020 , Couples,"Hollywood, FL, ",Nice square park 😀,"Really cute park, full os shops, restaurants and many tourist around. If it is a nice day it is really nice to take a sit at the park and enjoy😀"
104,Town_Square50,Sep 2020,not available,"Portland, OR ",Happening!,"Wonderful shops, galleries and restaurants. We especially enjoyed the beautiful gallerias with gorgeous art work and photography."
105,Town_Square50,Sep 2020,not available,"Jenks, Oklahoma, United States ",Way too crowded.,"Jackson has gone nuts. I was there years ago, and loved the place. This time we were there at the end of September and the place was packed. We tried for two nights to visit after leaving Yellowstone, and had to give up. There was no place to park and every restaurant still had people standing outside the doors at 9pm. The only thing we got to see in Jackson was the Albertson's where we picked up food for dinner."
106,Town_Square50,Oct 2020 , Family,"Carpinteria, CA ",Busy off season,There were still a lot of people out and about About half the people wearing masks even with signs up everywhere. Nice visit and enjoyed town square. Just a bit crowded for me.
107,Town_Square50,Sep 2020 , Family,"Indianapolis, IN ",Cute town square,Loved the Antler arches at all four corners of the town square. Lots of people enjoying the green space of the park. Lots of interesting stores lining the streets as well.
108,Town_Square50,Sep 2020 , Family,"Lafayette, IN ",Downtown area is great,"We just left this area today. As a group we really enjoyed downtown Jackson Hole. Our group varied in age from 13 to 63, so you know there is a lot to offer. There are lots of small boutique style shops and eateries. There was also plenty of parking available."
109,Town_Square50,Sep 2020 , Couples,"Fort Walton Beach, FL ",Take the moment,"If you’re in Jackson, it’s well worth it to take the time and walk through and around the town square. Town has done a nice job. Antler arches at all four corners and a dramatic memorial to local servicemen in center of park."
110,Town_Square50,Sep 2020,not available,"Alpharetta, GA, ",The Center of Activity,"This is the center of activity in Jackson. The streets on all four sides are lined with galleries, cafés and restaurants, bars and tee shirt shops.    Venture away for the square for more interesting shops and dining opportunities."
111,Town_Square50,Sep 2020 , Couples,"Jackson, Missouri ",Finally!,"Have seen pictures of this place for years, finally got to experience it for myself! Awesome place, one corner has a webcam you can view yourself!"
112,Town_Square50,Sep 2020 , Couples,"Plant City, FL, ",Fun photo spots,The 4 corners of the park in the town center had great antler arches. Of course we had to take some photos to remember this fun town. Rhey were huge and impressive
113,Town_Square50,Sep 2020 , Family,"Poquoson, VA ",Photo spot,Great place to take a photo for Jackson Hole on your vacation . Nice family park behind that whole public concerts
114,Town_Square50,Sep 2020 , Couples,"Kenmore, WA ",Nice square,It’s a nice square with great set of antlers for entrances. All tourist traps are around here as well as a few decent places to eat and shop.
115,Town_Square50,Sep 2020,not available,"Westcliffe, CO ",relaxing,"cool and shady - could use a few more benches, but a beautiful place and they were setting up for a craft/art show. Good place to take a breather from heavy shopping!"
116,Town_Square50,Sep 2020,not available,"Castle Rock, CO ",Beautiful park,"This park is at the center of Jackson, and they were having a Farmers market and craft and art venue."
117,Town_Square50,Sep 2020,not available,"Sutter, CA ",Antler Arch in Town Square,"You must visit the town square and see the beautiful antler arches and then visit all the shops. You have so many lovely stores: art galleries, restaurants, books stores and clothing. This is a must do ...."
118,Town_Square50,Sep 2020 , Couples,"Saint Joseph, MO ","Relaxing, clean peaceful",We had a great time just sitting on benches watching everyone. Very clean park! So peaceful just to step back and enjoy life
119,Town_Square50,Sep 2020,not available,"Palm Springs, CA, ",Great little town square. . . .,Great town square. . . Jackson hole is charming town and we enjoyed walking around the main square and venturing into the many great shops. The antler arches of course are the big draw to this town square which is great for a quick photo.
120,Town_Square50,Sep 2020 , Couples,"Cabo San Lucas, Mexico ",The town of Jackson was crowded.. we tried to stay outside down town,"Lots of lines. Great shopping for leather, fur, silver jewelry, cowboy garb, touquoise, trinkets, art galleries everywhere! It was a great shopping experience... but we to Wilson to eat at Chippy’s caterer and bistro.. great lobster rolls!!!"
121,Town_Square50,Sep 2020 , Couples,"Cincinnati, OH, ",Photo Op,"There are several entrances to the park having antlers, so there are numerous chances for photos. It will be difficult to get a photo with others not in it."
122,Town_Square50,Sep 2020 , Couples,"New Orleans, LA ",Just a must see,Go. See it. Take the obligatory photo with the antler arch thingy.    More importantly enjoy the shopping surrounding it 😍
123,Town_Square50,Sep 2020,not available,"Santee, CA ",Too Crowded,"If you want to go to somewhere super overcrowded... this is the spot for you!! We luckily found parking right in front, hopped out and took a photo. There were people everywhere. We got back in the car and kept driving."
124,Town_Square50,Sep 2020 , Family,"Austin, TX ",Must Photo Stop,Plenty of shops and restaurants around the Town Square and a must photo stop under the arches if in downtown Jackson Hole.
125,Town_Square50,Sep 2020,not available,"Atlanta, GA ","Beautiful, active town square","A great place to wonder around looking in shops, appreciating art, and taking some pictures with the famed antler arches. There are so many great restaurants in this area!"
126,Town_Square50,Sep 2020,not available,"Science Hill, KY ",A cool entry in downtown.,I enjoyed visiting the town Square. All the shops and restaurants are nearby. It was my third time visiting here. The first time in the summer and a lot busier than early October and Late September.
127,Town_Square50,Sep 2020 , Couples,"Miami, FL ",Must do if in area,The town square itself is a great place to take photos and learn more about Jackson’s history. It’s also conveniently located next to multiple shops and restaurants.
128,Town_Square50,Sep 2020,not available,"Florida, USA ",Typical Tourist spot,"No big deal, in person. Just a bunch of people wanting pictures in front of this arch made of antlers. There is one on each of the four corners of this small park, that would be nice, if it was not full of tourists. Just spend all of your time in The Grand Teton National Park, as it is the only reason to be in Jackson."
129,Town_Square50,Aug 2020 , Family,"Chanhassen, MN, ",Great photo Opportunity,Cool photo opportunity with all of the elk sheds. The park itself is fairly small however some benches for those looking to take a break. Lots of good shops and restaurants surrounding the town square and they had a really good farmers market on Saturday.
130,Town_Square50,Sep 2020 , Couples,"North Port, FL ",A must on your list,"Beautiful Park, nice place to stop and relax for a while. This park has been used in numerous movies. The antler arches make a great photo stop"
131,Town_Square50,Sep 2020,not available,"North Salt Lake, UT ","""A Unique Square""",A unique Western town square. Four corners of Elk antler arches with a monument in the center to local Veterans. A nice grassy area with trees surrounded by loads of shops and restaurants. A must see!
132,Town_Square50,Aug 2020 , Family,"Orlando, FL ",Small grassy park surrounded by busy streets,Stopped here for a few minutes while others in our group went into a store across the street. The square itself is a quaint little areas with grass and sidewalks. Keeps you away from the busy streets. All the entrances to the square have the elk antlers arch which is pretty cool to look at. Many people do walk through the square to get from one point to another. Would be a good place to have breakfast or lunch on one of the benches.
133,Town_Square50,Aug 2020 , Family,"Georgia Coast, GA ",Cute town worth a day trip,"What a cute town!! We’re from California, Northern might I add, and this town kind of reminds me of a cute Tahoe area like a mini state line kind of. Lots of cute boutiques and stores. Tons of t shirt and souvenir shops, I think shirt off my back had the best deals for souvenir shirts i saw in town. People were very friendly even when it was packed w tourist. Definitely a cute tourist town, everything is kind of pricey but you should expect that i think. Tons of restaurants, I’d recommend mapping them out and making reservations as far ahead as possible especially w COVID a lot of places were reservations only for dinner i noticed. Bring your camera there’s the really neat antler arches at each corner of the town square you’ll wanna take pics under. And not too far out of town square is snow king area, it’s family fun. They have mini golf and mazes and a few rides and a gondola or ski lift. We rode the cowboy coaster and it was a blast. $50 for 3 of us, 2 adults and one child. We all had a blast riding that. Really crazy views up there and your kiddo can ride w you if they can’t go alone. Parks are everywhere, i can think of 3 w in the town square. There’s a neat one back by snow king area that had a rock climbing area. 3-5 structures kids and adults could climb on and tons of green grass to hang on while the kids play. I recommend coming to check the town out for a day. I noticed they had a farmers market down there too on either Saturday or Sunday morning i don’t remember which. We missed it but it looked neat. Definitely try a day here :)"
134,Town_Square50,Aug 2020,not available,"Asheville, NC ",Nice spot for a photo op,"Obviously an iconic spot for a photo, but also a good place to hang out. There was a farmer’s market here on Saturday with lots of neat local products."
135,Town_Square50,Aug 2020,not available,"Plainfield, IL ",Just too crowded,"I am sure the area is wonderful... when not so incredibly over crowded. We walked around for 30 minutes, got a picture with the antlers, and then just left. It was soo jam packed! I had wanted to see many of the shops and spend an entire afternoon here (NOTE - we had originally planned our trip to the area before COVID happened), but there were soo many people that I could barely figure out were I was and where I wanted to go. I completely avoided the area for the rest of my trip."
136,Town_Square50,Aug 2020,not available,"Cape Girardeau, MO ",Unique town square,We were surprised by the number of antlers in each of the four arches. Amazing and beautiful! Great photo op to send back to our friends.
137,Town_Square50,Jul 2020,not available,"Redondo Beach, CA ",Touristy but cool and genuine,"This is a fun town to just walk around in, starting under one of the four elk arches in the town square. Yeah, the town is touristy, but there is enough cool, quaint and genuinely historical stuff so you shouldn't mind all the other tourists."
138,Town_Square50,Aug 2020 , Couples,"Coeur d'Alene, ID ",Great Walking Area,We love walking through the town square and shopping in the shops. Lots of shopping and restaurants to choose from.
139,Town_Square50,Aug 2020,not available,"Dallas, TX ",Beautiful!,A beautiful and quaint place! Great restaurants and ambiance. Would definitely recommend coming here for the pictures alone!
140,Town_Square50,Aug 2020,not available,"York, ME, ",A must see in Jackson Hole,Nice little public spot in the downtown area. Great use of the elk shed antlers. Makes for a great photo. We were there early in the day so not to many tourists.
141,Town_Square50,Aug 2020,not available,"Lincoln, NE, ",Iconic Jackson Hole Must see,"Iconic Jackson Hole town square. Don't miss it. Everyone has to get a selfie in front of the Antler Arches. Intersting shopping surrounds the area. Come ""set a spell""!"
142,Town_Square50,Aug 2020,not available,"Saint Louis, MO ",Touristy,"Decades ago, there was one arch. Now, there are 4, to accommodate the photo ops. People were good about wearing masks inside buildings, but obviously quite optional outside."
143,Town_Square50,Aug 2020 , Couples,"White Oak, TX ",No impressed,VERY crowded!! Just wanted to eat dinner and buy a couple souvenirs our first night in Jackson. So many people!! The next night we got room service at our hotel room to  Keep from going the the square.  It just wasn’t our thing.
144,Town_Square50,Aug 2020 , Couples,"St. Petersburg, FL ",It's a must see for the arches,Enjoyed the shopping and the park. There is free parking about four blocks from the square. Really cool area!
145,Town_Square50,Jul 2020,not available,"Frederick, MD ",Thats a lot of antlers,Neat entrances to square. Makes me feel bad for the animals who once had the antlers. Good central location to explore the city from.
146,Town_Square50,Aug 2020 , Friends,"Moorhead, MN ",Crowded but Jackson hole staple,You can’t go to Jackson hole without visiting the town square. At times it is very crowded but there are many cute shops and great restaurants close by. Also good views of the mountains/ski hills surrounding the city.
147,Town_Square50,Aug 2020 , Friends, ,Love the Elk antler arches on each corner!,Cute little town square park with the iconic elk antler arches at each corner. Well shaded. Surrounded by cute stores and business on all sides and horse/carriage rides. Take a pic and everyone will know where you were!
148,Town_Square50,Aug 2020,not available,"Atlanta, GA ",Not enough seating,"During these COVID days the town needs more shaded outdoor seating. The benches at the square are great, but they should add some tables and chairs."
149,Town_Square50,Apr 2020,not available,"Montville, NJ, ",Selfies w/the ELK Antlers,"The town square in Jackson Wyoming lies in the heart of the City. To be precise , Jackson is the name of the city and the area including Jackson is referred to as Jackson Hole mainly because the area is surrounded by mountains.    The square is a community park, albeit small in area. There are benches and walkways and some landscaping with lawn areas. The distinctive design element are the Elk antler entrance arches on each side of the square. Great for photo ops, thus the crowds that always seem to be present. Selfie's with the Elk Arches seem to be very popular.    On Saturday's an seasonal farmer's market can be found selling produce and crafts, honey etc. around the square. Also surrounding the square are a variety of merchant establishments. Wyoming Outfitters, Million Dollar Cowboy Bar, Snake River Grill, Moo's Homemade Ice Cream * Sorbet and the Stage Stop to name a few. Prices are all over the place but many unique items can be found.    The town is very aware of the COVID-19 pandemic and signs can be seen advising social distancing and the wearing of masks."
150,Town_Square50,Jul 2020,not available,"Columbus, OH ",Shopping time,"great area to buy gifts and souvenirs, and just look at things in the stores. There are stores for everyone"
151,Town_Square50,Aug 2020 , Family,Indiana ,Overrated,"Nice little park with gates made of antlers. But it's filled with swarms of people. Honestly, it's cooler in the winter with snow...this trip I just found it annoying because of the crowds. Tons of shops and restaurants around it, some are actually really good but I've just never understood the allure. I find the best of Jackson is off the beaten path."
152,Town_Square50,Jun 2020,not available,"Orlando, FL ",A Slice of Jackson Hole,"We always thought Jackson Hole was the actual town, but it is not. Jackson, WY is the town and Jackson Hole is the entire area -- lesson learned -- now I know that. While visiting Grand Teton and Yellowstone National Parks, we wanted to be sure to see the ""infamous"" Jackson Hole that we'd heard so much about. The entire area is quite beautiful with stunning mountain ranges, ski slopes, wildlife and natural wonders. We spent 1/2 day in the Town of Jackson. I tend to shy away from touristy areas (I was raised in Orlando, FL and it's not the Orlando I loved and knew since the Mouse came to town). You understand my aversion to crowds now as I rarely find myself in the area of tourism in Orlando. Jackson was busy that day, despite Covid, but EVERYONE was wearing masks which was awesome. My husband and I walked around some of the town and had to visit the cool Antler Arches at the Town Square. Very unique and photo worthy. We went into one of the shops that had some pretty and nice gift ideas for folks back home. Some things pricey but some reasonable. We stopped in for a quick bite to eat at one of the small cafes, had seen enough and headed back to our RV campsite near Yellowstone. I've seen Jackson now, got my fix. I'm good."
153,Town_Square50,Jul 2020 , Family,"Saint Louis, MO ",Nice area,"Very well maintained nice area for pictures and to sit and relax a bit, in the middle of many stores and restaurants  Many signs reminding people to social distance and wear masks"
154,Town_Square50,Jul 2020,not available,"Centerville, UT ",Very crowded and not much social distancing,"The Town Square in Jackson is an iconic place, with four elk antler arches at each corner which are magnets for the social media/selfie crowd. It's actually a nice little park with some shade trees and grass, but it is overrun with people, most of whom were not social distancing and couldn't be bothered paying attention to the people around them.    Go early in the morning if you want the square to yourselves and minimal competition for photo ops."
155,Town_Square50,Jul 2020 , Family,"East Brunswick, NJ ",Perfect little town square in the center of a perfect little town,"We saw it on tv before, seen it in person and loved it every time. Tourist town, absolutely. Shops, restaurants, galleries, public art displays...beautiful place to hang out after a day of hiking at the GTNP. Keep your eyes, mind and heart open, and the experience will be unforgettable. We can't wait to go back!"
156,Town_Square50,Jul 2020,not available,"York, SC ",Beautiful town square,"The town square is beautiful. There are shaded benches all around. There are four entrances with the antler arches at each entrance. We went here often to people watch. We also went to marmot watch. The marmots have homes under the walkways. They come out and are fun to watch. There is a beautiful monument to war veterans here also. On Saturday mornings in the summer, there was a farmer's market lining the outside of the park. There were many vendors selling interesting items from vegetables, homemade bread, etc. Very convenient to walk to from our hotel."
157,Town_Square50,Jul 2020 , Family,"Nacogdoches, TX ","Nice square, bit crowded","Nice quaint square with many shops and restaurants. Expect crowds though. Friday night was ridiculous, 1 hr+ waits at all the restaurants, recommend reservations."
158,Town_Square50,Jul 2020,not available, ,Beautiful place,Great place to sit and people watch and so convenient to all the shops. Love the creatures in the park!
159,Town_Square50,Jul 2020,not available,"Houston, TX ",Nice place to shop and dine!,"The town square is the center of commercial activity in Jackson. The quaint shops, restaurants and bars make it a must stop on your visit. The Antler Arches also make for a great photo opportunity. There is a farmer's market on Saturday mornings."
160,Town_Square50,Jul 2020 , Family,"Pittsburgh, PA ",Elk antler archways,This was our first visit to the Town Square and we found the elk antler archways to be pretty interesting. This is a nice shady spot to take a rest from shopping. People had blankets spread and were just relaxing.
161,Town_Square50,Jul 2020,not available,"Dallas, TX ",Very cool antlers!,The antlers are worth getting a picture of! Very neat and really nice to have this in the town square!
162,Town_Square50,Jun 2020,not available,"Edwardsville, IL ",Heart of Jackson,Town Square is a must visit. Great vibe and plenty to walk around and see. Pick up your gifts and eat a little. Make sure you get your pic in front of the arches
163,Town_Square50,Jul 2020 , Couples,"Bozeman, MT ",It’s a “must-do” while in Jackson!,"Always fun, & always lots of friendly families & couples from all over enjoying the park, the shops & restaurants, etc. Go for a stagecoach ride in a Wells Fargo stagecoach! Take your photo beneath one of the antler arches at each corner of the square!"
164,Town_Square50,Jul 2020 , Family,NAPLES ,Tour of the town,"Such a great..clean..n beauty little town. So much to see, very updated! Loved the stage coach ride through the town, 100% awesome for kids!!!..also loved the eateries that have seating on top over the town. So quaint..."
165,Town_Square50,Jul 2020,not available,"McMinnville, OR ",Fun experience and great photo shot,Take a picture of yourself at The Antler Arch. The photo will live forever. In the town square are 4 arches.
166,Town_Square50,Jul 2020 , Couples,"Anderson, IN ",Antler arches,Nice little place to rest with plenty of shade. Great place to eat a snack and recover in between shops.
167,Town_Square50,Jun 2020 , Couples,"Los Angeles, CA ",Wonderful outdoor experience,"I absolutely loved Town Square. It was filled with people picnicking, reading, and enjoying the fresh air. I also saw chipmunks-being an animal lover, this was a plus. A definite place to visit for anyone coming to Jackson."
168,Town_Square50,Aug 2019,not available, ,A Fun Half Day Excursion,"Lots of shops, restaurants, and good photo opportunities. Parking can sometimes be difficult to find, and you might want to make dining reservations if visiting over a holiday or long weekend, but other than that very enjoyable."
169,Town_Square50,Jun 2020 , Family,"Rochester Hills, MI ",Interesting landmark,"4 on each corner, 1 at airport. 2400 sets of elk antlers on each one! These antlers are shed also, so no animals were harmed :)"
170,Town_Square50,Jun 2020,not available,United States ,Yellowstone return route,"Check the weather, bring layers. Nice hometown square with a few things to look at and a lot of touristy stuff. Worth the walk around the square."
171,Town_Square50,Jun 2020 , Family, ,Really cool park,"Really cool park, this is a must see if you visit downtown Jackson. It is impossible to miss these antler arches if you go downtown"
172,Town_Square50,Jun 2020 , Family,"Orlando, FL ",Arches are beautiful,Nice tranquil space with the beautiful elk antler arches. Check out the stagecoach a and enjoy the ambiance!
173,Town_Square50,Jun 2020 , Solo,"Jackson, WY, ",A joy,"Not only a green spot in the midst of commercialisms bustle, it is a place of heritage. Circling the square are wonderful historical displays chronicling this town remarkable story. But in the center, the newly refurbished veterans memorial restores the iconic bronc buster but now atop gorgeous black granite tablets listing Jackson’s veterans from every conflict and with room for many more names."
174,Town_Square50,Jun 2020,not available,"Denver, CO ",good time,"we took several pictures, had good time, not that much crowded, had with me my coffee and sit there ,the weather was nice"
