,place,date,category,place ,Tagline,Review 
347,Town_Square50,Jun 2019 , Family,Illinois ,Must see,"Jackson Wyoming has a beautiful town square! Don’t just stand outside the square, take a stroll through the park. Check out the shops surrounding it."
348,Town_Square50,Jun 2019 , Couples,"Jefferson, LA ",Beautiful arches,"Was very happy and relieved to understand that the antlers were all naturally shed by the elk. I had visions of a massacre, but it was all harmless, and wonderful to see."
349,Town_Square50,Jun 2019 , Couples,"Cape Coral, FL ",Very Unique,Seeing arches made completely from elk antlers is impressive. Hundreds of antlers had to have been used for this project and it turned out fascinating to see.
350,Town_Square50,Jun 2019 , Couples,"Lewes, UK ",Pretty square with lots to see and do,Visited here earlier this month and really enjoyed Jackson. There is often entertainment in the area around the town square. Antlers on each corner are amazing and much photographed. Horse and carriage rides also available.
351,Town_Square50,Jun 2019 , Couples,"San Antonio, TX ",Saw it on the webcam!!,Had to visit and have our picture taken. Enjoyed watching the squirrels peek ou from under the walkways.
352,Town_Square50,Jun 2019 , Family,"Orange Beach, AL ",Must See,Very cool archway at each corner made from elk antlers. Great photo opportunity to remember your visit. Lots of shops and galleries within walking distance. Parking is not bad if you are patient.
353,Town_Square50,Sep 2018,not available,"Denver, CO ",Not a lot to do,"More family friendly than most towns, nota lot to do, but at least it is safe to bring kids here...."
354,Town_Square50,Jun 2019 , Couples,"Chicago, IL ",People watching!,"And yes, there are typically a LOT of people in this tiny little town. Great stop to rest for a few minutes...but parking is not easy."
355,Town_Square50,Jun 2019 , Family,"Charlotte, NC, ",Our kids favorite part of Jackson,"Our kids loved coming to the town square. Between getting to run around in the grass, and watching the prairie dogs pop in and out of their holes, it was a nice spot to grab a bench and relax for a bit."
356,Town_Square50,Jun 2019 , Couples,"Williamsburg, VA, ",Loved the antler arches,"Interesting town square, kind of like being in the Wild West. Many shops and restaurants surround the square with lots of tourists everywhere. At each corner of the square is an arch made of elk antlers. This was worth seeing and the most interesting thing I saw."
357,Town_Square50,Jun 2019 , Family, ,One of My Favorite Towns!,"So glad we were able to visit the town of Jackson! Wish we had the opportunity to stay longer. From the shops to the restaurants every was so quaint and charming. What I loved the most was all the coffee shops and restaurants! Cowboy Coffee was a must stop. From delicious coffee to yummy gluten free treats, plus my husband said he had one of the best breakfast croissants ever. The town square itself makes for a great photo opp."
358,Town_Square50,Jun 2019 , Couples,KY. ,Pretty,Nice place to walk to. We stayed at The Lexington.so we were really close to it. All kinds of shopping can be done. Nice shops and cheap shops
359,Town_Square50,Jun 2019,not available, ,great stop,The antler arches are a must see when in Jackson Wyoming all four corners have arches very nice too see
360,Town_Square50,Jun 2019 , Couples,"Atlanta, GA, ",Jackson town square,The Jackson town square is a great spot to enjoy people watching and is an interesting part of the history of the area.
361,Town_Square50,May 2019 , Family,"Prosser, WA ",What a picture,The square is a wonderful place to hang out. The four corner have the perfect place to take a picture
362,Town_Square50,Jun 2019 , Couples,Montana ,Very very crowded.,Expected vacationers. Area is very crowded with people everywhere. People stand and just walk out into the streets so be aware if you are driving recommend avoiding this area. Selfies are possible with patience.
363,Town_Square50,Jun 2019 , Family,"Minnesota City, MN ",Interesting stop if you are in Jackson,"Nice to have a little respite in the middle of the madness that is Jackson. The town square is interesting with the antler arch and the green space in the tourist mecca of Jackson. Jackson, especially at certain times of the day/year is not nearly big enough to deal with the overflow of tourists."
364,Town_Square50,Jun 2019 , Family,"Haslemere, UK ",The focal point of Jackson,This is the one place you can photograph yourself to prove you’ve visited Jackson. It’s right at the centre of town and surrounded by all the shops and restaurants you could want. Very popular with tourists but a good place for the youngsters to run around chasing ground squirrels while you’re resting between shopping
365,Town_Square50,Jun 2019 , Family, ,Great place!,Great place for shopping and restaurants! The square was cute with antler arches at all 4 corners. There are some pricey shops and others with local memorabilia. Seemed pet friendly.
366,Town_Square50,May 2019 , Friends,northbrook il ,of coarse you stop here,its the center of town if your in jackson you can not avoid the town square it well worth your time to walk the square
367,Town_Square50,Jun 2019 , Couples,United Kingdom ,Great part of town,Fantastic center of town with many different types of shops and eating places. Although parking can be a challenge park on the outskirts and walk in there are plenty of things to do and to look at.
368,Town_Square50,Jun 2019 , Couples,"Williams, AZ ",Sightseeing,"Beautiful park and unusual arches out of antlers. This park is not DOG Friendly!!!  A must see in Jackson Hole, Wyoming"
369,Town_Square50,May 2019 , Family,"Pensacola, FL ",Great spot to shop and hang out,"Jackson Hole town square has lots to do. Shopping, eating, historical viewing and shootout. Shopping is at its best with lots of great shops. Local cuisine is great, with game options. In the square there’s the antler arch at all four corners and at 5 o’clock there’s a shootout. I would recommend visiting here on your next time in this area."
370,Town_Square50,Jun 2019 , Couples,"Haines City, FL ",So excited to finally be there!,"The town square is exactly what you would hope it would be. A clean, friendly atmosphere with plenty of shopping and eating options. So pleasant to stroll around the square or sit and people watch."
371,Town_Square50,Jun 2019 , Couples,"Jamesburg, NJ ",Fun part of town!,Town square is in the center of everything so it’s hard to miss. They have 4 beautiful elk antler arches that are perfect for taking pictures under. In the square there are cute benches and it’s overall a nice place to sit and relax
372,Town_Square50,May 2019,not available,"Greensboro, NC ",the antler arches of the Town Square,took a walk to see the town square and all the antlers- as well as walking among the shops - nice memorial to the veterans- saw some cute ground squirrels
373,Town_Square50,May 2019 , Friends,"Syracuse, NY ",Fun town,"Many shops, restaurants and galleries, ""shoot out"" in the evening and other activities. Super town, mostly walkways are enclosed to protect from weather as you walk around. We spent a rainy day and loved it... and breweries !"
374,Town_Square50,May 2019 , Couples,"Portland, OR ",Town Square Old West Style,"This Square is super interesting, from the antler arches on all four sides to the moving war memorial and statue in the center. Makes you feel a part of the areas history."
375,Town_Square50,May 2019 , Business,"Bridgeton, NJ ",Nice town square,Always enjoy the town square and the surrounding area. It never gets old taking a picture in front of one of the antler arches. Enjoy visiting the shops around the square and the galleries- although the art can be rather expensive.
376,Town_Square50,May 2019 , Couples,"Westminster, CO ",Cool town square in the middle of downtown Jackson!,It's always cool to visit a place that has a town square... it tends to be the hub of the community. The elk antler arches (amazing!) are a great place to take an iconic family photo. Don't miss the town square and all of the cool shops and eateries surrounding it!
377,Town_Square50,Feb 2019 , Couples,"LaBelle, FL ",A Must See,"Of course we visited the arches in town square on our honeymoon. A short walk from the Rustic Inn where we stayed. It was a must see. And in the middle of February there was an ice skating rink in one corner, being from Florida we don't EVER get to do that so it was a treat. Even better we made it out without hurting ourselves lol."
378,Town_Square50,May 2019 , Family,"Papillion, Nebraska, United States ",Shopping and attractions!,"Had fun shopping around the town square! And, of course stopped to take our picture at the Antler Arches!"
379,Town_Square50,Jun 2018 , Couples,"Stuart, FL ",Small and quaint,The town square is small and quaint! Arches at every corner of the square. Great to explore for a day
380,Town_Square50,May 2019 , Family,"Austin, TX ",Antler Square,"The area takes you back to the old West. Nice stores, bars, restaurants. Antler arch a must for picture taking. This small town is very easy to navigate regardless of what hotel you choose to stay at."
381,Town_Square50,May 2019 , Couples,"Long Valley, NJ ",Not much going on,The antler arches are an attraction to take a photograph to send home. Several restaurants and T-shirt/souvenir shops surround the Townsquare area. Much smaller than I had expected. It is however a convenient base to spend a night if you are flying into Jackson Hole airport to visit Yellowstone.
382,Town_Square50,May 2019 , Couples,"Liberty Lake, WA ",Easy,"It's right downtown, easy to find, cute to explore, and is the center point from which one can easily find all kinds of stores, restaurants and other businesses. Not much else to say about it. We should keep in mind this is a town with only a little over ten thousand people."
383,Town_Square50,May 2019 , Couples,"London, UK ",Sweet town centre,Lovely centre of old Jackson with individual shops and restaurants on all sides. Good place to walk in the evenings.
384,Town_Square50,May 2019 , Couples,"Collinsville, IL ",Town Square worth a walk,Jackson has done a nice job of creating a mountainside walkabout near and in the Town Square. Nice shopping and dining. We enjoyed.
385,Town_Square50,May 2019 , Couples,"Brisbane, Australia ",Great little park and the antler arbour is a treat,Quite clean and pleasant to see. The park is near enough to the centre of town to allow you to air in the sun to eat lunch or just pass the time
386,Town_Square50,May 2019 , Solo,"Walnut Creek, CA ",A Fun Stroll,So many great shops and galleries to visit and many restaurants make Town Square a great place for a nice stroll around Jackson. Very fun.
387,Town_Square50,May 2019 , Couples,"McDonough, GA ",Picturesque setting,"If you only take one photo to remind yourself of your visit, this is it. The towering arches comprised of shed elk antlers are picture perfect."
388,Town_Square50,Apr 2019 , Couples,"Nottingham, UK ",Stole through town.... 😎,"Lovely little place, surrounded by mountains. Lots of little shops, how I imagined those small towns to look like... A great place to visit"
389,Town_Square50,May 2019 , Couples,"Mesa, AZ, ",Vacation,I have been watching this area for six months via WebCam just to see what the town was like what is surprise how cute but the stores great places to eat love the antlers hoping I can find one to buy in one of the stores
390,Town_Square50,Apr 2019 , Family,"Cincinnati, OH ",Iconic,"This is one of the most iconic places to visit in the western United States and certainly is the epicenter for Jackson Hole. It's also not called the town square for nothing, as it sits right in the middle of the action of downtown Jackson. This small little park features the elk antler arches, a cowboy statue memorial to Teton County veterans, park benches, evergreens, and lots of green grass for the kids to run around. This is a nice spot to unwind after dinner and/or enjoy an ice cream cone from one of the nearby shops."
391,Town_Square50,Apr 2019 , Family,"Lausanne, Switzerland ",Very well done,The several gates leading to the middle place are made of reindeer horns replica. It gives a wonderful and authentic feeling of being in the mountain.    Same sculptures are always displayed at the airport
392,Town_Square50,Jun 2018 , Couples,"Gary, IN, ",A Small Quaint Area,"This is a nice area to visit and see a lot of different stores. There were restaurants, retail stores and other merchandise. As you walk around you see different sculptures. There also snack places like ice cream. The Million Dollar Bar was an interesting place to visit and have a drink if you desired. We just walked around and took our time and enjoyed the small setting. Something for everyone."
393,Town_Square50,Feb 2019 , Couples,"Slidell, LA ",Very nice visit,"We walked through the Town Square several times, for a nice stroll, during our visit. It was lit up very nicely at night and covered with snow. The antler entrances were interesting and nice."
394,Town_Square50,Apr 2019 , Solo,"Long Beach, CA ",Cute and Unique,I loved the town square with the antler aches on all 4 corners. The town square is lovely with its trees. Lots of stores and eateries in the area.
395,Town_Square50,Sep 2018 , Couples,Paradise  ,Must see this,The town square with the elk horn decor on the corners is a must see stop on your trip to Jackson. You can't miss it as you drive through town. Be sure and get a photo of yourself here.
396,Town_Square50,Apr 2019 , Family,"Asheville, NC ",Town square,"My family and I walked thur town square it was a nice maintained area. The antlers are ""novel"" as my wife would say. There kinda of creepy but that my opinion. We were glad to learn from our wild life guide earlier that day that they shed them yearly and people find them all over. It was kinda cool something I've never seen before. My grandson thought it was cool."
397,Town_Square50,Apr 2019 , Family,"Kimberly, ID ",Elk Horns,"The center of Jackson Hole is the Town Square and the history behind it is fun to learn about. It is small but takes you back in time to when the towns activity happened in the Town Square, in the summer time there is a lot of activity here-well worth the time to see."
398,Town_Square50,Apr 2019,not available,"Cheyenne, WY ",Very western like town,"In the Winter, if you like the quietness and western like feel Jackson Home is a great place. I was pleasantly surprise how diverse it is and the people are very welcoming."
399,Town_Square50,Mar 2019 , Couples,"San Francisco, CA ",Quaint town square,"I must visit while you're at Jackson, surrounded by away galleries, shops and restaurants, you can take a nice walk around the square and taking many good pictures of the town."
400,Town_Square50,Mar 2019 , Family,"Danvers, MA ",Jackson Hole - Town Square is a must!!,"When in Jackson Hole, you need to stop by the Town Square. There are 4 archways of antlers where you need to take a picture. Surrounding the town square are a bunch of restaurants and shopping."
401,Town_Square50,Mar 2019 , Family,Florida ,Western Feel and Easy Access,"We love the town of Jackson, and the square is the perfect meeting place when everyone wants to split up and go in different directions. The antler arches make perfect photo ops, and it's just a great place to rest and take in the surrounding views of Jackson."
402,Town_Square50,Jan 2019 , Family,"Sallisaw, OK ",Shopping,Tons of shopping and restaurants in and near the area as well as a great place for pictures. Our family took a picture under the antlers in the town square...it is frame worthy.
403,Town_Square50,Jun 2018 , Family,"Provo, UT ",Iconic Western Site,"Jackson Hole Town Square is a must for all who visit Jackson, Wyoming. The famous antler arch entryways are unique and no visit is complete without a picture of your group posing beneath the arch."
404,Town_Square50,Jun 2018,not available, ,Must See,Be sure to visit town square. The elk antler arches are so neat (perfect picture backdrop). The nightly gunfight in the summer is fun for the whole family.
405,Town_Square50,Mar 2019 , Couples, ,Beautiful and charming,So lovely! The skating rink inside the square was charming. The town is clean and quaint and awesome
406,Town_Square50,Jun 2018 , Family,"Buffalo, TX, ",Awesome!,We loved the four corners of the square! Each corner has arches made from antlers. So unique and great for photos.    Love this town!
407,Town_Square50,Feb 2019 , Couples,"Fredericksburg, VA ",A must see if you are visiting,The arches are something everyone visiting Jackson should see. A fun and unique part of the town of Jackson.
408,Town_Square50,Feb 2019 , Friends,"Kansas City, MO ",Go at night!,"Lights with snow cover really made this place special at night. This is a must go spot for first time visitors, and is almost impossible to miss. Make sure to walk in and see the cowboy statue!"
409,Town_Square50,Sep 2018 , Couples,"Reading, UK ",Very Pretty,"Great little town with loads of shopping and places to eat. The main square is the central attraction with antler arches at each corner, very cool.    Plenty of parking around and everything fairly close together. Would imagine this place is teeming with trendy skiers in winter."
410,Town_Square50,Jan 2019 , Family,"Charlotte, North Carolina ",Pretty,I visited Jackson Town Square in the middle of January. The square was set up as an ice skating rink and the trees still had lights in them. This was really neat and everyone there seemed to be enjoying it. People were able to ice skate during the day and into the evening. I can't ice skate because of knee problems but if I could I would have definitely been out there too.
411,Town_Square50,Feb 2019 , Solo,"Sioux City, IA ",Iconic and entertaining.,If you have ever been to Jackson then you know you can not miss the square and the antler arches. Throw in an ice skating rink and people watching and it makes for a fun time and a great photo op. Be a tourist and take a picture. Of course the shops around the square offer a wide variety of goods and services.
412,Town_Square50,Feb 2019 , Couples,"Plano, TX ","Cool vibe, quaint feel.","Lots to see and experience. Restaurants, shops and art for all tastes. Great views all around and plenty of photo ops. Would love to have spent more time there but it was way too cold for this southerner to walk around for an extended period of time. Would LOVE to go back in warmer weather."
413,Town_Square50,Feb 2019 , Couples, ,Lots of antlers,"Pretty cool, but not much to see here. Park is small and nice. We were there in February at dusk, so it was pretty cold and we did not stay long. Close to town."
414,Town_Square50,Feb 2019,not available,"Salt Lake City, UT ",Photo Opp,"If you didn’t get a photo under the antler arch, did you really even go to Jackson Hole? Jackson Square is a great photo opp location. Beautiful scenery."
415,Town_Square50,Feb 2019,not available,"Whittier, CA ",Iconic Jackson Hole,If you have your eyes open when you arrive in Jackson Hole you can’t miss the town square and the Elk horn arches at all 4 corners.
416,Town_Square50,Feb 2019 , Couples,"Los Angeles, CA ",Beautiful place to relax and enjoy Jackson Hole,Each corner of the town square has a beautiful antler arch perfect for an Instagram photo. The park itself is peaceful with great views of the mountains and wonderful public art. In the winter it's well shoveled so you can still enjoy a peaceful walk.
417,Town_Square50,Feb 2019 , Solo, ,Always charming,"Love this little town square! They have a small ice rink and skate rental. No dogs allowed inside, though."
418,Town_Square50,Feb 2019 , Friends,The Cincinnati Region ,Repeat visit,"Love this town square; something for everyone and great photo opps. Of note, the small shops are people friendly and very welcoming. Also, you need to see the antler arches at night; you will get beautiful keepsake photos."
419,Town_Square50,Jan 2019 , Couples,"Asheboro, NC ",Dog Sled Race at Jackson Town Square,"The first, ceremonial stage of the Stop-Stage Dog Sled Race sponsored by Pedigree Dog Food was held at the Town Square on January 26. A couple thousand residents and visitors made their way from pizza parlors and steak houses to witness the ceremonial start of the Pedigree Dog Food Stage-Stop Dog Sled Race in downtown Jackson. There will be a total of eight stages in different parts of Wyoming over the next week, and the race will finish here in Jackson. Tonight’s stage is a ceremonial two-mile race from Jackson to the Snow King Ski Resort. Tomorrow’s stage will be about thirty miles long. Mushers are here from several northwestern states, Canada and Alaska. The dogs were hilarious with their barking and doggie antics. There was a wonderful spirit among the spectators as well. Several Jackson residents invited Glenda to return here often, and I became acquainted with spectators from North Carolina, Virginia, and Arkansas. I even had a chat with a family from Australia. What a great way to spend a Friday night!"
420,Town_Square50,Dec 2018 , Family,"Fort Lauderdale, FL ",Beautiful & Magical,"The town square is just magical in Jackson Hole! While JH is a hunting and meat eating kind of town (I do eat meat, but it was very different than from where we live LOL), I was thrilled to learn that those Antler Arches are not poached from the elk, but collected as they drop naturally from these beautiful animals. Wonderful, magical winter wonderland!"
421,Town_Square50,Jan 2019 , Family,"Jacksonville, FL ",Very Nice area--,A lot of galleries and museums with infinite detailed history in each of them--almost in every block. There is some shopping and a host of eating places in this area as well.
422,Town_Square50,Sep 2018,not available, ,Loved shopping for pearls at Pearls by Shari,"Loved roaming around this delightful town square with friendly people, cute shops and good dining. Stayed at the Rusty Parrot which was fabulous and a great location."
423,Town_Square50,Jan 2019 , Couples,"Liberty Township, OH ",Winter Wonderland!,We enjoyed multiple visits to the square. Every time we walked through town we loved to walk past it. It was a winter wonderland. We loved watching the ice skaters and just passing through the lights and trees.
424,Town_Square50,Jan 2019 , Family, ,Tourist Must See,"Made sure we went downtown when we recently visited Jackson, WY and took a picture under one of the 4 Wild Game arches to have a fun memory of our trip! There are many shops, bars, breweries, soda shop/ice cream parlor, historic hotels & galleries to check out & many stay open late so you can enjoy the nightlife around the square! There was also an ice skating rink & skate rental in one corner. It was fabulous"
425,Town_Square50,Jan 2019 , Friends,"Las Vegas, NV, ",Nice lights,Walked around the square with friends tonight. The lights were very nice. I loved the antler arches.
426,Town_Square50,Dec 2018 , Couples,"Chattanooga, TN ",Town Square has opportunity for pictures and there is a little drug store there that has home made ice cream!,Town Square has opportunity for pictures and there is a little drug store there that has home made ice cream!  You can access most restaurants groceries shops etc from that central locatiin easily by walking. Also there is a free local in town blue bus stop on the square and you can pay them a very small fee to take you to Teton Village / ski slopes. You will need to plan any longer drives carefully because the taxi services are very expensive going out of town.
427,Town_Square50,Dec 2018 , Solo,"Brooklyn, NY ",Christmas square,The town draws you in from the temple Tetons. Winter in Jackson is hot. Many bronze sculptures are fun surprises. Check out the local history museum on Cashe street a few blocks from town square.
428,Town_Square50,Jan 2019 , Family,"Wellfleet, MA, ",Iconic Jackson,"A trip to Jackson would not be complete without having your photo taken in front of me and we’re arches. They’re right in the town square, you can’t miss them."
429,Town_Square50,Dec 2018,not available,"San Ramon, CA ",Great place to visit,Time spent eating and shopping downtown Jackson was great. Everything revolves around this square. So beautiful at Christmas with all four antler arches lit with white lights
430,Town_Square50,Dec 2018 , Couples,"Teton Village, WY ",Beautiful and fun!,We visited the town square and took a picture beneath the elk antler arches. Such a fun memory. The square itself is small but all four corners have antler arches. We came near Christmas time so the antlers were all lit up! Very fun!
431,Town_Square50,Dec 2018 , Couples,"Brisbane Region, Australia ",A demonstration of the beauty of Jackson Hole,My wife and I visited this lovely spot decorated with Christmas 🎅🎄lights decorating the 4 corner elk antler arches.    Its definitely worth visiting for any tourist visiting Jackson Hole. Best seen at night!
432,Town_Square50,Nov 2018 , Couples,"Payette, ID ",Quaint,"Jackson is such a beautiful city. So much to see and so much to do. The tree lighting ceremony in the town square (home of the antler arches) was delightful. Nice, quaint small town feel."
433,Town_Square50,Aug 2018 , Couples,"Huntington Bay, NY ",Relaxing day spent in downtown Jackson WY,"Enjoyed the shops, the views and the people; the entire experience was unique and would love to return."
434,Town_Square50,Nov 2018 , Family,"Los Angeles, CA ",Quaint Town,What is there not to like when you visit Town Square in Jackson Hole. Centrally located with great shops and restaurants surrounding it. A must visit.
