,place,date,category,place ,Tagline,Review 
175,Town_Square50,May 2020 , Family,"Salt Lake City, UT ",2 thumbs up,It's a great little town. We enjoyed walking around town. Lots of history. The elk antler arches are awesome.
176,Town_Square50,Jun 2020 , Family,"Amarillo, TX ",Always a fun stop!!,"Great shopping, restaurants, and photo opportunities!! We got some great clearance deals at several of the shops and some great lunches!"
177,Town_Square50,May 2020,not available,"Colorado Springs, CO ",Lovely town square,"My husband and I enjoyed taking a break in the square a couple of times during our visit. Well maintained and clean park with comfortable benches throughout, perfect for taking a break. And of course we took pictures of each other under the antler arches!"
178,Town_Square50,Aug 2019 , Family,Massachusetts ,Nice town square,A nice town square to walk around after a day of exploring Jackson or Teton NP  Lots of shops and places to eat
179,Town_Square50,Nov 2019,not available,"Baldivis, Australia ",Wonderful town square,This is a beautiful little town square. Each entrance has its own antler arch. The area is well shaded and the square is surrounded on all sides by the local shops. We were lucky enough to walk through it when we arrived and then the next day with overnight snow we got to see it covered with fresh snow. This is a great little central point for town.
180,Town_Square50,Jan 2020,not available,"Meridian, MS ",Antler arch in the town square,"As always the Antler Arches (all four) of them are always beautiful, summer or winter, but in the winter they have snow on them and the park is covered also. Beautiful."
181,Town_Square50,Mar 2020 , Friends, ,Beautiful town,Absolutely beautiful! My friends and I were walking around downtown checking out local shops and couldn’t help but take photo shoots around town with the breathtaking architecture!! The antler archways even light up at night! I highly recommend making a stop to check out this spot! Walking distance to great bars and stores
182,Town_Square50,Oct 2019,not available,"Onalaska, WI ",Very cool to see all of the antlers.,Very cool to see all of the antlers and get the obligatory photo. Is pretty high traffic are right in the heart of town. You won't see alot quite like it anywhere else. Local told us that every winter they get alot of antlers in the refuge but sounds like it is not allowed for you to be in possession of one in the park if you find it according to trail signs we saw. Good picnic spot either carryout right there or bring your own
183,Town_Square50,Feb 2020,not available,"New Orleans, LA ",Downtown Jackson Hotel,Good for an afternoon of browsing and taking pictures under the Elk Antler Arches. We wanted to go for drinks at the Cowboy Bar and sit on the saddle barstools but had minors with us.
184,Town_Square50,Feb 2020 , Family,"Frankfort, NY ",Cute square,The arches of elk antlers is pretty cool to see. There is a little ice skating rink there too. Very cute town to walk around.
185,Town_Square50,Feb 2020,not available, ,super fun!,it was super fun to walk around the town and look at the different shops! the town itself is pretty with lots to see.  the night life is good  grab a coffee and walk the town!
186,Town_Square50,Feb 2020,not available,"Carthage, MS ",Beautiful Town Square,"In the winter, this town square is so beautiful. Part of the square is ice skating and of course the antlers arches are on all 4 sides for great pictures. The arches and tress are lit up at night."
187,Town_Square50,Feb 2020 , Family, ,Cute Town Square !,"Lots of offerings packed in small area so it’s great for walking.  Retail, art, jewelry, restaurants, coffee shops etc. plenty to do! Hours are pretty decent to capture after skiing crowd.    Only complaint was sidewalks are treacherous. No salt used so maybe just more sanding would make a difference."
188,Town_Square50,Oct 2019,not available,"Charleston, IL ",You'll Like to Stroll and Partake,"The town square in Jackson is the place to be after you have knocked yourself out on the trails and slopes and mountain overlooks. There are so many palces to eat and drink that you will have hard choices to make. Why not do a progressive round, a bit here, a bit there, and then go back to your favorite places time and time again."
189,Town_Square50,Feb 2020 , Family,"Winston, GA ",Shopping on the square,"If you’re visiting Jackson,Wyoming for any reason make sure to spend some time on the square. Especially if you love to shop & eat!!"
190,Town_Square50,Feb 2020 , Couples,"Nashville, TN ",Nice,There was a small ice skating rink open to the public. Music playing. Lighting pretty at night. The arches of antlers are lit at night and make for a pretty picture.
191,Town_Square50,Feb 2020,not available,"Rabun Gap, GA ",Terrific day trip.,"Great place to wander, explore, eat and shop. Plenty of stores and restaurants/bars to stop at. No matter what you're looking for, you'll find it at the square. Also, make sure you explore the side streets as well!!"
192,Town_Square50,Jul 2019 , Family, ,Town square,Great place to visit and lots to do. Great wild west show in the evening. Lots of shopping. Great food.
193,Town_Square50,Jan 2020 , Friends,Alabama ,Good place for a picture,"Anyone who goes to Jackson Hole needs their photo taken at the arches. Small square, but surrounded by quaint shops to visit. I really enjoyed our visit to Jackson Hole & hope to return."
194,Town_Square50,Feb 2020,not available,"Corinth, MS ",Love Jackson,Winter is the time to visit Jackson Hole.... Not to pricey and you can get around. Some really cool stuff to do as well. Snow mobile and shoeing is a must if you don't ski....
195,Town_Square50,Jan 2020,not available, ,Always fun,"A marvelous place to vacation. Great place to ski all day , and then party at night in so many fun spots."
196,Town_Square50,Dec 2019 , Family,"Philadelphia, PA ",So fun!,"The town of Jackson is idyllic! It is beautiful, quaint, and charming. Literally looks like a movie set. It is such a neat setting with trees and mountains and lots of friendly people. One our favorite places!!"
197,Town_Square50,Jan 2020 , Friends,"The Villages, FL, ","Must see when in Jackson, WY","This is our second winter vacation to this area, and we have also visited several times in summer months. Always get pictures of the Antler Arches at the Town Square. This park is known by folks we have met from all over the country. They also have a small skating rink. Easy to find, right in the middle of town."
198,Town_Square50,Jan 2020,not available, ,Wonderful square with MANY ravens!!,"A delightful square surrounded by shopping, from reasonable prices to the extravagant! Places to eat and rest and walk comfortably! There are 4 sets of antlers which surrond the square, fyi, a must to have a photo by. Lovely!!"
199,Town_Square50,Jan 2020 , Couples,"Houston, TX ",Simply beautiful in the winter!,"The center of the town square is surrounded by the famous elk arches which are lit up with white lights, as are the many Christmas-type fir trees. There is a skating rink with colored lights underneath and music to skate by. You can rent ice skates if you are just visiting.    There are two web cams on either side of the square. People not only take pics under the arches but tell their friends and love ones to check out the web cams so they can wave from Jackson Hole!    And there are lots of wonderful, interesting shops and restaurants circling the square, including the famous Cadillac bar and the re-opened Jackson drug with an old fashioned soda fountain. A must see/stop in Jackson Hole!"
200,Town_Square50,Jan 2020,not available,"Santa Monica, CA ",No! They didn't kill them!,"The animals lose the antlers in the spring, and it's my understanding that the local Boy Scouts go out and gather them up. No killing needed.  However, Elk is on every menu in JH. No meatless Elk just yet.  So visit JH, get that picture, and send it to your vegan friends."
201,Town_Square50,Jan 2020 , Friends,"South Australia, Australia ",Another Jackson ‘must see’!,The Town Square is really the centre for tourists. Plenty of shopping opportunities available. Lots of history if you take the time. We were there over New Year and all shops were open - even New Years Day! Lovely to see skaters on the middle rink. Snow is not a problem as this area is famous for the undercover boardwalk sidewalks. Close by are some iconic places like the Cowboy Bar & Wort Hotel. Lots to see and do!
202,Town_Square50,Dec 2019,not available,"Golden, CO ",Can't miss it,"Small, quaint park, best known for its horn arches and the festive lighting during the end-of-year holidays. If you're in Jackson, you gotta see it."
203,Town_Square50,Dec 2019 , Family,"Plymouth, WI ",Love the lights at night,"The elk antler arches are so iconic. At night, they are lit up with white Christmas lights. And they flood part of the square for an ice rink. Cool atmosphere for a winter night!"
204,Town_Square50,Dec 2019 , Couples,"Hillsboro, OR ",Beautiful !!,"Beautiful, well kept central park. The elk antler arches are incredible.  Great photo op day or night.  Being here at Christmas time with the snow and Christmas lights it was extra beautiful.  You must stop by when in town."
205,Town_Square50,Dec 2019 , Family,"Orlando, FL ",Cozy and festive,"This town square is very beautiful, cozy, festive, and unique. There are lots of local restaurants and businesses around it."
206,Town_Square50,Dec 2019 , Family,"Toronto, Ontario, Canada ",Cool spot,"Love the corner live cameras, you may wave to your friends and family!  The time delay is about 20-30 seconds."
207,Town_Square50,Dec 2019 , Couples,"Anaconda, MT ",Winter wonderland,Scenic downtown that is a classic for photos and sharply decorated for the holiday season. Good memories.
208,Town_Square50,Sep 2019,not available,"Haifa, Israel, ",Jackson beating heart,"The Town Square is Jackson beating heart. In the center of the square is George Washington Memorial Park, and in the four corners of the park are four elk antler arches that attract many visitors. Mondays to Saturdays at 6 PM (between Memorial Day and Labor Day), you can watch a fun Shootout show at the Square, for free. The wild west! There are many shops and restaurants around the square and the place is always bustling with visitors, especially during the summer months."
209,Town_Square50,Sep 2019,not available,"Valhalla, NY, ",Nice historic town,We stayed in Jackson enroute from Yellowstone to Salt Lake City. We had several hours to walk around the downtown area. The Antler Arches in the town park in the middle are interesting to check out. The rest of the area is mainly shops and restaurants. Everything is quite pricey.
210,Town_Square50,Jul 2019,not available,"Inverness, UK ",Very busy resort,Spent the night in Jackson Hole on our way to Yellowstone.Went for a walk around the town square and it was well looked after and very tidy.The Antler Arch is quite spectacular.
211,Town_Square50,Sep 2019,not available,"Salt Lake City, UT ",Elk Horn Arch,"My family has had a three generation yearly visit to Jackson, Wyoming and have years of pictures under the antler arches. While it is the center of town and a must visit there are many other reasons to visit. Get out and enjoy hikes, visit the many excellent restaurants, go to the art galleries and just enjoy the outdoors."
212,Town_Square50,Aug 2019,not available, ,lunch,Perfect location right on the square. Great restaurant and we sat outside for our lunch which overlooked the arch.
213,Town_Square50,Aug 2019,not available, ,Great town!,Perfect town for any season. Lots of great bars and restaurants. Good shopping and touristy stuff! We will be back!
214,Town_Square50,Sep 2019,not available,"Toronto, Canada ","Interesting Town Square, Crowded Shops","We stopped at Jackson during a bus tour. The elk arches are interesting to look at, but the town itself is really just a crowded tourist town. Would have been ok with just a drive through."
215,Town_Square50,Sep 2019,not available,"Evergreen, CO ",Must visit in Jackson,Everyone must visit the Town Square and have their picture taken under one of the antler arches. It's a Jackson tradition. We also visited the farmers market on Saturday and it was great! Lots of good local vendors.
216,Town_Square50,Oct 2019,not available,"Fernandina Beach, FL ",Lovely western town!,"My husband and visited Jackson for 5 days about 3 weeks ago. The town square is very nice. We attended a Breast Cancer event on the square, strolled down to dine at Liberty Burger, and visited some of the nearby shops. What a lovely town!"
217,Town_Square50,Oct 2019 , Couples,"Shediac, Canada ",Shops worth exploring,There were a lot of shops in the area of town square. You will find souvenirs and garments shops of different price range. There are specialty stores where you can buy your authentic western wear. A great way to spend a couple of hours wandering about.
218,Town_Square50,Oct 2019 , Family,Missouri ,Haven!,It’s paradise for female public because lot of shops :) Nice broadwalk and great atmosphere. Entrance fee is normal price and we give 5 stars for this place.
219,Town_Square50,Sep 2019,not available, ,Jackson Hole Town Square,Quaint and lovely little town in which to enjoy a most enjoyable stroll. Lots of shopping opportunities with many restaurants from which to choose from. The Elk arches were really neat.  The visitor center was very helpful and the gentleman who gave us the information we needed was very knowledgeable.
220,Town_Square50,Oct 2019,not available,"Mattoon, IL ",lots of shopping,fun stroll through downtown jackson! lots of shops to browse and many places to eat from burgers to steak and others
221,Town_Square50,Oct 2019 , Couples,"Long Island, NY ",Quaint town square,Nice shops and places to hang out. Boardwalk is sidewalk under cover. Elk arches in corners of squares.
222,Town_Square50,Oct 2019,not available,"Milan, Italy, ","Town Square, Jackson WY","Jackson Town Square is on US-191 and it is charactrised by the four elk antler arches at its corners. Apart from the arches (which are quite interesting and unique) there is little else to see, apart from the many shops in the area, some of them very good."
223,Town_Square50,Oct 2019,not available,"Peterborough, UK ",Passing through,we were travelling from Jackson on our way to Teeton and Yellowstone.  we drove the a lovely quaint town centre and remarkable antler arches.
224,Town_Square50,Feb 2019 , Couples,"Durham, NC ",Skating and photo opportunity,Skating rink and the best place in town for photo opportunity with the antler banner. Very quaint town square.
225,Town_Square50,Sep 2019,not available,"Seattle, WA ",Great antler arch,"In the center of town ,great gathering place . On the weekend ,local artists do a QUICK DRAW, followed by an auction. Lots of people ,food and a great experience"
226,Town_Square50,Sep 2019 , Solo,"Teton Village, WY ",Town Square,"Nothing here, just lights. It's the center of town so you see all the traffic on all four sides. Whoopee. Nothing else."
227,Town_Square50,Oct 2019 , Couples,"Fairhope, AL ",Did not disappoint !,"My husband and I just spent four days in Jackson Hole and it was fabulous. The square downtown is full of great restaurants, shops, and art galleries. The antler arches make fabulous backdrops for pictures and overall, the whole little city of Jackson Hole is a great get away no matter what you’re up to at the time. There is something for everyone !"
228,Town_Square50,Sep 2019,not available,"Richmond, VA ",Unique!,"The Antler Arches are beautiful. We enjoyed our visit to the Town Square. It's a lovely space and a great place to relax and ""people watch."""
229,Town_Square50,Sep 2019,not available,Dubai ,nice little town square,Nice little town square to wonder around have drinks and meal and do your shipping ? we even saw Tyler Perry - which as a nice surprise.
230,Town_Square50,Sep 2019 , Couples,"Springfield, MA ",Something Different,"This is a nice little park whose unique feature are the four elk antler entrance arches, popular spots for picture taking. The park is surrounded by restaurants, pubs and shops that are interesting to check out. One you don’t want to miss is the Million Dollar Cowboy Bar, even if you just wander in for a few pictures."
231,Town_Square50,Oct 2019 , Friends,"Nampa, ID ",Unique sight to see,This is always fun to see when coming to Jackson Hole. A popular photo spot. Nice park area to take a break from the shopping.
232,Town_Square50,Sep 2019 , Family, ,Cool spot for pics,The arches are a great picture spot. The stores around the square are touristy and overpriced but its a good spot to pick up some souvenirs
233,Town_Square50,Jun 2019 , Friends,"Kaysville, UT ",Create your own post card experience at the town square,"The iconic antler arch decorates the town square and Is the perfect spot for a lasting memory photo or selfie.    Plan ahead and tell a friend and they can get a live web cam shot of you close to the stage coach side.    It is stroller and walking friendly and pays tribute to fallen soldiers and famous kin from Jackson Hole.    A must on any travel list for sure.    Enjoy the statues, Flag, boardwalk and more."
234,Town_Square50,Sep 2019,not available, ,Unique little town square!,One could spend an entire day just walking around in the diverse shops and restaurants! Such a magnificent combination of an entire little town using the combination of old west decor with a modern flare! Loved it!
235,Town_Square50,Sep 2019 , Friends,"Winston Salem, NC ",Tourist Attraction,"Nice little park in Jackson which have Beautiful Elk Arches on each of 4 corners of park . Surrounded by shops , Restaurants and Bars . Traffic is unbelievable around this area walking and driving ."
236,Town_Square50,Sep 2019 , Friends,"Rome, GA ",Very quaint,Square is well maintained. The elk arches are cool and appropriate for the fact Jackson is home to the National elk Refuge. Jackson is bustling and the park is a pleasant oasis
237,Town_Square50,Sep 2019,not available,"Gatesville, TX, ",Nice town squre surrounded by shops and eateries,"Decades ago my hubby and I visited Jackson Hole and we enjoyed the town square area. It was quieter then with less sourvenir shops or galleries. This time the traffic was bumper to bumper, tons of people, many more shops and eateries. All in all I liked the town square less than before. I suppose if this is your first visit it would all seem perfect."
238,Town_Square50,Aug 2019,not available,"Charlottetown, Canada, ",Cool Square,Nice town square with shed elk antler arches as the main drawing card. Get your picture or have lunch or just sit a spell.
239,Town_Square50,Sep 2019,not available, ,Antler Arches all around,Antler Arches surround a calm grassy park area with a statue and colorful flowers. An oasis in the busy town. Fun photo opportunity.
240,Town_Square50,Sep 2019,not available,"Brunswick, ME ",just walking through the town,"Great town, a very big variety of things to do and to eat. Lots of side walks and parking as well. Truly is something for everyone."
241,Town_Square50,Sep 2019,not available,"Peoria, Illinois, United States ",Tourist attraction,This is a great place to get a photo and see the town square with all the local shops and restaurants.
242,Town_Square50,Sep 2019 , Couples,"Norwich, UK ",Must see,"We had heard about the antler gates to the town square some time back. Well, today we saw them and had the obligatory selfies taken! All four gates looked identical (someone will tell me they’re not, I’m sure!), but are pretty amazing nonetheless. The park is well kept and there is a lovely memorial to the fallen in battle. We spent a nice time sitting in the afternoon sun, on the second day of Autumn watching the people go by their business. Worth stopping by and having a look if you are in the area."
243,Town_Square50,Sep 2019 , Couples,"Hillsborough, New Jersey ",Very cool town square,Jackson is a pricey place to be But the town square is free and very attractive . The farmers outdoor market was awesome .
244,Town_Square50,Sep 2019,not available,"Bossier City, LA ",Kind of cool to take your picture here but don't waste a lot of time sitting around,I guess everyone has to go see it if you are there but five minutes in and that is plenty of time to look at some antlers.
245,Town_Square50,Sep 2019 , Couples,"Little River, SC ",The elk arches,What a unique addition to Jackson Hole! Every year the boy scouts go and collect the antlers that the elks have shed and then auction them off. They’ve been doing this since the 1960’s. The arches were made from their harvests. The weather was beautiful so it made the small natural area within the arches enjoyable.There are benches inside to sit and watch as people enjoy this charming town.
246,Town_Square50,Sep 2019 , Couples,"Galesburg, MI ",Nice place,Lots of shops and restaurants here. Cute little park in the middle with lots of antlers used to make arches
247,Town_Square50,Sep 2019 , Couples,"Louisville, KY, ",Attractive downtown with a number of restaurants and some shops.,You got to love the antlers arch or whatever they call it in the center square park-one on each corner. There are plenty of restaurants to choose from and a few of shops to grab some souvenirs if you wish. It’s good for a relaxing visit after touring the nearby national parks. Free parking but it can get crowded.
248,Town_Square50,Sep 2019 , Couples,"Wheeling, WV ",Wyoming,Nice park with benches. Unique elk antler entrances. Many businesses located in the area. That’s it.
249,Town_Square50,Sep 2019 , Couples,United States ,Just a nice place,Not really a must see... but a nice place to take a rest. The downtown area has many unique places to see... but the food is fantastic at many places.
250,Town_Square50,Sep 2019,not available,"Bellevue, WA ",Love this spot!,Had a perfect day to visit the Square...farmer’s market and the art festival...I was delighted. And it was a perfect Fall day. This will be a favorite memory of my visit to Jackson.
251,Town_Square50,Sep 2019,not available,"Baldwin, NY ",beautiful part of town,"people might say im crazy but its very hard to park in the area. We got very lucky.The town is beautiful but its an extremely expensive area, and even though its fun to go in all the stores and look at the beautiful stuff, its nothing practical.Like you woudnt walk into a store and walk out with an $800 piece which is what most stores have.theres a lot of restaurants to eat at, and a few shirt shops,ice cream, but mostly high end things. Nice to look and eat"
252,Town_Square50,Sep 2019,not available,"Cape Girardeau, MO ",A lovely place,"The town square has a nice Central Park with benches for people to sit. The park is surrounded by fancy shops including a Starbuck. Of course there are pizza and ice cream place, art galleries, etc. You can spend hours here enjoying sights and people."
253,Town_Square50,Sep 2019,not available,"Albuquerque, NM ",A must-have pic for your Jackson WY visit,Your visit to Jackson isn't complete without a photo of you standing by the iconic antler arch. Enough said.
254,Town_Square50,Sep 2019,not available, ,"Tasteless, tacky, expensive shopping center",Jackson Hole is essentially a tasteless but expensive shopping center. Only go if you need lodging for Grand Teton National Park (which is excellent).
255,Town_Square50,Sep 2019,not available,Bloomington ,Antler arches,Antler arches on all 4 sides of the square if you missed the ones as you enter the airport from the plane! So interesting!
256,Town_Square50,Sep 2019,not available,"Woodlawn, IL ",Perfect for Cmas card,"This town square is very busy with tourists, but it’s charming and a must do for a few evenings. Everyone should visit and eat at the Cowboy Bar"
257,Town_Square50,Aug 2019,not available,"Omaha, NE ",Great park,Great park located within walking distance of all the downtown hotels. All the antler arches make for nice photo ops. A lot of very nice bronze statues nearby. We took our picture with Mark Twain and the Right Brothers. Don't forget Moo's ice cream shop across the street.
258,Town_Square50,Sep 2019 , Family,"Chicago, IL ",Iconic representative of the city,"The town square has 4 antelope arches at the 4 corners of the park. In the center of the park is a small statue in memory of veterans from the area. It's a small park, I think there's a daily shooting show at 6pm. There are many shops around the park area. After you take the touristy photo of the arch, you can walk around to enjoy of shops."
259,Town_Square50,Sep 2019 , Couples,"San Francisco, CA, ",Way Too Many People,"We lucked out and found a parking spot and walked around town around an hour. Even in mid September this place is too crowded. It took us 45 minutes to drive through town - crazy. Would love to stay here, but expensive. Worth a stop but be prepared."
260,Town_Square50,Sep 2019,not available,"Clearwater, FL ",Town Square,"Love Jackson Town Square! Love shopping in Jackson!! Nice souvenirs, clothing, sportswear and outdoor gear!! We found some great Labor Day sales!"
261,Town_Square50,Jun 2019,not available,"Camden, AR ",Such a unique part of the USA.,Town square park. Antlers at all four corners. Quaint shops and eateries. Beautiful with nearby mountains still snow capped. Comfortable temperatures. Cool treat in the mornings and evenings. Sitting outside when eating meals was a special treat. Much to see. Riding lift into mountains available.
